,uid,userLevel,userName,vipGrade,createtime,voteUp,downCount,content
12,1711605726,11,绅士十分滴8美若天仙亲,0,1561911859045,2,0,非常好看啊
12,1312677462,7,o夜魔侠胆怯滴,0,1561910501189,0,0,不错啊
12,932029613,52,壮烈法拉墨的太0,6,1561910327394,0,0,徐滨居然是隐藏的狠角色！你！还一直错误引导李必
12,910922738,100,zz100914,5,1561909765618,2,0,这是电影吧
12,412984155,4,猫玉西王爷80266473,2,1561909684658,0,0,才这么点评论，不真实
12,1213061354,100,点点豆豆07129,3,1561909628537,0,0,嗯很好雷佳音不愧是老演员演的角色[真棒][大拇指]然后千玺没有让我们失望哦请继续加油哦重点注意休息啊
12,556410170,37,刘卫玲44674,0,1561909358731,0,0,什么时候更新
12,1185049337,13,小白兔wal,2,1561909057864,11,0,这应该是一部里程碑式的电视剧。从长水到精短的转折。
12,1465101268,30,伍同志de多多,2,1561908651704,0,0,有看大片，电影的感觉，演员演技赞👍
12,1465101268,30,伍同志de多多,2,1561908617689,2,0,很不错，好看，精彩
12,1430380741,17,恒星1386,2,1561908213873,1,0,质感很好
12,1310962218,22,喜乐06436,4,1561908097428,3,0,造型指导黑泽和子是黑泽明的女儿[大拇指]
12,1369844661,25,行知84483,3,1561907558576,0,0,鱼肠的气质和红海行动里的佟莉很像
12,857286473,43,洲97199944,6,1561907162226,0,0,看个电视还要等4天
12,857286473,43,洲97199944,6,1561907082913,0,0,今天一天就看到这，待更新
12,857286473,43,洲97199944,6,1561907002167,0,0,每天几点更新
12,1717166789,4,滴绝地武士幻视酱,2,1561906990881,0,0,有个问题，更新是怎么回事呢？会员一周四集，非会员一周五集？我理解错了？
12,1466338392,43,A简朴de紫真,5,1561906985253,0,0,更新太慢
12,605084256,53,wxy01992,6,1561906298443,0,0,他们嘴里嚼的什么😳
12,1030686636,34,小妖冰阔落,5,1561906189324,0,0,鱼肠A 爆了
12,1334788162,28,kstzfs-007,6,1561905676326,0,0,好久没有不能快进看的电视剧了，开心
12,750811036,25,XIAOWEIZHANG41617539,3,1561905427573,3,0,当以此剧为古装剧之楷模
12,1151416339,40,俞信恩123,6,1561904905054,0,0,这部剧应该是电影的，愣是拍成了电视剧。而且还拍了六个月。晚上拍白天的戏，白天拍晚上的戏。基本没主角什么事，都是群演的天下。
12,783826068,24,喵呜64200692,3,1561904701411,0,0,我只好奇这个狗狗是啥品种
12,1037402477,24,北北丫丫1478917693637700,4,1561904377552,0,0,这是不是在陈凯歌那座长安城拍的？
12,808006787,44,怒风尘埃,6,1561904342184,0,0,姓曹的好可怜
12,1665943409,19,的同学茶饼乔,2,1561904301464,2,0,这部剧越看越上瘾啊！！古装悬疑我爱了！！
12,1023424916,100,阿申丶2017,6,1561904031085,2,0,还是蛮好看的
12,1143839817,5,franya08281492760459820115,4,1561903874142,3,0,画质好评，服化道好评，故事紧凑，但逻辑稍有矛盾，演员演技在线，从群演到主演，良心剧。
12,1348290645,26,蓉城刺客89164,0,1561903699435,1,0,演员只认识一个日本人，不过，拍得真的好，服装道具都很考究
12,1140404013,19,xhxssb,0,1561903646423,2,0,什么时候更啊  等不及了
12,1671777629,10,滴太好客x拉文德,2,1561903620470,9,0,真的，真的，真的，唯一一部没有快进，只有看不懂剧情的时候后退的剧[勉强]。连广告都看的津津有味。[花心]
12,1714621596,6,公良de桂圆君,0,1561902982926,3,0,演永王的是谁？长得挺帅的。
12,711363716,57,植翠低泡,6,1561902849593,22,0,发自肺腑的说一句这部剧拍的真好，情节除了几处为了凑时间的歌舞之外，不敢错过一桢一秒，就怕跟不上，雷佳音不用演就是戏，顶！千玺这孩子有潜力。近几年除了胡歌横屏的伪装者和琅琊榜，唯一让人欲罢不能的好戏[大拇指][大拇指][大拇指][大拇指]
12,810439627,55,夕雾之蓝,6,1561902813174,0,0,薄荷叶，就像你嚼的益达//我只想问嚼的叶子是什么，茶叶么
12,930990299,40,T寒冷的小梅,6,1561902801203,652,0,自琅琊榜后，就没有再遇到这么紧凑的剧情了，看的一字都不敢漏，从拍摄，化妆，大量群众的妆容，震撼，此剧不红，天理难容。
12,1486384381,17,东山王47685,2,1561902764234,0,0,666
12,810439627,55,夕雾之蓝,6,1561902740149,0,0,国产剧这背景音乐总是那么伤不起
12,440845568,35,燕子80036139,6,1561902602080,4,0,千玺本色出演，哈哈哈哈，李必小狐狸
12,1352584892,11,晴晴晴晴天4483,0,1561902485416,3,0,这部剧的布景太赞了
12,1365272883,10,任性de馅儿,0,1561902259672,2,0,好剧有好评[开心][开心]
12,1036966933,31,呼吸soom1478915355874752,4,1561902119966,2,0,这个夏天被易烊千玺圈粉了[花心][花心]
12,1350210306,20,喵_wu_喵,2,1561901690413,0,0,天天来看更新没！就不改一次性刷12集[啊]
12,1038261370,16,狗_狗_go,5,1561901647045,0,0,什么时候更
12,1575596104,19,匡桑的沙和尚,4,1561900987191,0,0,几乎所有主角都变窄了
12,337615102,20,09PR141,3,1561899246881,0,0,一周更新四集的意思吗
12,337158237,51,董珍a萬歲,6,1561898915360,0,0,我就想知道他们每集吃的像草一样的是什么东西
12,1198493858,11,小仙女啦啦啦0305,2,1561898779698,1,0,长源道长真真是一个嫡仙人物
12,1154612178,34,熊亚洲1494236375925741,4,1561898664054,0,0,没办法就想再刷一遍，不要倍速
12,1350980553,31,我爱胖胖球,5,1561898658871,0,0,有好几处字幕错了
12,1427860183,16,千看不厌YEE,3,1561897835869,3,0,千玺越到后面演得越好
12,1232811481,12,这货太二73216,0,1561897672532,2,0,如果国产剧都能控制在25集以内，那它的评分一般都会不错
12,1718261213,3,的极其富有罗利桑,0,1561897438796,2,0,真的好看，片尾曲也都很好听啊
12,1129893025,20,charspette40984,4,1561897341176,0,0,塔寨三杰发来贺电
12,930955349,40,wangliyunjs,6,1561896899161,1,0,小说改电影本来就是考验。剧情节奏十分紧凑，期待不断更新。
12,1147177932,58,璐易丝UOvO,2,1561896850919,2,0,好好看，今年追的第一部电视剧
12,1358956006,23,Miss木易Yang1128,0,1561896834339,3,0,好剧好看，演员易烊千玺，优秀❤️
12,1431526806,11,wxd7512,2,1561896512160,0,0,明天更不更新啊？
12,1499339095,5,fay19871215,2,1561895960447,0,0,这锤子怎么保持挂在脖子上的？
12,1033753196,43,guying5325,5,1561895920463,0,0,好演员
12,1151756410,49,青松大人39088404,6,1561895558612,1,0,好剧
12,1205905197,100,Happinessraise,6,1561895549550,0,0,还不更新吗？好想看13集[花心][花心][花心][花心][花心][花心][花心][花心][花心][花心][花心][花心][花心][花心][花心][花心][花心][花心][花心][花心][花心][花心][爱心][爱心][爱心][爱心][爱心][爱心][爱心][爱心][爱心][爱心][爱心][爱心][爱心][爱心][爱心][爱心][爱心][爱心][爱心][爱心][爱心][爱心][爱心]
12,1407522977,8,丽8557909081,2,1561893855972,2,0,怎么还没更新呢？坐等李必上线
12,1205125626,30,晴安好96,4,1561893704195,4,0,千玺就是优秀，这部戏真的良心之作，演员都好，细节也超好
12,1062306118,21,lithuhu,2,1561893405117,3,0,这么好的剧居然没有主推[疑问]
12,1537918088,13,蓝莓果酱199843540936,2,1561892829543,11,0,就很喜欢，是为着千玺宝贝来看的，千玺从不会让我们失望，也给我们震撼，其他演员也超好，这部剧的制作也真的没话说，超级棒
12,1121495541,35,小满11973,5,1561891649807,0,0,以前挺喜欢周一围的，现在看感觉好油腻哦
12,1407944871,23,Koala4x,4,1561891421094,0,0,这个封面哈哈哈哈哈
12,1014398560,37,无情即佛心,6,1561891166672,0,0,求更新，会员也要等吗？
12,1045700734,33,shsw_zx,6,1561891110845,0,0,很多人看这剧看的是外表什么服饰，道具，表演。深意不看吗？
12,382649976,76,cgl1011,6,1561890380331,5,0,越看越精彩，越看越着急，都是演技派演员，很久没看过这么连贯的电视剧了，还有电影的视感也是好评。
12,1366535011,36,夜魅的光,4,1561889526542,26,1,最初看预告，只想着就是一部所有人想尽办法破坏敌人计划，把坏人打出去的剧，看到中间才慢慢发现，每个人都有自己的私心，崔器，闻染，永王，何监，程参等等，这些私心可悯又可气
12,997470969,21,chenhui01020357879,4,1561888699070,1,0,优秀的剧
12,1032810598,40,文卓1478675697688649,6,1561888354353,0,0,我只想问嚼的叶子是什么，茶叶么
12,1110312785,14,雄壮的桃子x,3,1561887569011,4,0,易烊千玺 雷佳音我都爱
12,1185932500,26,66666王小,5,1561887459935,0,0,礼拜六礼拜天不更新？
12,444633754,33,Anna雲公主,5,1561887412157,3,0,好剧！好剧！[稀饭][稀饭]易烊千玺作为新人表演真的不错[稀饭][稀饭]
12,1110312785,14,雄壮的桃子x,3,1561887402704,2,0,四字弟弟演技炸裂
12,1110312785,14,雄壮的桃子x,3,1561887379315,2,0,看不够啊，电影既视感
12,1110312785,14,雄壮的桃子x,3,1561887365876,1,0,求日更
12,1545593806,25,m和睦的惩罚者,3,1561886693285,1,0,周四考完周四更，不要太贴心好的嘛！大爱！
12,498670104,45,zu1016,6,1561886456833,0,0,//为什么这些人打架不累？你不问问球员踢一场90分钟的球为何不累？这里是一天24小时的戏，真费体力的打戏也就半个小时。
12,1396691993,21,小猫的家家99,4,1561886280848,0,0,我真的希望狼人得逞
12,1374652712,35,郏x立秋70831,3,1561884184554,0,0,我天，这也太帅了点
12,815614946,28,13943429618ghj,3,1561883751208,4,0,不看别的评论！这是唯一一部让我看了又看的网剧！！！顶！
12,1187148157,22,小个子0720,3,1561883331818,0,0,等更新
12,1051424510,16,Winka29228,2,1561881835535,0,0,吃薄荷是什么，
12,1021901735,47,lesing缺,6,1561881504948,0,0,一直吃的绿色是薄荷
12,1193714226,13,刘晓丽55037,2,1561881189152,1,1,一直吃的绿色的是什么啊
12,1079717081,6,徐雪英1483080818940579,3,1561881186387,0,0,雷大头比四字弟弟高好多哦……才发现
12,1190107402,37,dandan890120,3,1561880960462,5,0,希望今后能多出一些这样的电视剧，不拖拉剧情，这才是良心剧！
12,1187702293,34,晓远11,4,1561880860632,0,0,为什么这些人打架不累？
12,1463712353,27,勿忘初心绿灯,5,1561880800676,5,0,这部剧的评论跟其他局的评论风格截然不同。各种服道化夸奖，各种制作精良，都太专业了！！！！！！！！！
12,1081529871,29,朱大陷,4,1561880615048,1,0,就这么要看完了  要等了
12,1177812709,14,长安时节,2,1561880496152,2,0,非常好的剧，希望得到大家的赏识
12,735066731,57,charlottemaple,5,1561879441670,0,0,我好喜欢东宫右卫率
12,954924452,41,淘宝屋顶,6,1561879342640,0,0,看着挺好看，却没有看下去的动力。
12,778280090,61,楼兰的每天,6,1561878841541,0,2,演员拖累剧情，可惜了[吐]
12,1716522714,7,1贫乏的t咖啡极,0,1561878786914,54,0,故事紧凑，逻辑严密，环环相扣，追剧都追得一气呵成，欲罢不能，还能够涨姿势。
12,1328092222,48,老赵24005,6,1561878680919,2,0,狼卫太傻太天真，各种被利用
12,345001284,11,绽放花儿23088509,2,1561876910107,2,0,超级好看呀
12,1008513444,32,独善其身z18603,3,1561876905503,46,0,这也太良心剧了吧，大爱雷佳音和易烊千玺，配角们也都演的很出色，好剧
12,500292070,19,醉挽笑月,5,1561876783605,71,1,看了这么多年的电影、电视，第一次评论。高质量的电视剧，无论时画面、道具、情节，都完全不输美剧、这样的电视剧应该多一些。
12,841624288,42,别动我的优酷,6,1561876454292,2,0,我是个罪人，为我的cp大脑感到抱歉
12,841624288,42,别动我的优酷,6,1561876388776,4,0,"妈妈呀！！！我感觉自己已经饥不择食了，居然嗑起了毕竟（必敬）cp,但是想想好带感哟[稀饭][稀饭][稀饭]"
12,1194028758,47,其实我们都难得,0,1561876183758,5,0,说看不懂的...是不是没读过书啊[黑线]不是讽刺啊，就是觉得这里的文言文读过初中应该都可以看懂吧
12,1366928563,27,英子23290,3,1561875778535,0,0,全部更新完就好了
12,1366928563,27,英子23290,3,1561875760533,2,0,看完了，不够看
12,1233423095,9,夏雨霏飞,3,1561875646226,3,0,[真棒][真棒]很赞，很好看，扣人心弦
12,1716174898,3,koi呀,2,1561874930358,4,0,"太棒啦 熙攘繁盛，光耀万年。再也没有比长安城更伟大的城市了Σ(๛д๛)今日只想守护长安的李必""靖安司司丞李必，不是唐李是隋李，六世高门望族，七岁与张九龄称友，九岁与太子交，何监为师，王将军为友，随高人修道十年，常与圣人辩道法真意”"
12,1716888554,7,同志美如冠玉灰常0芥末滴,2,1561874692003,4,0,年度最好看的大戏，太给力了
12,1716888554,7,同志美如冠玉灰常0芥末滴,2,1561874636305,2,0,快更新吧！期待，期待，期待
12,1220096324,30,地瓜的烊烊,5,1561874509524,4,0,太好看啦！！！长源哥哥加油
12,1718323797,9,乖摸摸头xin,2,1561874362301,68,1,期待了很久为看千玺，看了之后觉得处处是惊喜，雷佳音和易烊千玺的组合真的很赞。看第一集时有点懵，但是越看越上瘾，不得不说真的良心剧组，演员在线，亲身实践，周一围真的给我惊喜了。
12,1447931269,100,樊利亚,4,1561874336237,3,0,靠，拍的真好
12,1185048208,38,子耀29996,0,1561874222241,0,0,嚼薄荷叶跟嚼槟榔一样
12,734560083,7,大连高霸特殊车辆,2,1561874126967,1,0,大唐的骄傲 你们理解吗  大唐初期重武 大唐就应该 武人牛牛的
12,1534171217,100,先进de威震天酱,2,1561873042248,2,0,太好看了
12,1376661255,35,爱t罗伊,5,1561872370397,3,0,惊心动魄！片子不错，推荐给身边同事朋友看了！
12,1715257833,7,阿甘灰常的u暧昧酱,2,1561871718950,0,0,来看甲的，真心不错
12,1131783972,25,一样d爱,4,1561870381449,0,0,为啥还不更新啊
12,1186509444,18,追艺路上,2,1561870135428,2,0,刚开始看不大下去，越看越想知道后面的故事，支持千玺
12,503382167,70,RENFFYAN,6,1561870023273,2,0,这是个用心的好剧。
12,1399578846,15,徒道奈何,2,1561869796091,13,0,有些人屁股决定脑袋，只要是流量演，那就是差，前些年我也被小鲜肉辣过眼睛，但，事实上，本剧里，人家演的可圈可点。真让我说谁演技好，雷佳音全剧表情眼神没变过，胜在打戏精彩，周一围演的还是丁修。反而是，曹破延演的最好。
12,1045826367,34,燕尾蝶255,4,1561869610824,3,0,一口气看完十二集了，期待下周四更新，很不错的一部剧，演员演技都还不错，关键一共25集很给力，不像其他剧动不动就注水来个七八十集的，追剧追剧……
12,851530133,31,王小明97571,3,1561869469106,0,0,更新太慢了！会员跟非会员更新速度差不多。。。
12,599930400,54,四季的郑娜,5,1561869456053,0,0,为什么闻染会这么傻b，非要说的这么破，让做事的人都破败了信念
12,1480018950,10,Bunny68203,3,1561869066327,0,0,求加更！n
12,599930400,54,四季的郑娜,5,1561869000245,0,0,闻染是不是有点白痴，激怒那个女的
12,1142853629,12,安静的畅想世界,0,1561868926330,1,0,看了评论才来看的剧，抱着会看着尴尬的想法，结果看完也没有觉得演技让人尴尬啊，觉得也也挺入戏的
12,1079859782,40,暖心恰恰爱,6,1561868788011,2,0,整部剧节奏紧凑，环环相扣！值得追！看的时候得平心静气，只感慨拍这部剧的人太厉害了！用心之作！
12,366993582,8,素人隐画,2,1561867827948,2,0,四字弟弟太优秀了，少年未来不可限量！
12,356567938,36,湫荳,6,1561865962018,3,0,小胖丫头好可爱啊~~~~~~
12,1010247149,61,火热桑v盖洛普1的,6,1561865478593,2,0,这个剧易烊千玺真的很意外 看了并不觉得跳戏 挺好的
12,1228509760,37,PhilZ46282,5,1561864239120,0,0,讲真 让我胡 来演 可能又是一部史诗级，这完全是雷佳音 带着演啊！
12,698230820,27,soryuden001,6,1561863854965,1,0,导演是曹盾，难怪古装剧画面有保障啊
12,982513056,100,昨天卡桑,5,1561863061189,0,0,闻染到底死了没有最后
12,1032609671,28,晨晨的橘色蒲公英,4,1561861651525,126,0,我觉得千玺在17岁这个年纪能演出这样的剧已经很不错了，可以说真的是少年可期，加油，
12,1674276663,12,步履不停06910,3,1561861593087,3,0,烧脑 且演技在线 良心好剧 好评[太开心]
12,1473043617,21,pussycat猫儿,0,1561860799472,0,0,什么时候更新啊
12,1169076127,10,黑牛玉米,2,1561860383749,0,0,很好看啊不知道为什么没什么人评论？
12,534504104,51,幸福的汤司令,6,1561860308283,2,0,我很少评论的，但是这部剧我不得不给个好评！
12,1206821011,6,城堡小猫,0,1561859773044,19,0,我是湖南人，看见他们一个个嚼吧嚼吧那样，就想到槟榔。若能改邪归正都改嚼薄荷叶，那该多好啊。。。呵呵😊
12,1608664127,6,严厉亲x滴宇智波极度,0,1561859746438,0,0, 特意开了会员，
12,792299084,7,竹千代木一,0,1561859437678,1,0,不够看啊
12,1103642157,51,peter_hmzh,5,1561859159493,2,0,画面感比较强，不错
12,1713197251,49,璐畔阳光X,0,1561859136985,12,0,一口气就看了9集啊，真的是非常精彩的❤️。尤其戴上耳机之后，感觉就像是看电影的效果一样，里面的布局，服装，各方面的排布都是精心设计的，演员都是老戏骨，演技爆棚啊！这剧是我看的所有古装中最喜欢的，画质方面很清晰，演员都回到位。后辈千玺也跟上了前辈的步伐，可以说十七岁的千玺演技也是一直在进步的，以前一直觉得他唱歌方面，舞蹈方面很有天赋，不太适合演戏的，但是看了他的几部剧后，尤其《长安十二时辰》发现他的演技已经进步很多了，现在又在中戏学习，演技方面会越来越好的。《长安十二时辰》是真的很精彩，里面的打戏各方面都很吸引眼球，而且是一部不需要加速看的古装剧，里面可以顺便学学文言文，对语文很有帮助的哦❤️
12,1116159730,40,flyingcloud87,6,1561858770592,63,0,这部剧这么的好，易烊千玺的人设也很符合，就是一个高冷聪明的男孩儿。你们这些人却说人家苦瓜脸，怎么一个高冷的人设要天天笑吗？不爱看滚蛋，没人求着你昂
12,1321985729,15,julietKatherine,6,1561858233204,4,0,是不是还有第二季啊？之前不是说60集吗？感觉按这个进度25集应该完不了，但是60集也有点太长了
12,1716888554,7,同志美如冠玉灰常0芥末滴,2,1561858041816,1,0,曹导真的太棒啦！
12,1716888554,7,同志美如冠玉灰常0芥末滴,2,1561857986608,0,0,演员演技好到爆表。赵巍的徐宾太棒啦！
12,1716888554,7,同志美如冠玉灰常0芥末滴,2,1561857879346,1,0,快快更新吧！这么好的电视剧看不够哇！
12,1061282874,36,夕若555,5,1561857665862,29,0,喜欢你的集数。和你的拍摄。色调很舒服。不像偶像剧脸都刷白墙一样。[爱心][玫瑰]
12,432501322,24,尤冠程,4,1561856220833,0,0,bu
12,418978982,65,zrangela,6,1561854703747,1,0,质感不错(*๓´╰╯`๓)
12,1234314424,28,夏xyzb,3,1561854190341,0,0,用心做出来的剧，不会让人失望，未来可期的千玺加油(ง •̀_•́)ง
12,1347190126,34,北辰君上-,4,1561854007425,1,0,制作非常好，剧组良心了！各个演员都挺棒的，有血有肉
12,1527335159,1,严厉de小小桑,0,1561851175132,1,0,很好
12,796293301,22,tantantl1,4,1561850560084,1,0,好剧
12,1371627031,100,幽兰25007,3,1561850109913,2,0,好剧
12,677881410,39,Xiaomabenteng_677881410,5,1561848651435,0,0,制作精良！各个方面！
12,1113157543,44,君若只如初见,6,1561848223978,134,0,雷佳音表现得超出彩，把一个外表狠辣无情野蛮凶悍内心却柔软细腻的张小敬演活了，彻底颠覆以往对他的评价，这次选演员选对啦，选剧本也选对啦，长安十二时辰是除我看过琅琊榜之后最棒的古装剧，各个配角也是尽心尽力出演，实在难得，服饰妆容尽和人意，摄影一流跟天盛长歌有的一比
12,1503647116,20,A过于谦虚光光的,0,1561846695502,2,0,好
12,771361622,31,toma1900,4,1561841955190,1,0,又来看了
12,817292002,100,MrLonely48331467,2,1561837697935,0,0,打分好低，但我看着市一部不错得剧，明天就去看小说。
12,749554110,30,ykapp_lcsntlpc,6,1561837041280,24,0,演员包括群演都很到位，制作很精良，细节处理的也很好，剧情节奏不拖泥带水，真是好剧啊
12,437159826,47,匹克杜,6,1561834629699,0,0,怎么更新的啊？两天没有新的
12,618046151,74,pkwuyan,6,1561833367805,1,0,就是有点费薄荷叶
12,846148303,58,--百事可乐--,6,1561833140401,35,0,优酷独播的剧都还不错，质量可以，有内涵。使徒行者，白夜行，长安十二时辰，天坑猎鹰都还可以，至少剧情演员都不错
12,1566514748,17,相知相惜14123,0,1561830847349,0,0,什么时候更新啊，等的花儿都谢了。
12,1049915132,18,xuan83285,4,1561830183166,2,0,郭将军传话那段是经典
12,350569784,40,ErosCheung,6,1561830093027,35,3,场景不错，剧情拖沓，刑侦政斗情节不合理，演员演技都有些太用力，不自然，还是在演而不是看起来就是剧情中那个角色。
12,709213640,47,fylg1,7,1561829987777,1,0,杨宇霆
12,1226300887,12,炒混沌挺好吃,0,1561829087416,2,0,真的，爱了，
12,1091029518,60,鲲博电子科技,6,1561828203560,2,0,看完了，没了
12,1394278490,8,巫v特里萨,2,1561828110406,5,0,一口气看完12集，没看过瘾。
12,1394278490,8,巫v特里萨,2,1561828065201,1,0,真棒👍
12,1711820200,11,激动沉香太de8,2,1561827655908,32,0,还得等到下周啊，这部剧真的好好看，想来不爱看古装剧的我一口气看了12集，想看到更多千玺的镜头[太开心][爱心][haha]
12,1718164723,9,弹钢琴的猫007,2,1561827642539,3,0,超喜欢这部剧的啊 电影质感  良心之作 剧情人物栩栩如生 我要跟更多人安利
12,765572734,31,eric201541914025,5,1561826967213,3,0,难得一见好本子！古时人！现在事！[大拇指][大拇指]
12,1061570314,8,双鱼植树,2,1561826803062,1,0,道具服装考究，难得的是群演也很认真，表情很到位，有点HBO的味道
12,1205096129,19,四叶草的秋季,0,1561826442318,0,0,GOOD
12,1153833326,50,青8489126562,4,1561826006018,3,0,画面简直电影般的视角，场面布景十分精致还原，完美呈现了大唐盛世之繁荣，而繁荣之下，官场的勾心斗角也展现得淋漓尽致，没有强行尬主角关环，剧情改动也很贴合逻辑，主角配角演技也全程在线，就连群众的服装，妆容都细致妥帖，又是一部国产好剧！
12,856478331,11,陌上人如玉李健哥哥,4,1561825869373,1,0,质感超棒！厉害
12,1376763913,18,充电拖拉机,3,1561825631047,0,0,剧情没看明白
12,1129029054,5,柔弱同学_赫德森T的,6,1561825227109,1,0,好看
12,1428324825,38,李超同学00,4,1561824995617,0,0,飞起来
12,1428324825,38,李超同学00,4,1561824961984,1,0,通宵
12,1177812709,14,长安时节,2,1561824682181,36,0,今天看了赵魏老师的微博，才知道小十二原来也有人黑有人质疑。这么优秀的剧应该让更多的人知道了解才是。这部剧不容易，这么久才播出，导演和制作团队还有演员的付出都应该得到相应的回报。曹盾导演说他不知道网上对小十二如何评价，（没微博的男人）不过我相信大多数人都是明眼人，是金子总会发光，闪亮众人。
12,810496067,29,当爱已成往事71921218,0,1561824439066,1,0,看着没什么兴趣
12,1595854833,5,zyd83065452,0,1561824000963,118,2,这么好看的剧为什么压了那么久？那些粗糙乱造的网剧倒是播的快！你看里面的道具和演员的演技都是精了心的。越来越好看
12,717007808,41,许方成52980216,5,1561823664933,0,0,666
12,1569862752,19,m古怪de布兰琪,3,1561823422526,0,2,有人说演技都很过关？
12,709961998,48,晕晕的AMUMU,5,1561823226711,0,0,一口气看完，推荐给朋友，真的很好看，实力派吃货雷佳音
12,1114896964,57,0快速de樱花,6,1561823212453,2,0,好看
12,1492946753,12,wellsoullikeyou,0,1561822835838,0,0,剧情好紧张，人物有趣，喜欢!就是要等更新
12,1715393894,10,老易的小甜甜,3,1561822791872,15,0,首先说这部剧真的不错，细节处理很好，很用心，演员演技都在线，情节也不拖泥带水。其实是为了易烊千玺追这部剧的，17岁的他有这样的表现已经很优秀了，这样的天赋和领悟不是谁都有的，前途无量，加油！
12,1606789368,18,永远丶su,0,1561822748111,0,0,十二集看完了[惊哭][惊哭][惊哭]
12,1374286133,26,中易48593,3,1561822665466,2,0,其他不说，这剧要是在国内电视剧不获最佳美术奖说不过去
12,1484703755,13,闻w小妖,2,1561822442710,1,0,问一个老板，走过来直接问了好像知道老板知道了一样，平时过来问人都是这样说，请问老板这几个字，演戏有上差
12,760872398,21,杜思念28952047,3,1561822382112,0,0,会员每周四集，非会员每周五集，两者相隔7集。问：非会员几周可以追上会员？？
12,954456525,60,奔波儿灞81925,6,1561822374133,5,0,前12集一口气看完，制作精良，节奏不拖拉，无论群众演员还是演员演技都在线，打斗场面精彩，某些名词还特意注释，良心剧
12,1718101404,45,君闭月羞花十分-鬼鬼滴,0,1561822356637,1,0,这剧很棒了，大制作每一帧都很喜欢
