,uid,userLevel,userName,vipGrade,createtime,voteUp,downCount,content
16,1216654881,49,小仙女不xian,5,1563109772724,3,0,莫名觉得千玺弟弟，骑马好帅啊٩(๑´3｀๑)۶
16,1537655101,29,石戴语萱,4,1563105516206,1,0,崔器就是个怂人
16,1475394463,10,明显亲1邦德x的,2,1563105378852,5,0,徐宾是个傻子吗，，都已经怀疑了还要跟着人家去，还是单独，，
16,753567728,53,幸福de飞,5,1563105191983,0,0,[赞]
16,1727929709,6,仙人de桑马蒂尔达,2,1563104851984,1,0,张都尉是忘了自己有刀吗[泪]
16,825805488,22,信阳龙哥,2,1563104715151,4,0,那个李必谁演的，跟个死人似的……服了
16,1537655101,29,石戴语萱,4,1563103818217,2,0,16和17集怎么接不上啊
16,958756927,42,Mr_liangshao,6,1563102850285,0,0,这一天天的过的真慢😂感觉一个月过去了😂
16,1494064308,16,陈瑶61415,2,1563102683394,0,0,想在电视上看弹幕
16,1494064308,16,陈瑶61415,2,1563102637411,0,0,怎么有弹幕
16,1240249287,20,Donna0808,3,1563098449508,2,0,3车15桶？
16,462733852,28,伞下的幸福L,5,1563097386925,35,0,有点搞笑哦，靖安司传令的那个家伙是去小日本留学回来的吗？一口流利的日本汉语[无语]
16,1577588082,9,tb0646610_2012,2,1563096617990,0,0,宝强绿走一波
16,1369690834,17,你是易二,4,1563096446617,1,0,认真做事情的人值得尊重
16,1060793432,19,zy56514627,2,1563095073565,1,0,良心剧 真的给力  电视剧拍出来电影的感觉
16,324612046,100,洋洋№老实人,5,1563094655769,2,0,张小敬为什么不让马脱缰然后只骑着马追。。速度更快。也不会带着石油满街跑那么危险。。答：这么设计观众不爱看。[搞笑]
16,367051452,56,桑滴李维斯谭,2,1563093429796,0,0, 徐宾别真的死了吧
16,1554457908,16,chensunnyss,0,1563092067166,3,0,张都尉，你刀是干嘛用的？
16,1722358215,9,滴拜耳a过于耿直,2,1563092009574,0,0,VIP为什么只能跳进看？
16,1732544310,5,比顿灰常de8自强同志,2,1563091530698,1,0,不是说望楼可以射箭吗？
16,1554457908,16,chensunnyss,0,1563091329048,15,0,张都尉，我想问你 ，你的刀为啥不用？你驾马车为啥不嘞马缰绳停车？为啥不直走要拐弯翻车？
16,1589709237,61,的1极新奇沉香,3,1563091240585,0,0,这和射箭有区别吗
16,1725048251,1,滴泽卡赖亚弗莉达亲,0,1563087853393,2,0,16集到17之间是不是断片了？？徐主事不是死了麽  17集怎么又冒出来了    而且17集一开始张都卫就出现了   他不是落水失踪了麽！
16,1217384683,29,o适量的耶达,5,1563086885081,0,0,一剑射死不就完了
16,1164493158,40,蓝色天空31号,5,1563086650826,0,1,小说我看了，然而。。。有点慢啊
16,765966213,10,wu228,2,1563085306507,14,0,为什么望楼的弓弩手不直接射死大张旗鼓在街上横冲直撞的狼卫？他们不是一直能追踪到狼卫的位置吗？…还要张小敬强披猪脚光环一条一条街的追！额，不能释怀。看到这里我实在忍不住吐槽了，一直在击鼓[汗]，后面的旅愤军也是一直在打酱油的，看的人都抓急，一直追着敌人屁股跑就没发挥过作用，结果还被无辜炸死了那么多…也是醉了
16,1052824873,32,ML锅锅,3,1563081421522,1,0,这些跪的人，你们能得，你们去呀
16,1052294496,27,tb618040674,0,1563081314408,1,0,剧情一般，个别演员眼里拙劣
16,999114459,18,薏米穷街ss,0,1563080981183,0,0,16集跟17集
16,748638311,39,钢丝架架,5,1563079165703,1,1,徐兵居然这样领了盒饭。。。。。。。
16,1320999538,20,大漠丿孤烟,3,1563078723963,0,0,辉叔居然喊救命了！被人踩了哈哈
16,1045194042,11,易嘉爱是我女神有什么问题吗,0,1563077899740,0,0,我就好奇，望楼不射箭？？？？
16,813971453,44,磊磊不累14195027,0,1563076716863,3,0,这部这么火，是不是下部就是长安十二年了？
16,410202829,9,Jason翔翔,1,1563075092898,0,0,更新，有点慢哦
16,1203287926,29,雾里观影,2,1563073411107,5,0,姓徐的你可真是笨死的，既然怀疑人家还跟他去没人的地方。
16,1500838233,17,芳菲96590,2,1563071365226,3,0,千玺太棒了
16,498681729,29,贵贵的电影院,2,1563070508617,1,0,更新太慢了
16,1473120249,11,勉强的帕特里奇桑,3,1563068049457,1,2,徐斌彪子似的
16,558559345,36,哎呀真好看个神啊,0,1563064833071,2,0,这游戏画面做的真漂亮
16,503794762,24,甜橙谭谭,4,1563064138473,1,1,我就想知道上元节为啥天气这么热
16,586584321,49,小鱼妹75,6,1563062886670,1,0,现在周一 周四各更三集，一周共六集
16,588655996,100,子煜空间,0,1563053292488,8,1,为什么没人评论鱼肠呢？这么优秀的演员！又漂亮，演技又好！这部剧里面女演员就她最好了，那个王大千金，我只能呵呵了
16,501115077,8,xuetianlinlin,3,1563051899589,2,0,太阳落下山，秋虫儿闹声喧
16,1733630216,6,花飞非常dev充沛酱,2,1563034618939,0,0,认真做事情的人值得尊重
16,1692635566,6,甬柯,2,1563032829421,0,0,更新太慢，一周至少得八集，要不一天两集更新
16,371573991,37,耍酷馒头,5,1563032484650,2,0,真是一部牛逼大作啊
16,1053589515,100,极限时空,3,1563029414398,0,0,有刀为何不用
16,1212218343,42,愤怒的小空,5,1563028963578,2,0,徐宾真是棒槌
16,832311932,41,dykln66116,6,1563026020679,2,0,良心国剧，真诚推荐！
16,927791268,48,赤赤小姐,6,1563025088773,2,1,难得良心大作，国产剧不要神剧
16,1727695797,8,同志谦让极其1雨水de,2,1563024587449,0,0,更新太慢了，一周才一天更新，不合适
16,713261006,39,朝琎,5,1563022315933,0,0,三女，繁体字是姦，内奸之意，要拆字就用点心，谁会拿名字里的三点水做代号，何况姚汝能此刻在外面，根本不知道三百桶的事，陆三是龙波的人，檀棋就更不可能，庞灵就没离开过那个计时器，怎么告密
16,501609929,34,laraxi,5,1563021477163,1,0,闻染跳井那会，披肩一会有一会没的
16,1302798909,46,演播室郭然,6,1563020166119,0,0,姚汝能坏坏的神情像黄教主
16,1457242686,13,柠檬色秋干,2,1563018979082,0,0,这更新速度太慢了，而且容易忘记 ，要不一天一集那种？？？
16,1427053625,10,意外的雪景,0,1563017710017,1,0,那个传信的，是不是韩狗子
16,684337027,47,草莓灬冰激淋,6,1563015668022,2,0,偌大静安寺 就张都尉一人能打？真是气人！
16,1222574213,36,淋宁淋宁,4,1563015327929,0,1,太好看了
16,1635267227,16,clam_zhou,0,1563015049253,1,0,在这儿紧的催不要用张小敬，那他们倒是说说用谁了
16,846135775,43,汪积庆,6,1563014145636,2,0,徐主事就这么挂了？
16,1009610484,48,露宝178100,3,1563011868518,0,0,小李必，给我躲远点儿[吐舌][吐舌]
16,1720081605,1,de翠柔霍尔特桑,2,1563010356135,2,0,什么陆三，舌头打卷了吧
16,475382883,21,冷血欧阳49833,2,1563008678557,1,0,陆三说话令我想起天地英雄里面的那个遣唐使
16,952080191,28,她去海南了额,6,1563007635846,0,0,王姑娘丑了点
16,1222387181,19,L神经病xm,3,1563003951441,0,0,一共48集？会不会太多了
16,1126020423,22,qxmoon54,4,1563003786497,1,0,我没记错的话之前应该是说全集21集吧？怎么突然48集了？
16,1103436020,41,果心gosin,6,1563002496846,29,0,易烊千玺算不得鲜肉了，长得不是很妖孽那种，只能说是年轻一代的少年演员，能歌善舞又去科班学演戏，这部是上大学前的吧，前途无量啊，什么菜什么饭的才是流量鲜肉吧
16,1103436020,41,果心gosin,6,1563002165049,2,0,许鹤子这个让我想起来芙蓉姐姐
16,1195451035,22,无欲则刚-宝,3,1563001699085,2,0,陆三一口港普，好出戏啊[勉强]
16,1150170425,31,Thranduils,4,1563001368000,6,0,徐宾就这么死了？？？知道他可能是奸细，还要跟着他去一个没有人的地方，是不是傻。直接派几个人把他手里东西夺过来一看不就知道了。唉！伤心💔
16,1330406566,3,西征旧部,0,1563001216782,0,0,刺客信条长安 动作完美呈现
16,362471454,17,桃花颂词,3,1562999636438,0,0,这个剧题材真的无敌
16,1040867547,27,有一天我们都会老26671,4,1562998118857,0,0,这个元载真可恨
16,354896855,18,jy26319029,3,1562997383808,0,0,这个元也太丑了 实在看不过去
16,823589558,41,刘先生瑶小姐,6,1562996799520,0,0,[赞][赞][赞]好剧，故事跌宕起伏，人物刻画很生动，故事中穿插故事，人物穿插人物，转折中带有转折，不错。希望把不要像破冰一样[解树震惊了][解树震惊了]烂尾就好。
16,1051124808,5,清间皓7512,0,1562995886878,5,0,右相脑子太好使了
16,1132324332,50,吼吼哈嘿地老虎,5,1562995863849,0,0,张小敬这一天得跑十万步了吧，能量不得了啊[泪]
16,532899952,24,林熙妈妈,3,1562994693832,5,0,这么多的托是哪来的。把这剧夸的都上天了
16,591816682,18,平凡山人啊,2,1562993586876,0,0,明明能一刀解决的人，非要赤手空拳的打一场
16,323376574,41,该用户很漂亮,6,1562993452592,3,0,檀琪好像张柏芝啊
16,323376574,41,该用户很漂亮,6,1562992423822,0,0,喜欢檀琪
16,1571416717,21,春暖花开36839,0,1562991254259,0,0,他们都不错，就是更新太慢了
16,1723090443,24,干洗店一把手,2,1562991123312,1,0,好剧，良心之作！
16,1681289853,6,亲红糖海格力斯的,0,1562989703741,1,0,108集可好
16,558747394,19,妞_smile,0,1562981100612,5,0,好好看剧 别做杠精 谁也不能完美，不管演员导演还是我们，所以大家多点包容理解之心，就好好看一部好剧吧
16,1408868555,58,美不美不光看外表,0,1562980817858,2,0,慢。。。。的让人窒息
16,1724422721,10,杜鹃格外滴y婀娜多姿同学,2,1562980386242,1,0,一周更新一次，看了前面等那么久，也没兴趣等下周了，幸好还没充VIP
16,1406009925,44,1格外有活力康斯坦斯de,5,1562978209676,0,0,为啥突然变成48集了？
16,799783598,32,赵_默笙,5,1562975700501,0,0,12时辰那么久。太夸张
16,799783598,32,赵_默笙,5,1562975654472,1,0,20集增加到48集，回忆给我弄28集出来？不追了不追了
16,1192268641,4,发条橙59998,0,1562974748669,2,0,直接断掉，接不起上一集。瞬间好感全无
16,478650141,8,o爽朗de天启,2,1562971711880,3,0,这个王姑娘好一脸假体呀，不忍直视啊
16,1729567446,4,元本非凡,0,1562953140174,2,0,高知商的徐主事竟然这样去送死 太假了
16,467329746,100,D_Kou,6,1562952373813,3,0,我可以接受剧集多，但参考了HBO神奇铁王座的教训，希望片方理性面对！别为了延长而延长，虎头蛇尾比一开始就是烂片更伤人。质量和口碑才成就了经典，总之，千万别烂尾…千万别烂…千万别…千万…
16,1136830023,40,易x小北x,6,1562951031870,5,0,心疼张阎罗，心疼李必，心疼徐宾，为了一群🐷队友太拼
16,1211931016,25,1茹元芳,5,1562950944477,1,0,下午17点，是啥时候？？？
16,1686163493,7,滴最贤惠-破军,0,1562950423634,2,0,感觉追不动了……
16,1034665681,29,鄧小Moon,6,1562948033461,0,0,刚开始25集的时候，一来就看了12集，还想一下子就看过半了，太好了。结果过了一周总集数变成了48集。一周才更4集。算了，等更要再看了，不然好片子都变味了。
16,723860604,28,金属风暴8,0,1562947531426,0,0,飙车！！！
16,1316243528,31,方-克雷吉,2,1562945963380,1,0,有多少真的看剧的啊？都没人评论每集里的故事情节，一味的夸电视机多好，就没点实际的说辞
16,1561882913,22,想和易烊千玺一起看剧呀,3,1562945583426,0,0,真好看
16,416825040,16,俄的未來丶怎能沒有妳,3,1562945554331,0,0,刀片超车？
16,1560679178,32,_耐热的左岸,4,1562944776041,1,0,这—天好长啊！
16,1724047792,4,_妩媚滴i黛安娜尤其,0,1562943083340,0,0,卧槽 我会员不想自动跳片头啊 是不是傻呀
16,1381293103,20,查酱de齐天大圣,3,1562942216632,2,0,没人觉得胖丫很可爱吗
16,1598390717,18,小思u,2,1562942014469,1,0,突然发现变成48集了？？哎呦我还以为快结尾了[泪]
16,1679069310,15,滴休斯m自强很,0,1562940853243,0,0,我想知道徐斌死了吗
16,1160716147,42,ydl2557831,6,1562940025611,2,0,奔着千玺来的，现在也越来越喜欢雷佳音，片子不错！顶
16,791984230,51,劉嘯龍,5,1562939972922,1,0,一共多少集？
16,1665898534,46,与你共舞97939,2,1562939450203,1186,1,支持每天两集的顶上去，这样看的太累，休息六天中又去看别的，忘记剧情啊。
16,1476136138,64,危桑的莴苣,5,1562938813284,4,0,为什么要让小鲜肉来演李必。
16,349496644,100,深夜惊鸿,6,1562938027732,0,0,这某些角色说话不利索是咋回事，人物设定?
16,1341024192,25,M越发朴素劳逊滴,5,1562937844582,1,0,我在忍着更完[勉强]
16,1252762703,13,卞v东皇太一,0,1562937464838,2,0,雷佳音演技不错
16,1098480641,42,叼馋28742,6,1562937427313,1,0,删了一集吗？闹什么呀
16,1186660505,51,张留霞1993,2,1562936262631,0,0,终于全部出来了[花心][花心][花心]
16,1207156378,41,Sunlight0825,4,1562935310198,0,2,死电视剧，一星期才给四集看
16,1066272154,24,努诺2018,5,1562935270633,1,0,剧中细节颇多值得琢磨，好剧啊
16,1301912779,55,yuebingke24223,6,1562934392288,3,0,本来说12集我觉得挺好，后来加到24集我觉得也能接受，这现在48集该不会演两个12时辰吧？
16,596596085,6,零号使徒,6,1562933611951,1,0,传令的是个日本人把
16,1713717645,1,茶饼莫里斯桑滴,0,1562933540509,1,0,48集！！我的天！也太长了吧
16,1719333770,10,卡内基de同志幻柏,2,1562932361343,0,0,徐斌领盒饭了？
16,1729974839,81,de很有诚信糖果同学,0,1562931668702,1,0,说因为我长的好看xswl哈哈哈哈哈哈哈哈哈哈哈哈
16,795872491,19,DrW05209803,6,1562931631790,2,0,既然徐宾怀疑他 为什么要和他去偏僻的地方 编剧 脑子呢
16,965175304,53,一塌齐,5,1562930879465,0,0,徐宾十六集不是死了吗
16,1468911515,19,偶尔路过的人94239,2,1562927066368,0,0,看到徐宾这么死的我决定不看了，等大结局出来了我看看结局就好。
16,1600165236,21,WQY今天认真了吗,2,1562926206840,0,0,我觉得他以后的发展空间会更大
16,1730040476,100,古老芥末,2,1562923828915,0,0,张小敬每次肉搏为什么不用刀啊？第三辆大车从后面一刀解决就不会差点被人勒死了
16,633608225,40,_78810128,6,1562922142671,0,0,哦豁 
16,1198570088,28,ZTGEMS,3,1562919335059,1,0,这些服饰与古画中的一样，可以剧组用心了
16,1054276786,37,阿山酱,5,1562919240912,0,0,共48集？
16,800486334,15,不掏钱就看不成吗,0,1562918349591,0,0,我总觉得鹿三鹿三在哪见过，才想起来，三哥打白鹿原上来啊[勉强]
16,388322355,62,wakanae_ak,6,1562915737238,0,0,更新太慢了，看了后面忘记了前面。
16,1040986867,20,王霞05636891,5,1562915614496,0,0,期待期待
16,1378818309,43,罗宾家的红线,2,1562914584457,0,0,求加更！！！！！真的不够看！！
16,1551048110,9,我是一个购物狂555,2,1562913772487,1,0,这陆三是右相内鬼
16,1328749441,100,derek_wa,6,1562913257443,4,0,为什么一个崔器，一个陆三都不会好好说话啊，
16,1501293910,10,完备同志x聂小倩x的,4,1562912670102,0,0,像美剧24小时！我喜欢
16,1501293910,10,完备同志x聂小倩x的,4,1562912482239,0,0,赞
16,1356824510,3,冷冷的风2018,4,1562912452557,0,0,这个道理别人也知道，可只有张小敬说清楚了
16,1356824510,3,冷冷的风2018,4,1562912408650,0,0,张小敬是个认真的人
16,390384845,64,Prehsa,6,1562912250514,0,0,"宋音是zhemeng，唐音不一定呢，古汉语口语读音，，现在都还没研究清楚的吧
"
16,1254390068,100,hoho大师,2,1562911700016,0,0,跑酷高手张小敬[哈哈]
16,489152182,49,fffyyyffff,6,1562911581365,0,0,LOL
16,1061117362,34,sdfsdfas21,6,1562911543566,0,0,多少好片因为更新慢，慢慢就不看了，被磨去耐性，等剧更新完，根本没心去看了。
16,1254390068,100,hoho大师,2,1562911038326,0,0,放箭把驾车的杀掉不就得了，看得捉急
16,1706636378,4,你的七七女王,0,1562910576194,0,0,更新的太慢，我都要忘记自己看的是那集了。干啥呢嘛，更新这么慢。w追个剧让人这么不痛快
16,1599945922,28,花花56267,4,1562908931625,0,0,看来片方还是很关注观众的心声的，加更了，一周可以看六集了，太激动了！
16,1034671529,21,薄荷864240968,4,1562908407976,0,0,终于加更了呀，希望不要凉凉⊙∀⊙
16,1536586934,3,慢慢瘦瘦瘦,4,1562907822219,0,0,闻染为什么要助纣为虐啊
16,845354088,54,典雅同志T哈代哈迪Hde,0,1562907552363,0,0,一天发生的事可以拍成48集？不可思议
16,791516912,10,梁梁35885,2,1562906661376,0,0,天呐！加更了
16,1475139955,32,wangbinyang77,0,1562906634672,0,0,确实有点撩人，是想让我每次都从头再看一遍的节奏啊！[疑问][疑问][疑问][疑问][疑问]
16,1598203925,16,啊毅91552,2,1562906495661,0,0,等的好辛苦啊
16,1481837216,14,鱼腥味01,2,1562905915103,0,0,17集看不懂啊！！！哪个大佬指点啊
16,1011821057,37,晰然16786,4,1562905889216,0,0,太牛了，越开越好看，都不舍得看了
16,1718970182,9,阿佛落狄忒L,2,1562905465479,0,0,龙波在何监后宅
16,1356824510,3,冷冷的风2018,4,1562904428254,0,0,每一集都像一部电影
16,1629806305,24,de沃拉斯顿同志特圆满,4,1562902802722,0,0,这徐宾就这样死了？
16,1600277889,8,君滴地瓜麻,2,1562902373314,0,0,，没货到的马车还跑不赢载货马车
16,1500410412,6,wm王小妞,2,1562901994236,0,0,不是25集吗？怎么又变成48了？
16,1718970182,9,阿佛落狄忒L,2,1562901874418,0,0,圣人 为守一人  牺牲百姓众人   圣在何处？
16,1718970182,9,阿佛落狄忒L,2,1562901660528,0,0,"我简直理解不了  
为什么不相信自己的儿子  信一个大臣"
16,1022561404,50,王同学50670,6,1562900808037,0,0,e
16,1618652062,5,宁静_最哈密瓜滴,0,1562900599520,0,0,会员都追过期了，准备等快更新完再开会员了[吐舌]
16,364578938,99,乔纳森南希同学的,2,1562900017198,0,0,竟然有人说徐宾单走是败笔，嫂子的鞋明说了两人关系很近
16,1629806305,24,de沃拉斯顿同志特圆满,4,1562899567733,0,0,这徐宾不是死了吗
16,1696642989,7,令白令,0,1562898333882,1,0,48集这么多吗，我还以为24集
16,1040119575,24,wong7723216232,4,1562897365673,0,0,16秒52，左狼王一刀砍在张小敬身上，一点事都没有，因为刀没刀锋吧
16,1541469647,36,叁拾伍94960,4,1562896066209,1,0,李必不在，魑魅魍魉全出来了
16,1067773152,26,洛少56768,4,1562895925266,1,0,可不可以每个星期更7集，一天晚上1集也可以啊[泪][泪]
16,1254185231,7,国U玛西亚,0,1562895751061,0,0,为了看个电视剧，我开通了会员。
16,1475140942,18,高明de宝石同志,0,1562894910074,2,0,怎么集数增加了。
16,1541469647,36,叁拾伍94960,4,1562894282334,0,0,原来不管什么时候都有疯狂追星的
16,1056168936,22,flower呦呦,0,1562894204386,2,0,更新的好慢，我都出现错觉了，以为张小敬出狱好几天了，结果是刚出狱不到一天，都快忘了演的是十二个时辰的事了，快看成十二天的感觉了[吐舌]
16,1041230562,13,无法抛弃的爱,2,1562892855175,1,0,就一集也让我等一个星期
16,939534099,21,杨杨杨成成成亨,3,1562892483617,1,0,死了的人在17集平白无故的活的好好的
16,1023256609,29,念mm1477541225000250,4,1562891811223,0,0,这就是所谓的断片[真棒]
16,1502895023,15,二三十63468,3,1562890890850,0,0,我不是在针对你们，40多集你们嫌时间长拖沓，20多集你们嫌太短，紧凑，怎么弄你们都嫌弃，还看什么剧，看完再说行不行，这才放到一半都还没🙄
16,1714725617,9,纯洁雪梨格外dey,2,1562890087884,1,0,太好看了，喜欢雷佳音
16,1208149839,13,梁馨文baby,2,1562889042650,2,0,真的  前边我都忘了
16,1100211219,7,张小洪1485483328298454,2,1562883753729,0,0,这样更新太慢了，一周才四集，哪怕一天两集也好啊
16,1100939357,9,小玲子40503,0,1562883727654,0,0,崔器看着好扎心 [勉强]
16,1306512069,52,钻研de花满楼w,2,1562883030562,0,0,讲十二个小时的故事，要48集！？？
16,553755961,59,尐噺先生,6,1562869976243,0,0,怎么后面只有21集预告？究竟几集？哪来的48级？
16,348759451,28,地球梦,5,1562869385393,0,0,这啥东西天天放嘴里嚼这里面规矩太多
16,1442890943,25,莽撞的瑞香君,5,1562869321837,1,0,不管是剧情还是演员还是背景方面都非常好，把电视剧拍成了大片的感觉！演员演技在线，非常棒，良心剧
16,1518010538,17,梵昏128,2,1562868271599,0,0,等了一周才四集[勉强]
16,1385587507,10,饶t潼恩,2,1562867613310,0,0,想一晚上就看完，最讨厌追剧了
16,1711781676,100,滴灰常可靠大爱桑,2,1562867490087,2,0,"皇城火劫危旦夕，
督卫捉狼事在急。
上元灯节百姓欢，
云麾震边守国宁。

长安十二时辰，真的超级好看。"
16,1500812035,13,惊奇队员,0,1562864475076,0,0,太子才是幕后黑手
16,551262045,49,a3066686,6,1562863187699,0,0, 啊郎的故事
16,1533962674,24,外向de面粉君,4,1562863186248,2,0,好久没有看到这么精彩的良心剧了，书写的好看，电视翻拍的也经典，看电视剧的时候也学到很多东西，谢谢。为你们点赞！
16,439851920,20,凯撒的小迷妹,0,1562862942017,0,0,元载到底是个什么人设？
16,1036287718,30,加菲二号1478908933177129,4,1562862716671,1,0,这部剧喜欢上了千玺跟小敬
16,1531488683,16,我是AC啊,2,1562862191415,0,0,因为我长的好看
16,1591805557,27,qing82854,4,1562862082079,3,0,十六集和十七集怎么连接不上。
16,333616319,40,trouble-in,2,1562862020016,0,0,看的太好了，还原度算高了
16,1723060432,13,同学文明太0南春的,2,1562861209306,1,0,太精彩了，给力，好久没看到这么给力的国剧了，赞
16,1694781324,4,稻子wax,2,1562861105258,10,0,建议改变一下更新方式，自己的感受是一周的时间长度稀释了追剧的热情。
16,1724909635,1,同志乌黑太0超胆侠的,0,1562860967725,5,0,超级好看的电视剧，比言情的电视剧的技术含量好的不是一星半点，四字弟弟的演技有待提高哦（正宗四叶草🍀）各位要求也不要太高，拍这个剧的时候，他也就16，17还是要有经验和磨练的，但是真的要被张小敬圈粉了！演的特别好(✪▽✪)，但是更新的太不合人情常理了，每次都是一口气看完四集，然后下次看就忘的一干二净，慢慢回忆起来的，希望更新能多一点，每天两集，求求了，真的超级喜欢看啊，画质不好的自己调一下，真的和电影一样了！我觉得国内就应该多拍一些这种好的，有技术含量的电视剧！导演也说了，关键不是看剧情而是想还原大唐盛情，真的超级棒了，点赞哦(´-ω-`)
16,1511626427,100,肆六一二一,0,1562860902409,0,0,我看着看着觉得哪里不对，退出来一看，哦吼，四十八集
16,743783988,16,君的奥丽薇亚邢,2,1562860671295,0,0,期待续集
16,1378643431,61,天蝎座55011,4,1562860559063,0,0,16集看的太精彩了👍……
16,1206429644,33,孤独的时候给我说,4,1562860556556,0,0,，
16,743783988,16,君的奥丽薇亚邢,2,1562860524008,0,0,每周四更新四集，一次性看完，又得等上一周了，煎熬啊
16,1174560813,24,嘎嘎的王,2,1562859715974,1,0,终于等到你～一个来自快要期末考的法学狗冒着挂科的生命危险来追剧了
16,1727474398,11,桑沉沉分外m沙僧的,2,1562859297997,1,0,整了一圈，静安寺的人帮了右相
16,915958410,3,晓娜1663145,6,1562859202193,0,0,掐指一算，古时十二时辰，约莫等于现代12周，3个月
16,915958410,3,晓娜1663145,6,1562859061235,0,0,啊啊啊啊 为什么连预告都没有啊！不够看啊不够看
16,802456585,61,Quietyourfear43649784,6,1562858901645,0,0,龙波是不是第八团的人啊？
16,1129437328,23,李李庆龙,6,1562858717132,1,0,何孚
16,1730638158,6,同学能吃苦十分u哈尔迪尔的,2,1562858641442,0,0,闻染就这么死了么？
16,1350496238,10,niniaibama0,2,1562858634424,1,0,备考中级会计的我，忍不住看剧，又不能快进，我罪恶啊，我的时间！
16,827736325,10,略微de合理布罗德,2,1562858629074,11,0,真的是迄今为止看过最良心的古装国剧，堪比权游，人物的刻画和细节的点缀以及气氛的烘托都堪称精妙，演员的演技全程在线，与史实并无太大出入，满分！希望中国电视界能多一些像这样优秀的导演，出色的演员！
16,1364101187,7,强悍de雷利,0,1562858620902,21,0,以为十二个时辰一集半个时辰，原来一集是1/4个时辰orz有些追不下去了，后面的剧情也略显拖沓。。。
16,1129437328,23,李李庆龙,6,1562858573612,0,0,大boss姓何名孚
16,1385144497,25,爱yang烊,3,1562858522128,0,0,真的良心之作啊，喜欢
16,1044388213,5,华战公会,0,1562858486099,0,0,徐斌死了吗？？？？
16,1532811689,12,巴比伦和土耳其,0,1562858464949,50,0,看后面，前面李必和徐宾喝酒是回忆，接旨那里徐斌还没有苏醒，后面徐斌苏醒了，陆三已经去找龙波了，唯一没有解释的是，张小敬是怎么被救起来的，怎么就被抓捕了，这点要吐槽（小说写的张被捞起直接被抓捕了，这样一想和剧情就衔接上了），给看片的观众带来了很大的困惑。送我上热评呗。
16,1193072576,44,杨柳枫666,6,1562858191471,1,0,这个元载心机厉害
16,1628087471,12,书雪门罗君的,0,1562858147440,0,0,寺庙小哥一定是神助攻
