,uid,userLevel,userName,vipGrade,createtime,voteUp,downCount,content
16,1619420678,9,断尾猫9411,2,1562375874933,2,0,有剧透…………………………………………………徐宾聪明了15集结果智商突然下线，就算要死，我觉得应该是跟踪后被发现然后突然弄死，剧中这死法
16,1464049233,13,佴1盼儿,0,1562375774543,1,0,特别不错的一部电视剧，一口气追了16集，希望更新快一点
16,772717052,61,小张测评123,6,1562375319933,3,0,更得太慢了，急死人了，
16,944730369,20,安达燃气,2,1562375304135,0,0,"陆3是小日本演的吗
"
16,944730369,20,安达燃气,2,1562375064195,0,0,"十二个时辰拍了48集，导演的心思真是极细的呢
"
16,1308093697,33,英雄所见略同之,3,1562374827903,2,0, 张小敬威武！雷佳音燃爆！
16,1516945721,29,vivi10196,4,1562374244291,0,0,徐斌就真的死了？
16,1188831590,34,hongsemeigui1989,6,1562373719445,4,0,细节之处见真章，不造作，好剧
16,944029319,27,爱宝贝尼,4,1562373204499,3,0,怎么忽然就48集了  我就是以为这个电视剧集数少我才看的我槽了
16,389347278,25,YI易燃易BOOM,5,1562373120123,4,0,剧情发展是越看越精彩！
16,906526470,61,莽莽捣蛋鬼,0,1562371444646,0,0,怕就怕虎头蛇尾
16,1131450332,8,康斯坦丁54591,2,1562369755526,4,0,两部并一部了？在哪里可以评分啊 我还是觉得这部剧很好看的
16,841846442,44,坚持锻炼666,5,1562369442043,0,0,这电视演的越来越没逻辑了，开始瞎演了
16,1321567216,17,留年芳华,0,1562368728060,0,0,到底多少集呀 前面写25 今天一看 咋48了 太烧脑 太多集 坚持不住呀
16,1059130764,17,摩天轮1480224062076441,2,1562367924406,0,0,变成48集了，
16,1072715943,1,只吃鱼的狗00062562612,4,1562366334047,2,0,累死宝宝了，只有宝宝一个人在跑[茶杯]
16,1708747032,100,看一只江,2,1562366240957,0,0,张小敬为什么就是不用刀呢？
16,474922573,42,阿_柒,6,1562365530767,1,0,看了个通宵 10多集😂 有的等了
16,364453904,60,yuanqibaby,4,1562365011080,1,0,更新太难了，四十多级得看到啥时候去
16,1406046153,21,廉桑de竹笋,3,1562364719667,1,0,徐宾不是真的凉吧[委屈]
16,1693227356,12,tb007319336,2,1562364142786,1,0,为了个剧冲了个会员[泪]一晚上不睡觉啊[勉强][勉强]快更新吧！没看的了
16,1203272030,25,情vs枫,2,1562362464174,0,0,细节处理影响了整部影片 故事👍
16,859564951,37,壬子卯兔,4,1562362400144,1,0,照着美剧《24小时》来的，不过很精彩！[吐舌]
16,1725019015,8,滴太踏实玛琪亲,2,1562361536862,0,0,恕我智商不够，看不懂，一般般
16,1328433479,24,东虞如音,4,1562360733162,678,2,我服了，这节奏，一口气连追十六集大气不敢喘一个，请收下我的膝盖，这节目适合等更完一口气追到底贼爽。
16,1183773503,18,醒宝牌香烟,3,1562357779372,0,0,我只想说，结水货
16,593962282,36,书影伶仃,6,1562357211406,0,0,靠，搞半天，她没死，[啊][啊]
16,932512817,13,圈圈6呀,3,1562356936709,1,0,妈呀还要等一周好难熬
16,593962282,36,书影伶仃,6,1562356538176,1,0,闻染就这样下线了吗？
16,1361179303,14,H深沉的竹子,0,1562352867078,5,2,剧情确实很紧凑，可是主角太神，不符合逻辑，张小敬受了那么多伤：短指伤、腰间处的重伤还有从高处坠落下来的伤以及其他地方的伤，如是凡人这些伤只怕要好些天才会生龙活虎，可放在这部剧里以小时计算这伤跟没有似的，真是神奇。
16,1720954609,14,提笔写长安,2,1562352311282,2,0,不用他用谁？？？？？
16,549139076,31,甜心-Stephanie,3,1562352143446,1,0,来个人告诉我徐宾到底死没死
16,558605276,34,爪子抓鱼,5,1562350990008,1,0,好片，必须追。。。。。。
16,1044284191,15,静8720624290,3,1562349385327,2,0,更新呀更新呀
16,793305448,30,暮与歌,4,1562349225242,1,0,我又在等！！
16,1081471632,54,天津_艾美,6,1562348651964,2,0,到底多少集啊？一开始不是说25集，现在怎么标志48集？
16,1224751645,3,UxU克鲁尼T,2,1562347904948,0,0,没法追了，24集我还能坚持。。48就算了。。我不如看小说。。。
16,1666339040,19,亲绿巨人阿丽丝的,2,1562347805287,1,0,好戏还在后头！精彩的🐴战
16,1032165145,22,乌拉拉是天蝎座,2,1562347517959,644,2,客观点评，剧是好剧，全程没有想看进度条的感觉，不知不觉就一集结束了，老阿姨不是小鲜肉的粉，千禧演技没有炸裂，但也中规中矩，还是可以给个及格分的，未来可期
16,583904665,62,太阳依然,6,1562347223909,2,0,一个传令兵怎么突然开挂了，莫不是有人指使
16,816806606,55,丢你个老某头,6,1562346761215,1,0,国剧质量若都能如此，我各大视频网站都会毫不犹豫开会员追剧。
16,1194891507,36,hailan37267,6,1562346446659,3,0,强烈要求加更加更，一周四集太少了，看不过瘾
16,952092904,18,shb2824,5,1562345842535,4,0,雷佳音演技太棒！这部片子拍的真好！
16,1327771505,16,回回73362,3,1562345653777,0,1,何监！BOSS
16,1327771505,16,回回73362,3,1562345613081,0,1,何监是最大的BOSS
16,1629984149,25,陈孝春44951,3,1562345101141,2,0,就怕一件事！万一和湖南卫视那个封神传奇一样放一半呢？那就狗血了
16,1543970884,39,优惠de猛大帅同志,4,1562344957657,1,1,48集，一个礼拜更新4集这的到什么时候，这是悬疑剧，这礼拜看完前面看的都连不上啦，这还怎么追剧
16,1546511876,9,饱满的惠特同学,2,1562344950602,0,0,今晚怎么没有更新？
16,326640268,52,艳道人,5,1562344900306,1,0,杆精真多，比起其他的超太多了
16,326640268,52,艳道人,5,1562344842142,1,0,好看
16,1203578600,22,小双99779,0,1562344588827,3,0,我想知道腰上的刀是干嘛的，能带着又蹦又跳的，不能抽出来给他一刀非要用绳子勒吗？
16,1185556309,100,liulian592732611,5,1562344351744,0,0,额。只想知道，为什么从25集变成48集？
16,972325832,36,xb136617538,4,1562344243758,1,0,司丞是六品，付师级。
16,544439652,21,君香蕉曲折特的,3,1562343970615,0,0,更新好慢啊，这么慢很容易追不动的，剧情都要忘记了
16,986814034,51,寂寞的童话2012,6,1562343615655,2,0,一星期4集，太慢了
16,986814034,51,寂寞的童话2012,6,1562343565255,0,0,怎么突然变成48集了[汗]
16,982628062,4,北凉王说北凉,6,1562343555158,1,0,此剧使我周四晚上八点不能入眠！！太特码精彩了
16,713098391,39,懒猫爱鲤鱼,2,1562343484451,0,0,怎么没有更新
16,1643623772,20,莉娃同学的萌主,3,1562343435428,0,4,哆哩啰嗦，如何评的高分？
16,1190048776,37,0极谦虚洪七公的,5,1562343210934,1,0,坐等更新，怎么不更了[不高兴]
16,1159542019,37,把你拖出去打,3,1562343196570,5,2,确实有烂的趋势，希望别，另外剧情真的很拖
16,551269086,3,iconesun,2,1562343102906,2,0, 感觉不好，生死关头用拳头，刀呢，太扯了
16,388410219,31,楚轩粉丝,6,1562342972162,2,0,去看了小说，感觉电视剧拍得比小说好，真不错
16,1411951620,100,黛儿88329,2,1562342893719,1,0,一开始看不是一共25集么？怎么又变48集了
16,1526148667,28,俊逸非凡de贝尔酱,3,1562342853964,3,0,我天啊，张小敬打戏看着就疼
16,405334431,42,浪子不识路,0,1562342482213,2,0,徐宾就这么死了吗？既然怀疑通传是犯人，还配合着给灭口的机会，也太不智了
16,1051144854,100,tracy_mm1479481447203642,2,1562342400228,2,0,太太太好看了！
16,835144479,9,宝宝么么哒-,3,1562342179972,0,0,啊啊啊啊，没得追了，又要等一个星期哦
16,1651752732,16,的亲福勒齐,2,1562342160524,0,0,只想给评分满分，但不知道从哪评
16,1096770352,31,我是小素素小素素,3,1562342158050,12,1,长安十二时辰真的是这个夏天最燃最值得追的好剧，两位主演千玺和佳音的表现都非常精彩，戏里戏外都超级默契，就是曹盾导演说的巧夺天工永远比不过浑然天成，他们就是李必和张小敬[赞]
16,1309284444,33,香菜宝宝93529,5,1562342157183,1,0,徐宾你不能死
16,1300828293,8,娟5659840430,2,1562342104962,1,0,好看大力支持
16,1035056088,28,我是小美619,4,1562341993479,0,0,更新太慢了吧
16,1449657396,42,13962855293cy,5,1562341871322,0,0,司丞是几品
16,1076908183,46,JENNY_JOHN,6,1562341773885,1,0,太好看了，紧凑
16,1449657396,42,13962855293cy,5,1562341751980,1,0,司丞是几品官
16,1449657396,42,13962855293cy,5,1562341692720,0,0,我想问一下司丞是几品官位
16,658124029,16,红点颏7415,2,1562341631544,4,2,果然有烂的趋势徐斌这智商也没谁了这智商怎么写出大案读书的?
16,1339296031,10,北夜爵37719,2,1562341534952,0,0,"
这到底是怎么更新的？"
16,1029867604,13,丁劲松1478338238877487,2,1562341509715,2,2,剧情有些设置的真的对不起这9、0评分
16,1150201965,22,Justinalove,3,1562341295246,2,0,"太好看了,一分钟都不能错过，千玺真的太帅了，骑马拽车那段。"
16,1452715451,16,肉肉的聪聪zl,2,1562341157054,1,0,剧情其他都可以，，就是为什么马车在大街上跑，就只有张小敬一个人在抓，，其他人就算不能射箭，难道都不会武功，不会找一些高手上去打吗，，感觉那么多坏人就一个人在抓，，其他都可以表示不错
16,1708531706,14,同志肘子小盒de,3,1562341024301,1,0,我只想知道谁会嫁给他！
16,1231415023,17,0潘多拉V-V,2,1562340989823,0,0,什么情况 我记得是25集 怎么就变成48了？？？这24小时能演48集？？？难道是从40多分钟变成20分钟一集[汗][汗][汗]
16,1312025404,19,chaddana,4,1562340806203,2,0,该片剧情好，值得一看。
16,1195519801,4,骄宝蛋,2,1562340592785,3,0,天呐 剧情太燃啦 演技太炸裂了 
16,1228809392,19,相对论56427,2,1562340561450,0,0,咋变成48集了
16,1370023827,15,小白流星19831207,3,1562340470658,2,0,好看，精彩
16,1190300385,15,秦采环13,2,1562340468564,2,1,千玺演技好棒，出乎意料
16,421384000,34,hisacheng,0,1562340182074,0,0,好看吗 这么高的分
16,808384708,65,光光43734127,5,1562340130490,0,0,到底是25集还是48集？
16,1340820681,15,此生只爱你们TFBOYS,2,1562340115231,0,0,打卡
16,658767308,6,角斗士的小电视,0,1562339572320,0,0,有烂的趋势，可千万不要啊，挺住挺住
16,1022389763,21,一念之间125125,0,1562339411990,2,0,良心好剧，看得意犹未尽[真棒]
16,1537815422,29,a憨态可掬de埃墨森,3,1562339338806,2,0,加更！同意保持队形。
16,909567384,37,ma13392906866,4,1562339244916,0,0,太假
16,658767308,6,角斗士的小电视,0,1562339162660,1,0,得吐槽一下，张小敬简直超人，夸张了夸张了。徐宾再多来几集啊，就这么给弄挂了[难过]
16,1448603218,38,纳百川76652,0,1562339001955,1,0,难得好剧，不仅剧情，主要是镜头，人物刻画，细节处理，以及长镜头
16,1706636378,4,你的七七女王,0,1562338829468,0,0,这个人是。
16,1706636378,4,你的七七女王,0,1562338729281,1,0,怎么从来没听说过雷佳音呢，这是第一次看到他。
16,822120097,40,凉薄凉薄凉,5,1562338662387,2,0,徐宾这死的也太随意了吧
16,1036076268,25,源于你的玺欢,5,1562338299252,1,0,加更
16,488517555,24,戴宛励,0,1562338191242,0,0,今天不更新的？
16,1186815014,44,sakura62099820,5,1562338188686,1,0,楼上的兵看不到这几辆马车吗
16,1168870426,38,赵鼎17045,2,1562338149797,7,0,其他都挺好就是一说话的时候嘴里都跟含了槟榔是的，不会好好说呢，非弄个外国腔[黑线]
16,776847720,46,贵州众行户外,5,1562337990561,1,0,不是更新两集吗？
16,386291572,33,一抹浅蓝95739631,3,1562337890350,1,0,本来25集，现在48集了
16,1363746748,25,愿远方的你能被温柔对待,4,1562337847021,1,0,不错
16,1357434931,17,简单de剑士i,0,1562337788229,1,1,片子不错值得一看
16,400998930,30,旧约汝画,2,1562337556380,0,0,这么重要的这人这么快下线我不信！！纸张替换啊！！纸张原料替换啊
16,1044974081,18,流年不止经年1479183681090621,4,1562337515752,2,0,太好看了，想评分，怎么评在哪评分？
16,1384674372,10,林桑的菖蒲,0,1562337388730,1,0,李必的扮演者太没形了
16,1044974081,18,流年不止经年1479183681090621,4,1562337351049,1,0,徐宾就这么死了？？？[汗][汗]
16,567536167,26,wanyuany,4,1562337190649,0,0,好可怕
16,1336481542,2,弥生大魔王,0,1562337128903,1,1,本来是看的，但看完小说就不是很想看了
16,1072550081,25,娇7064470184,2,1562337045036,0,0,为什么一个星期才更新四集？
16,1046794625,47,逊雅619119927,5,1562336747443,0,0,九分低了 根本tingbuxialai 
16,1216127817,39,千锦千1128,6,1562336722165,2,0,这里看的太过瘾了
16,1036266237,34,Cheung_txz,3,1562336720505,0,0,看了这么多集不知在那里打分啊
16,342971423,78,简单点好13751559,6,1562336682483,3,0,作为会员，能不能多更新一点啊
16,1321151947,41,小青青小冉冉,5,1562336519291,2,0,国产精品。10年没看国产片的我服了，以后多出这种片看鬼美剧
16,1433462500,13,蒸汽香菜x,0,1562336415765,2,0,太好看啦
16,1174932893,26,duoduoxqr,5,1562336308378,3,0,[大拇指]太好看了，至少9.0以上评分
16,478865714,40,千染狐,6,1562336274200,23,0,真的好看啊，说实话，大千世界，各种各样的人组成长安，每个人都有镜头，少了他们就不叫长安！！说剧情拖沓的，每集开头不是都有报时么？十二时辰，哪里拖沓？！我越来越期待后面的剧情了！！！
16,1038551782,31,zhangyingjian978,5,1562336208188,3,0, 看的完全停不下来，好剧好评，以后多出
16,389028811,47,秋夜的風,0,1562336207159,0,0,长安人生活节奏好快，一天办这么多事
16,1718668675,7,蒙哥马利妲己桑的,0,1562335934615,1,0,好看 相当好看 精彩 绝对精彩 精品！！！！
16,1073959299,18,小颗粒90,2,1562335855305,1,0,更新的太少了，强烈要求➕更
16,1541683580,17,人性本恶55631,3,1562335685592,1,3,大的方向还不错，细节出了逻辑问题。路转粉，粉转黑
16,384717470,21,1279895101,3,1562335618409,6,0,以后古装戏就按这个色调做，有味道，还有一板一眼的还原，导演也是很负责。
16,1052876755,49,转运者1479570614511992,6,1562335607949,1,0,还有个小日本跑腿？？什么情况😳。没看懂
16,1121953791,27,周文华80729,5,1562335564549,0,0,细节真不行
16,408118300,60,好名儿都让我起了,6,1562335115557,0,0,哪里口音
16,979663667,24,谢刚17915,0,1562334925187,0,0,好剧及时没有完全懂也能看出来这部剧是用心了的。
16,1142169028,12,jamesjiang09321492521044551531,3,1562334875198,0,0,从剪辑上来看，第一季原计划应该是16集啊
16,1341404934,12,石榴麟_,5,1562334811702,0,0,还以为你是因为在极限挑战虐的太惨，所以不去了。
16,1581841633,19,鲜红的史迪威w,2,1562334729318,0,0,i
16,1335927471,35,梦游的阿狸79800,0,1562334673869,2,0,这一集是生死时速的古代版啊！
16,592527123,5,taodzhy,6,1562334631856,1,0,我只能 呵呵了，这个 徐宾 。。。谁写的本啊。无语
16,1571738422,2,鞠y布兰琪,3,1562334595901,1,0,阙罗霍多是什么
16,1719319558,10,鸡腿de酱鲁法洛,2,1562334376016,4,0,我看雷佳音的采访，十二时辰拍了八个月，又是良心剧，追
16,1590382706,19,罗兰过硬de同学,3,1562334326367,2,0,闻染让人看不懂
16,365436721,37,邓根民,6,1562334198414,0,0,为什么突然60集了！昨天还是24
16,1235518210,30,zz要开心,4,1562334195450,2,0,那个通传的口音，为何如此奇怪😂
16,1121468660,38,我是80后的他,6,1562333969535,3,1,千玺骑马那段太帅了
16,1331062874,30,文文66371,5,1562333962537,2,0,能不能快点更新啊。到这过去一半了吧？
16,917081680,14,gdqk67972,3,1562333886126,4,0,许鸽子唱歌的时候，群演是某是歌手的观众吗？[勉强][勉强][勉强]
16,1099136073,19,jessica3625,2,1562333803580,0,0,曹破延后来又出现了？不是之前就挂了吗？
16,1130869333,32,雪儿131452090083271,4,1562333773218,1,0,今晚没有更新了吗
16,1240324715,37,殇斄,5,1562333469444,0,0,不是二十四集啊这一下子翻了翻
16,1050122111,26,娜娜1479434056926836,4,1562333434695,4,0,太好看了，每次看到雷佳音受伤我好心疼，好想哭，看到那些猪队友真想手刃了他们
16,764427518,19,ykapp_oh2esj81,2,1562333279789,0,0,细狗早绝了
16,957246754,3,氵尗又尹口,0,1562333156429,5,0,很喜欢，好好看，绝对10分，大爱雷大头，真的好敬业！！绝对演技派！！！
16,433712113,57,雷鳴闪电,6,1562333045145,1,0,公480集？？不是说好的250集吗？
16,710608099,57,2货最自在,6,1562332686172,3,0,"越来越精彩了  抓耳挠腮
"
16,1722137095,3,-活拨滴u小倩很,0,1562332611755,1,0,不可以让马停下嘛我的天
16,1021809386,55,V烟花易泠V,5,1562332589257,2,1,太好看了喂，国产剧有望啊，啊啊啊啊啊啊啊啊
16,1331027773,28,自由的神往,4,1562332311311,3,0,更的太慢了，急啊
16,994609604,39,l温文尔雅的颓废,5,1562332171395,3,0,真的太好看了啊！！
16,777069726,27,李想到理想,6,1562332163177,2,0,一星期就更新一天4集？
16,1245776123,7,i哈伯德0_0,2,1562332144331,5,0,徐斌是个沙雕嘛，都怀疑对方是内奸了，还跟着去幽静地方，不是应该是叫人拿下嘛，沙雕
16,1208799644,33,懂次打次,6,1562332063440,0,0,请问这剧圣人做了些什么？
16,1571416717,21,春暖花开36839,0,1562332046784,2,0,更新太少了，不够看
16,1058964343,12,赖撕J,2,1562331956908,1,0,请问通传陆三是个歪果仁吗？？？[无语]
16,1043929729,25,liuxingyiren9937,3,1562331870062,3,0,太燃了
16,373330120,24,悲伤未化作,4,1562331663392,0,0,情歌王
16,1322619546,18,廉v光光,2,1562331557305,2,0,大数据就这样挂了
16,1408208194,22,瞿u雨水,3,1562331524715,1,0,4集不够看呀
16,1322619546,18,廉v光光,2,1562331431847,2,0,大制作，大场面
16,1093954054,46,Auspicious_乔,6,1562331422998,105,1,这部剧会开启国产电视剧电影化风潮，类似于美剧一样的精良大制作，按季播出，只不过这次是一次性两季合播了，良心剧组，也是先河！
16,390876068,22,张天天12982,3,1562331242271,0,0,怎么变48集了？
16,1033407992,8,miniw1478755533947535,4,1562331217605,2,0,徐宾这就挂了？！！！
16,1369544927,22,彭冰1218000,4,1562331167305,4,0,看千玺追车太咋啦
16,1589190079,20,九九小狐狸,4,1562331098120,4,0,这剧绝对2019的路王，[大拇指]电视剧的里程碑
16,1222113281,11,梓末青桐,0,1562331028358,0,0,说好的周一到周五一集呢，感情会员周四4集之后就没了
16,355285283,36,雪khun,0,1562330873070,489,2,千玺骑马那段太帅了   看着特别的激动  但也可想而知当初学骑马是多么的苦  拍这段戏有多么的难   
16,1433480683,4,qm喜欢你,0,1562330581235,1,0,"
686



0"
16,1573532070,11,方君的玉女,3,1562330464268,1,0,张小敬为什么不用刀
16,1710771917,15,de鲁道夫8荒废格外,2,1562330427199,3,1,三俩马车就把街道搞得一团遭。
16,1710771917,15,de鲁道夫8荒废格外,2,1562330230103,1,1,许鹤子光天化日之下杀人。
16,1326409234,13,喵喵咪呀57064,2,1562330098119,1,0,求加更啊，剧情这么紧凑，战线拉的太长了
16,1036083439,21,ty嘻嘻0,5,1562330055087,2,0,这更新，满慢慢
16,900208143,38,不便滴狄龙,5,1562329691192,0,0,这是网剧嘛
16,429750540,6,老衲爱吃毛血旺,0,1562329682001,0,0,徐宾造纸煽了我一回，李司承拿刀又煽我一回
16,744443408,33,ykapp_fwpx1yy1,3,1562329656667,3,0,根本不够看
16,630732604,39,elevenwon_aimee,6,1562329467156,1,0,传信的是老外吗？ 话说的根本不像中国人
16,1178285465,38,梦-貘,2,1562329446076,2,0,我还想看，可是没得看了，只好来看看预告啊爷
16,1044191687,30,萌芽阿weyerming,6,1562329205618,2,0,好好看啊吹爆！我都舍不得看完
16,1675031664,19,的埃文思颜君,2,1562329160861,0,0,长安没有别的兵了吗？
16,454276383,45,新绿33796191,6,1562329023398,2,0,他们三车只是龙波的障眼法
16,1351681203,18,哈w菲尔德,5,1562328851418,0,0,会员今天没有一集吗？
16,1008533448,42,向荣888,6,1562328819017,3,0,刚追到了三辆伏火雷，以为就算没结束应该也差不多了，结果一看一共48集，我去，看来还有好多事要发生啊
16,906106986,26,那天遇见你21,0,1562328784178,3,0,大敌当前还在内斗，人性啊
16,1173119079,15,田振杰62875,0,1562328758923,1,0,易烊千玺还是太年轻了，换成胡歌这部电视剧就完美了
16,1187637739,27,元凯84314,4,1562328559064,2,0,我去，一周只更新4集吗？我去，未免太贱了吧
16,341349121,10,吖鸟哥,2,1562328481095,1,0,这样的好剧，真的是久违了
16,757541832,35,偶像007嗯Y,5,1562328461480,2,0,今年看过的最好古装戏[大拇指][大拇指][大拇指][大拇指][大拇指]
16,1050433187,11,阿仅硕硕,2,1562328371506,1,0,啊啊啊好想看后面的，多更新几集吧
16,1032014611,47,孙崇坤,5,1562328328170,0,0,很纳闷为什么不用刀
16,1159895819,20,薇笑的晚餐,2,1562328322555,0,0,更新的这四集简直太精彩了
16,1641976523,13,de同学地瓜粥禹,3,1562328124443,0,0,不是25集么。。。怎么四十八集了
16,989321960,4,努力去看易烊千玺,3,1562328083474,0,0,好看
16,374569623,60,—5月—,6,1562327890522,0,0,看过小说看不料这编剧
16,1308575117,18,韩o终结者,5,1562327890416,0,0,难得的好剧
16,1054582717,23,淡似雾,3,1562327604603,1,0,24集变成48集，请问后面24集是怎么来的。
16,643622451,34,_85244283,6,1562327586947,0,0,张小敬有剑为什么不用呢？
16,833752582,44,JacksonWang1128,4,1562327577983,1,0,一天更新两集就好了，一周8集，还的等到下周四
16,1162498120,10,小屁孩佛,2,1562327490205,0,0,大家都在讨论主角，但剧中长安百姓的包容热情，有趣勇敢，我觉得导演把长安人的人格魅力塑造的很好
16,1716283409,11,禅师极其的w普及酱,2,1562327431448,0,0,更新太少了，求加更
16,1208477516,13,姚玄武,5,1562327370981,0,0,和小说差别太大，剪的乱七八糟。
16,1063413279,23,青藜子,4,1562327036946,0,0,为啥电视台拒绝好剧
16,1118746269,26,大小都是猪,4,1562326976950,0,0,只有最追求极致的人才能称为最纯粹的人。徐宾也许是痴人但他活得纯粹有信仰。但也不能怪李必毕竟他要负责，稍有不慎满盘皆输。
16,1248159699,18,T0T芬克o,2,1562326860716,0,0,这几集看着真的有点侮辱智商呀，实在是bug
16,1300031007,31,犹豫的大表哥,4,1562326810162,0,0,台下喊许鹤子的观众怎么那么像…………
16,658335655,53,我要去色达送快递,0,1562326744364,0,0,线索没有一个是浪费的
16,1146466199,45,Mango1121,2,1562326737327,0,0,一个时辰两个小时，一集电视半小时，48集正好十二时辰！厉害了！
16,698230820,27,soryuden001,6,1562326668907,0,0,通传是内鬼，最后杀了李滨//通传真好，紧急关头来回传递消息，还为李必李司丞小狐狸说好话，大义凛然啊
16,1234728739,40,color34623,5,1562326469074,0,0,爸，更新吧！
16,1183639862,23,阿黎梨啊,2,1562326187730,0,0,通传真好，紧急关头来回传递消息，还为李必李司丞小狐狸说好话，大义凛然啊
16,1038740429,48,啊罗哈里路亚,6,1562326139404,0,0,求加更，这样速度要更两个月呢
16,1645653620,22,de极度惊人0太乙真人,3,1562326077060,0,0,好剧好剧好剧！！！！！！！！！！！！！！！！
16,1039414973,1,刘胜意,0,1562325792895,0,0,徐宾居然死了，真的是
16,796124046,19,ABB黑森,2,1562325705916,0,0,一天的事情演40多集！我擦
16,813236395,30,爱蒲09317989,6,1562325591965,0,0,好啰嗦
16,1354080995,13,忧郁亲A纸伞T的,2,1562325578408,0,0,良心好剧
16,745296199,9,ぁ尛白89872213,2,1562325509786,0,0,内容越来越扑朔迷离了，就是更的太慢了！！！
16,1389093631,48,丹姐的小酷狗,5,1562325382825,25,0,剧荒的情况下，比起那些谈恋爱的狗血剧有期待。劝导演们多拍点这样的剧。
16,1003145249,34,西里哗啦哗啦,0,1562325341517,0,0,越来越不精彩了
16,1463123749,55,北方音乐学院,2,1562325304625,0,0,"徐宾就这么死了？？ 
不觉得可笑么？"
16,1587691942,30,de格斯T豁达君,3,1562325223520,0,0,好看
16,1301928599,32,牛奶加点咖啡,0,1562324813676,0,0,吓我一跳，25集变48集，剧情都不知道怎么发展下去了，十二时辰，前面16集就已经到达申时了，剩下后面三个时辰32集，前面估计又要毁剧了，片方出来咱们聊聊天可好！
16,658335655,53,我要去色达送快递,0,1562324707516,0,0,真的超好看，电影里最多两个小时能够做完的。拍了二十几集还这么紧凑
16,1137751753,11,森林味道牙膏,2,1562324652993,0,0,🙏🙏🙏🙏🙏🙏🙏
16,1137751753,11,森林味道牙膏,2,1562324565457,0,0,🙏🙏🙏
16,1580003162,11,兵锋13042,2,1562324087701,3,0,指使龙波的幕后黑手就是太子和何监，在第一集的时候何监骑驴看到花萼香辉楼说的醉话，叫李必查狼卫就是掩护龙波的行动，到时皇帝和宰相看灯的时候，炸了花萼香辉楼，太子就是皇帝了！
16,1137751753,11,森林味道牙膏,2,1562324081238,0,0,🙏🙏🙏🙏🙏🙏🙏🙏🙏
16,328579395,57,悠悠然然听轻笛,6,1562324025417,2,0,好看！
16,910798566,22,秋墨Decadent,0,1562323942215,0,0,只看雷佳音
16,1555499031,8,tb186722989,0,1562323379485,0,0,哈哈哈，我一想到一天可以演48集！我就愁得不想看了！
16,1431478685,40,人言西方日出早-勇,0,1562323248453,1,0,崔器这角要来干嘛呀这是
