,uid,userLevel,userName,vipGrade,createtime,voteUp,downCount,content
42,1043757082,27,feitong0719,5,1566136468960,0,0,千玺千玺千玺
42,1034957142,32,刘家铭呼,5,1566129391852,0,0,出来了
42,539762102,43,笑笑不笑你还笑,5,1566107494271,0,0,龙波人生巅峰啊 可以改朝换代
42,1139142403,2,tb_8828904,1,1566099605110,2,0,这个赵参军是不是个喜剧演员啊？戏份不多，却每每看到他有点可爱中有点搞笑~
42,375283603,65,活动必须积极,6,1566097670956,0,0,。
42,1140139285,28,mloanding,0,1566096172692,1,0,良心作品
42,793196213,6,加勒比976,6,1566096006145,0,1,不错呦
42,1037222973,11,沙漠依米花花,3,1566091952311,3,1,当官的口才果然了得啊！我再知道为啥每次去找领导谈都不会有结果了
42,1762133954,2,U滴o标准同学哈伯德,1,1566076407361,0,0,龙好酷，喜欢
42,1070666034,6,大叔叔1481902948721292,1,1566076037331,0,0,大爱
42,1133384389,61,任凯歌728,6,1566057373284,0,0,真美啊
42,1752100045,6,8聪慧deY蜜尔娜最,1,1566056903691,0,0,萧规别死，，，，，，，
42,1119685772,33,julia19525,5,1566055973154,0,0,张小敬燃
42,1544381983,14,喝一箱七喜,3,1566050199369,0,0,挺好看
42,1040204444,20,pdhdmum,1,1566031310541,0,0,眼镜掉了一地
42,393202318,51,JY20771879,6,1566024746284,0,0,林九郎怎么样了？
42,855441440,31,魅影6868,5,1566022115562,0,0,站在你背后的鬼(#ﾟﾛﾟ)≪看后面看后面!! (-_(;ﾟﾛﾟ)嘿嘿嘿
42,1325981173,32,牛8震波,4,1566018573266,0,0,好看
42,956120897,29,叶七七12j,5,1566017442357,0,0,真精彩的，萧归的人设演的太好了
42,1201064250,38,莉迪亚的霍布斯,5,1566012675899,0,0,卧槽，龙波，败了～～～
42,1743613527,10,卡拉格黑压压,2,1566000350017,0,0,好看好看
42,1133384389,61,任凯歌728,6,1565970675308,0,0, 完美的剧
42,477475856,77,粗心de金色先锋同学,6,1565970373613,1,0,我觉得圣人不是神，张小敬才是神，怎么搞都搞不死他，如果他能上月球的话估计也行
42,1105104839,18,倒叙x时光63930,5,1565970321145,0,0,电视剧看到这里，我发现圣人真心爱着林九郎，为了他想尽办法除掉自己的儿子，然后把大唐送给他[勉强]
42,795356258,8,586885haha,2,1565961145378,0,0,其实张小敬就是个臭傻逼，因为他才死了好多兄弟好多人，闻染也白死了，他只是固执的坚持自己愚蠢的想法，
42,607573271,22,任小宇,0,1565960936722,0,0,李四郎倒是胆量不小啊啊！有点帝王的大气
42,1003757084,18,wang_61260924,3,1565928417325,0,0,周一围好演技
42,1195726193,10,亲亲宝贝196348476,3,1565921833736,0,0,2018.8.16
42,1350512488,16,诸葛亮4481,4,1565920043346,1,0,一个二傻子的故事
42,1090389835,19,可喜de欧阳锋o,3,1565885558961,0,0,后面的剧情太扯了
42,1579909431,29,澹台a古墓,3,1565880845723,0,0,圣人终究是圣人啊！几句话就把萧规满腹的愁怨说尽了…
42,1579909431,29,澹台a古墓,3,1565880237041,0,0,萧规这出场太霸气了👍😄
42,709876733,78,妍俞飞媛妃,7,1565877189585,0,0,为什么后面几集要有王蕴秀的戏！
42,791719868,57,PerkinsLiu,6,1565870964753,0,0,拿弓箭的那个就是丁老三
42,424013020,39,索妮德,5,1565857635452,0,0,周一围，舍我其谁，霸气
42,1226294754,21,路路75057,2,1565854213967,0,0,太子是主谋
42,1485208956,5,陈立农的女朋友1003,4,1565854092705,0,0,周一围演的饱满。这是才是真正的演技。
42,1199610754,17,写实滴兰花,4,1565844127889,0,0,张小晋没人信了，兄弟反正是不会信他了，她害兄弟害朋友，偏偏帮的不是兄弟那些人
42,1051133156,43,国服第一Acup,0,1565838739212,0,0,哈哈哈哈，死于话多
42,1479686688,20,养同学的拉塞尔,2,1565834985173,4,0,张小敬是一个军人，士兵突击里的许三多，他有他的信仰，并为之守护奋斗一生。何为大义？我守了我的道，张小敬杀身成仁，毁己护道，他没有错。看不惯他的人，因为你心中的道与他不同。道不同不相为谋。
42,1373969396,23,晓芹_,2,1565826622277,0,0,徐斌是幕后黑手
42,497925113,20,四分阴阳化无极,6,1565820687666,1,0,徐璐在这部剧中的造型还是蛮好看的，比在海上牧云记中要惊艳
42,1732540895,33,拉瑟福德馒头酱的,1,1565810734283,0,0,编的太离谱[无语]
42,1377700270,31,魏武之世,4,1565805749654,1,0,就没人觉得太子很轴吗？
42,1234600447,7,小菲子201298,1,1565795929968,3,0,良心剧啊，后面何老发飙飚，龙波登楼真带劲[大拇指]
42,505151861,28,叶尧,7,1565795280729,3,0,我觉得张小敬守护的是第八团兄弟们心目中的长安，一个强大美好的长安，如果这个长安错了，那第八团兄弟们的守护也错了，他们的死将毫无意义，也没有任何希望。
42,1333164003,20,lm_zx,2,1565790059961,1,0,什么情况？
42,1757028595,5,多肉小w,1,1565777059661,0,0,萧规的鼻涕太敬业了叭！
42,729672973,7,偶然牛B,1,1565770997001,3,0,整部剧可以当成喜剧片来看嘛！兄弟坑兄弟 爹坑儿子。上级坑下级。男朋友坑女朋友。挺好的看着挺开心的啊
42,1736035499,11,de超胆侠h相当激进,2,1565768425795,1,0,太离谱了，如入无人之境
42,1300161491,30,微微安1111,5,1565762827438,3,0,圣人与百姓，几句话，就让肖规泪流满面，普通人，委屈，就是想听句，我懂你！
42,1132078785,5,w养赛薇亚拉,0,1565762752205,0,1,这竹子都接在一个点上藏得住吗？这活脱脱是在地上接的啊
42,1091313037,2,蓝皮鼠1484750505698619,4,1565757438862,0,0,为什么中国就喜欢这样自己骗自己！
42,1114855228,100,de科克尔T能吃苦亲,3,1565746937076,1,0,周一围演的还是可以的
42,1630360703,36,cz影子,1,1565746798379,0,0,芦芳生换了个造形，差点没认出来。
42,1255399081,16,排气管5555,1,1565720454595,0,0,徐宾绝对是幕后黑手！
42,1608106008,12,wrx露露,2,1565710056326,3,0,张小近，在我看来身为他朋友都是他的棋子，他的不简单，都是牺牲兄弟换来的。
42,1349387488,24,红尘嘟醉,3,1565709802698,2,0,鱼肠与张小敬打斗那段，尤其是上大齿轮，鱼肠跳的时候简直太帅了。
42,778206404,100,ykapp_3zupe952,3,1565709763167,0,0,周一围圈粉了
42,1163336559,25,black先森任纪元,2,1565707475740,0,0,其实萧规和张小敬做的一样，只是一个激进一个保守。只是想要个公平，要个为什么，守护的是什么。
42,1523965540,19,辉6848362143,2,1565707000196,1,0,喜欢龙波说话的魅力，魄力，好帅
42,1132939504,20,的马莎清净同学,2,1565705652904,4,0,张小敬还是背叛了萧规
42,513095070,29,梦维光坊,5,1565702617278,2,0,我是闻染，我在这里（黄泉路上）等着你哦～细思极恐
42,1360125421,37,Y小蘑菇健全的,3,1565702095687,0,0,徐宾是坏的
42,1048493400,24,cjiamin1998,3,1565698065737,0,0,继续追
42,1753315248,3,x丰硕dex丹聂耳极其,0,1565695464841,1,0,请问谁才是幕后主使我没有会员
42,950094721,21,二朵金花二根草,4,1565690481919,0,0,好看
42,447702170,48,ykapp_l0jmltvp,6,1565685875615,1,0,看哭了
42,1377447820,9,天河弱水20348,0,1565679808760,5,0,我们不是张小敬，也不是萧规，更不是花萼楼里的任何人，我们是看灯的人或者糊窗户的穷人
42,1036660232,49,剧中人vc,6,1565672673985,0,0,好看
42,1310733608,30,禄Y先生,5,1565670585331,4,1,越看到最后越觉得张小敬碍事！
42,1126940276,39,末世de快乐,6,1565669260394,0,0,电脑网页怎么没有记忆播放了，显示有播放记录，点开每次都从头播放呢，谁告诉下
42,1035077554,6,仅此而已_eva1,6,1565669009479,0,0,"大结局了
"
42,783089154,2,迈卡的戚酱,6,1565668939904,0,0,你确定你看懂了吗？//有惊艳的地方，但是剧情也太不严谨了，讲故事不是要有头有尾吗？讲一个好故事成就一部剧一批演员。
42,1729569696,5,龙jinglian,2,1565652868614,0,1,突然觉得元载好可爱
42,617631376,39,喜欢排球的王孙忆灵,6,1565620129865,0,0,萧规也软了 张小敬该死 鱼肠可惜 立时射死 震荡天下！说那么多都是屁 干不成大事 害了跟你一起干的兄弟！
42,779487163,9,makeornoise,1,1565618980128,1,0,剧情有些空洞化，不严谨。不过算是今年的好电视剧了，给个赞[赞]
42,716364842,7,世纪罗汉,1,1565618344513,1,0,张小敬磨磨唧唧，尽坏事儿。。。
42,716364842,7,世纪罗汉,1,1565618050722,3,0,张小敬能不能不要捣乱，烦死了，支持龙波
42,1426964809,20,聪明伶俐小可爱吖,3,1565610484490,0,0,超级好看呀
42,1725916680,10,邴de帕克同志,2,1565603803140,1,2,有惊艳的地方，但是剧情也太不严谨了，讲故事不是要有头有尾吗？讲一个好故事成就一部剧一批演员。
42,1318000708,14,Y单纯deA希克斯非常,3,1565601361002,6,1,越来越烦张小敬了，妈的，出生入死得兄弟死绝了都，
42,1181606312,12,_滑稽de艾尔玛,2,1565599450718,4,1,感觉到后面有点扯
42,1558026647,7,琪琪的日本代购,2,1565595247250,5,1,不知道为什么，我希望龙波赢
42,784595212,27,姚翔超帅丶,0,1565592669681,0,0,徐斌的金币交代了啊。何富有钱，肖规需要金币买付火雷材料。
42,586617085,24,黑白的小熊猫,2,1565592132326,0,0,啊48集是结局了吗，好期待
42,1121284702,28,宇峰轩言,4,1565590470986,0,0,阿爷都自身难保咋救你呀！永王😂
42,1121284702,28,宇峰轩言,4,1565589393379,0,0,城外皇庄看谷子的盖将军😂
42,1121284702,28,宇峰轩言,4,1565589077893,0,0,右相这怕死劲儿，哈哈哈
42,1404867743,32,i脸喵,5,1565586667032,1,0,好久没像这样追下来整部电视剧了
42,1228767476,25,w玛瑞TwT,4,1565584315872,0,0,1
42,440326565,54,ji76490465,5,1565583662144,0,0,我突然觉得徐斌是大boss [黑线]
42,1023850156,55,繁华留年印1477596277706348,6,1565581860978,0,0,"好看
"
42,1140955010,7,strong3626,2,1565579448521,0,0,圣人要射箭，萧规后来那一笑是什么意思
42,1017039427,10,盲流子deidei,2,1565577863712,3,0,我不说张小敬好还是坏，我就想说他好像就是个克星，只要他说为谁好，在帮谁，谁最后就死了！！！！
42,1753182659,1,丰子源15,1,1565550491949,0,0,差评
42,1750981772,3,0混乱的8鲍恩很,1,1565534931566,0,0,也补更新了
42,324046929,77,微雨轻云,7,1565534279405,0,0,永王这个是配音吗？声音听起来有点浑身不自在啊[汗][汗]
42,1012501608,12,Hard_Spring,2,1565533718892,6,0,可惜啊。张小敬在保护百姓的同时，也保护了权贵集团。他卖了小乙，牺牲了兄弟，这么尽心尽力，现在还是死囚之身。尽忠职守，还不得好报，实际沦为权力斗争中的棋子。看到这里，觉得不值。
42,1491415120,23,雪旖旎06139,4,1565521751693,5,0,周一围演的不错
42,1190679642,10,武功盖世de欧阳o,2,1565518792056,0,0,张小镜这个轴人
42,1030418000,28,卢修斯的莉达1478400256598566,6,1565507673152,0,0,这几个徐宾的广告都好萌啊，么么哒
42,1037305852,13,pebblelin1478917202577966,4,1565507366200,0,0,太子的人啊
42,1030418000,28,卢修斯的莉达1478400256598566,6,1565507282038,6,0,这个部分有点单薄，如果就几句话就瓦解这样规模的行动，那这个首领意志不够坚定
42,1037305852,13,pebblelin1478917202577966,4,1565506011359,1,0,没救了
42,1037305852,13,pebblelin1478917202577966,4,1565505409449,0,0,跟着灯到大内了呀
42,1246554926,26,Rene68805,2,1565503066361,5,0,谁去杀了张小敬
42,1223758376,40,Zyqqqqqqqq49186,5,1565501118720,0,0,太一太活稀泥！
42,1750981772,3,0混乱的8鲍恩很,1,1565499141240,0,0,什么时候更新最后两集
42,1435375785,17,得意de八部天龙M,3,1565499051571,3,0,周一围简直神演技
42,1432491641,17,愿你玺,2,1565498391132,1,0,阑尾了
42,759114412,19,沙漠王子31863764,2,1565497938218,4,0,"我草你祖宗死烂片
"
42,848745993,62,小苏烟26,6,1565497711177,0,0,不错啊。 。。。。
42,1010234333,16,蒹葭苍苍24249,3,1565493078712,1,0,这个和小说不一样呀！
42,1214110955,10,年年有余61441,3,1565455580120,2,0,太扯了 
42,1084613622,17,云朔灬灬灬,3,1565451272166,2,1,墨迹个啥？赶紧处理了得了
42,817357673,4,睡眠宝宝33,6,1565449200835,5,0,圣人不是神是人，张小敬不是人是神，因为张小敬穿了神装，狂徒，反甲，复活甲，大吸血，无尽，攻速鞋。
42,1373443356,18,boku糖糖,2,1565443841702,8,0, 我怎么那么希望萧规成功泥
42,379223496,26,destiny1111,2,1565440568316,3,0,这人设全崩了啊
42,1718841760,9,滴黑莓w非常谦让,3,1565436541258,3,0,这个也太扯了把
42,570738135,41,只能呵呵不能多说,6,1565433725500,8,1,肖规才是大好人，真男人，男主啊
42,570738135,41,只能呵呵不能多说,6,1565433630345,7,2,看这剧我就想大喊：谁能去阻止张晓敬，别让他害人捣乱了？？？？？？？？？？？？？？？？？？？？？？？？？？？？？？？？？？？？？？？？？？？？？？？？？？？？？？？？？？？？？？？？？？？？？？？？？？？？？
42,1037579761,56,tianxie7829,6,1565430820672,2,0,鬼扯
42,722969012,9,FM调频512,3,1565428186708,0,0,灯山里面的人都只剩两个拚命打斗的，请问谁来燃的灯？
42,1128335789,8,纳西瑟斯88358,2,1565425798574,4,0,不成功有时候就是因为话太多！
42,1334375623,9,冀w钢铁侠,0,1565423478905,6,1,好想张小敬掉下去，是什么心理？
42,709060351,14,李_泽渊,4,1565421721978,3,0,萧规那么好骗？
42,992108474,20,不错酱l黑寡妇Y的,2,1565419700388,0,0,么么哒😂😂😂
42,1158677129,8,机灵de亦寒i,2,1565419419480,0,0,谁去然的灯
42,590774917,24,呆呆呆呆呆呆米,4,1565418658299,5,0,鱼肠真的让人好心疼
42,1722807620,8,滴伸缩人x非常精密,2,1565417878361,1,0,为啥圣人需要牺牲严太真性命
42,1721654461,11,黄瓜滴亲邓肯,2,1565413637002,4,0,没想到最能打的是皇上[呵呵]
42,1573817672,11,憔悴的x教授酱,2,1565408609698,5,0,这不是我想看到的，支持龙波
42,1359474144,7,zero4000831119,1,1565400846813,0,0,这就是信仰的力量，人是要有信仰的
42,424608639,24,米迦勒18415,4,1565395380255,13,0,元载必须死
42,1751904788,43,的夜夜x非常香甜,1,1565374826996,2,0,剧情真是一波三折，看看怎么交代吧
42,1227498844,35,阿六宝本尊,4,1565367746309,3,2,这剧情转得太突然。。。。猝不及防
42,1720843971,9,君似玉十分a迪肯斯滴,2,1565367116129,3,1,雷佳音就是个狗
42,1042074999,52,一只爱吃鱼的懒猫,6,1565366992773,1,1,雷大头前面演技挺好的 后面就总是一个表情啊 尤其嘴巴…
42,743523154,8,阿峰网店,6,1565365018416,6,0,姚汝能去哪了
42,1017228099,25,追光者17111,2,1565364921784,6,0,突然觉得鱼肠真性情，喜欢这个角色了。
42,600246848,40,暗夜里的一颗流星,6,1565364638483,0,0,不会吧……这么容易？
42,1720843971,9,君似玉十分a迪肯斯滴,2,1565364439580,4,1,张小敬就是一条狗
42,1506229951,5,de大白殷切,0,1565363858700,2,0,做事一定要果断，要不就别做了
42,761773891,6,张铭71447,3,1565363746485,0,0,现在的人啊，好像喜欢格外执拗的人，就能证明自己很酷一样
42,1704209009,12,的略微自在0索伦,2,1565362764372,6,0,忍受，妥协，大人物的一句话，小人物就感激涕零，殊不知这只是骨子里的奴行！身体为了生活被别人束缚就算了，连思想也被禁锢的话你就不是一个真实的人。因为萧规更加真实，所以才会被大众所认可
42,1183015675,6,a110165362,4,1565362336611,0,0,到最后都在扯淡
42,1441493651,9,大头胡言,1,1565360714932,4,0,现在的剧怎么都喜欢高开低走？
42,1244943361,15,xingzi198080,3,1565359362772,1,0,龙波这么地就被打动了，放弃计划了！
42,1244943361,15,xingzi198080,3,1565359292487,3,0,确实是瞎编了吧
42,1244943361,15,xingzi198080,3,1565359247238,0,0,被他骗了
42,1244943361,15,xingzi198080,3,1565358740447,0,0,今天先查的哈
42,1244943361,15,xingzi198080,3,1565357796047,5,0,权力下放，却没有制度约束，那不是改朝换代吗
42,505941401,33,司令大大,5,1565355686758,1,0,禁军就这水平吗？
42,580599764,13,曹子鑫,2,1565352648290,4,0,鱼肠也太飒了吧！勇断左臂啊😱对萧规也是爱到底，死心塌地
42,1305377730,10,嘤Y阿信,2,1565352606388,3,0,到这一集就编的太离谱了
42,1043044517,28,易上头已喝醉,2,1565352153251,1,0,后边几集感觉不精彩了
42,1732599561,9,五合园家的德云女孩爱拢龙,2,1565351772759,1,0,看哭了
42,382875531,10,779656553,2,1565348820320,1,0,"天使会为了世界而负你
恶魔会为了你而负世界"
42,1737391533,8,爽直红糖略微滴l,1,1565344942467,0,0,第八团活下来的9个也是问题，不只是盖嘉运，没原则的萧规
42,1534748115,31,倾国倾城的璐易丝桑,4,1565343164301,7,0,md 超级不喜欢张小敬了  
42,1556316581,8,_热烈de塞缪尔,4,1565341886210,3,0,这个圣人有病，人都是有私心的，尤其林九郎这种一人之下万人之上的人，圣人想权利下放大家抗起江山，林九郎就会想大唐江山改姓林，而且未次会不择手段！
42,1122605639,9,艾卉9934666,1,1565337169178,4,0,看哭了
42,1122605639,9,艾卉9934666,1,1565336862291,4,0,皇上关键时候还是胆识不一般的
42,1122605639,9,艾卉9934666,1,1565336429751,2,0,万民期待燃灯，颇有点咱们期待春晚的感觉…………
42,1122605639,9,艾卉9934666,1,1565336200117,1,0,我看过的最精彩的剧
42,1122605639,9,艾卉9934666,1,1565336066355,1,0,龙波保张小敬。。。
42,1384355269,25,自由色彩58,2,1565334394448,2,1,前年还行，画面真好。但是也不能光靠这个啊。剧情后来太磨叽了。也弄不懂，这要表达什么意思。
42,1384355269,25,自由色彩58,2,1565334174824,1,0,他们整来整去白死了多少兵，那些不是命啊
42,1384355269,25,自由色彩58,2,1565334123621,0,0,后面真是看不懂了，皇上是好是坏啊，右相不好，怎么也不办他
42,709494504,45,我在等一个蘑菇,4,1565334089527,0,0,张小敬太过自负
42,856091969,38,Saint75893184,6,1565333611969,3,0,这是我过的最漫长的十二时辰
42,1043243465,23,奔跑吧蜗牛64396,3,1565333369585,0,0,为什么12，43集加载不出来，其他都没问题，网络也没问题
42,788911799,30,氵夏沐子87746,5,1565332856705,2,0,太莫名其妙了吧，感觉像强行圆剧情
42,332897188,2,鏗鏗,6,1565331606455,0,0,打劫
42,1363039664,9,caicai10403,2,1565327114995,2,0,其实圣人不坏，这个位置没人做的好
42,1039362633,26,pepper6301478933769251548,5,1565324266221,0,0,鱼肠是否没死
42,928048299,4,心有猛虎细嗅蔷薇jin,4,1565323284473,0,0,周一围你以后便是我的偶像
42,1067363425,14,水蓝色的眼泪r32,1,1565322583758,2,0,龙波变成我偶像了😆😆
42,1386415020,35,仲桑de艾萨克,5,1565321575257,0,0,支持龙波[呵呵]
42,1336506411,20,东北四季分明,2,1565321036411,1,0,祖国万岁，中国必定强大。
42,845354088,54,典雅同志T哈代哈迪Hde,0,1565320461834,1,0,这个圣人的嘴巴真的好像加菲猫🐱
42,1320028522,33,一叶未知秋00890,3,1565319950083,2,0,这张小敬真是搅屎棍
42,462217710,32,墨浅风华,3,1565319769912,0,0,救张小敬的都死了吧
42,1036666476,24,fionslie,6,1565318157714,0,0,堂堂一个宰相，这个元载也太猥琐了吧
42,767425858,100,小开心674,2,1565317726320,0,0,这更新真是随性得很，有权就是任性，
42,1731035991,11,能干黛碧十分deu,0,1565316582537,0,0,鱼肠的胳膊是怎么回事
42,410162266,47,秋夜夜南南,0,1565313749014,0,0,看你吓的那样。，哈哈
42,761671210,100,伤逝40011439,6,1565307818706,1,0,"周一围演技是很棒
"
42,1029275568,36,振利1478267175598939,5,1565303737888,0,0,最后一句话，是什么意思
42,1581205292,3,w坦荡de司马,4,1565303451138,1,0,龙波有病
42,1581205292,3,w坦荡de司马,4,1565303357354,2,0,龙波尬呀
42,1720739558,8,de灰常繁忙胡佛君,2,1565301458951,4,0,后面几集是什么鬼，长篇大论胡说八道，圣人可以记住所有士兵名字，扯吧
42,1749664128,1,的瓦勒莉w极诚实,1,1565287453106,1,0,何老是彻底绝望了，分的餐根本没吃，唉
42,355133071,20,言简简12070516,5,1565283317640,5,1,瞎编，很多剧情不按正常逻辑走！
42,355133071,20,言简简12070516,5,1565282580367,2,1,这个剧太慢了，看着能睡着！
42,1176124777,15,楷楷看电影,2,1565280281955,4,1,这剧扯了吧，有点抢银行的感觉
42,816702500,4,曾经陆军,0,1565280161264,0,0,战友情战友情
42,1487381001,26,狄酱的内尔,4,1565279984161,0,0,为啥播放不了了
42,972797525,15,辛勤de温泽i,3,1565279518311,1,0,龙波不要信他！这个糟老头子！骗人的鬼！
42,1157114832,10,M憔悴de圈圈,1,1565279057195,1,0,圣人是曾志伟老师演的吗？
42,1017865607,16,esse58578,2,1565278079235,1,0,张小敬就是个骗子！
42,830426812,6,我爱我老婆CLH,4,1565278001083,0,0,宁王幕后
42,1017865607,16,esse58578,2,1565277886278,3,0,说自己是神！全靠一张嘴！
42,1043275305,12,drhj0472,2,1565277529573,1,0,那时候的人都有信仰。
42,1132908496,38,史努比库玛,4,1565276423950,1,0,这是张小敬 还是张小强啊 这生命力
42,420692301,100,DiorsQingnian,6,1565276295773,1,0,很精彩，很用心，周一围演技不错
42,1504726089,7,DDDM81943,2,1565276238295,7,0,有点没看懂，萧规听完圣人的话不是已经被感动了，为什么又变了？有看懂的说一下吗
42,1020705835,7,王国帆1477232401454745,2,1565275813096,1,0,民怨积累多了，一点就着
42,792056996,15,cordell123,3,1565275140947,0,0,周一围这段真是太帅了！
42,1046713626,7,hi彭小彭1479253781125257,5,1565274220515,0,0,圣人理想崇高，可惜所托非人啊，换个姓的人就一定好就不会有死心？
42,1525380302,15,鳄鱼加冕,2,1565273813267,1,0,圣人真是道貌岸然！
42,1613284591,16,辉8171668972,3,1565272608405,5,0,最能装的就是老大
42,1425066508,100,橘笙2023,2,1565272339251,0,0,把我吓到了 [黑线]
42,1613284591,16,辉8171668972,3,1565271957647,2,0,真的太假了
42,1362259508,5,饱满女绿巨人的很_,2,1565271731449,4,0,圣人的口才是真好[哈哈]
42,1210320200,100,Emilyniuhuibin,2,1565269572029,6,0,有谁和我一样讨厌元载
42,1035163522,19,我爱安安601,3,1565268221307,3,0,太啰嗦了，太啰嗦了
42,406257376,62,叻叻猪妈妈,6,1565267917055,2,0,张小敬人设崩塌
42,1442341123,26,zhl60333,3,1565266317540,5,0,后面的剧情好拖拉，为了凑集数，好讨厌，不耐烦
42,1559178558,10,游玺子哥,1,1565266316423,4,0,真是想给这部剧好评，不管是服道化，还是在各个细节的设计上，都从这部剧中看到了它在竭力做到最好，竭力呈现给观众最优质的视听享受[真棒]
42,1032656862,100,Speechless1478659987442370,6,1565266286658,0,0,不是会员更新五集吗？怎么这周又不更新了？
42,1558885137,24,夜魅佼龙,4,1565265947041,3,0,这部戏里面没有绝对的反派，有的只是选择不同，立场不同，
42,1558885137,24,夜魅佼龙,4,1565265845970,4,0,这大花灯放在现在看也是一奇景啊
42,951334244,35,Hacking-dead-family,6,1565265649852,0,0,我问一句:都没错？大唐为何能败
42,1026930439,17,懒懒的斐然,5,1565264841939,0,0,今天不更新？
42,599621474,100,swjtucheng,4,1565264797121,3,0,圣人就不该给第八团的弟兄道个歉么？
42,1553927289,31,迷茫人生55200,5,1565264442920,0,0,今天不更吗？😥️😥️😥️
42,1721106929,13,索的卤肉饭同学,2,1565263003810,0,0,为什么只能看一段一段的呢？
42,381459729,29,jxd91,4,1565261296614,0,0,今晚没有更新了？
42,832037456,24,桑de后羿涵菡,4,1565259235080,0,0,今天不更新了吗
42,502148005,21,jcat101,2,1565258476092,2,0,不只元载畜牲，张小敬更畜牲啊！
42,1030466343,15,XavieraJiang,4,1565257983729,0,0,今天会有更新吗？
42,726314210,32,陈劲权78564,5,1565255086085,1,0,今晚更新吗？
42,1147972801,21,骄傲的灯塔,6,1565254194383,0,0,只想问今晚更不更新？
42,371622888,10,wlsjsahy,2,1565253092797,3,0,萧规太帅了
42,1376832815,24,贺勇49678,5,1565252576842,6,4,电视越往后看越无趣，太扯了
42,363087544,29,小平鱼林,4,1565251229712,1,0,奇葩剧...
42,1521066417,13,菲tuan,5,1565249978710,0,0,今天不更新？
42,905590795,1,明雨19729,2,1565247173247,7,0,最讨厌这种 禺忠
42,1200089775,17,奥丽芙的糯米饭,3,1565244687573,0,0,借问……各位兄台～很好看吗
42,1135077693,17,晨辉1491571544598285,2,1565244229502,0,0,今天晚上更新吗？
42,1526853098,17,月亮81550,3,1565240967673,2,0,何为忠，怎为臣？
42,1095094204,18,南方有木i60334,2,1565240371917,0,0,现在，徐宾是要出来了吗
42,902135164,19,hydeqin,5,1565238915712,16,0,张小敬的三观是正的，为了民生，为了大意，因为他知道他救不了所有人，他可以牺牲家人，朋友，兄弟，只为了百姓。其实圣人只有张小敬懂。
42,757926782,54,怪物宾,6,1565238578825,1,0,永远都是死在批话多，要么就是磨磨唧唧
42,1362354223,46,葛w鲁思玛丽,6,1565238577989,6,0,圣人报出第八团人名的这段，安排的太戏剧了
42,806126156,13,JasonCronus,3,1565236143747,0,0,别的不说音乐是真的好
42,1038223431,33,啊挪挪44761,4,1565230718202,0,0,刚喜欢了一下龙波皇上两句话就打败了现在也不喜欢他了这个世界没对也没错百姓是什么只是......。
42,1021845205,22,姗娜1477380777778369,0,1565230447595,3,0,支持萧规
