,uid,userLevel,userName,vipGrade,createtime,voteUp,downCount,content
41,478044003,77,爱吃萝卜的fish,6,1565016495222,1,0,好悲壮。。。。
41,1584226989,43,WWloveLQ,1,1565016407838,1,0,完全失控了，蒙圈
41,1041919078,24,伴梦2222,5,1565016403152,101,0,官话说的真是一套套，华丽无比，实际不就是想和太真潇潇洒洒过晚年，不背上昏君的罪名吗？
41,387572824,100,10小东01,3,1565016265762,17,0,韩童生这演技无敌啦
41,1124508099,35,漓木木,5,1565016239800,1,1,宇文融的功劳。
41,1705674030,13,三生三世十里逃花呗,2,1565016224501,10,0,不忍看下去了🙈🙉🙊，自认为龙波也是个伟大的人物，不忍心看到张小敬骗他
41,1690065553,9,泽佳70964,3,1565016167051,10,0,好希望蚍蜉能赢
41,339204632,3,zkq1031,4,1565016147755,9,0,张小劲就是烂好人
41,810219657,57,华岐,6,1565016142058,19,0,越发敬重萧规，真汉子
41,1531159306,31,2b青年孩子,3,1565016079077,0,0,演员，班底都好。但是真的太慢了。可能仁者见仁，智者见智吧
41,1410578921,13,土拨鼠之谜,2,1565015992942,1,0,不愧是圣人，高玩就是不一样
41,1467659304,7,i不快的白菜,2,1565015899628,2,0,看到后面就像京剧一样，要耐着性子才能看
41,1348902736,37,精湛的拉姆斯登,6,1565015878703,2,1,后面太拖沓了
41,1138745504,100,陆俊峰70557,2,1565015766835,18,1,越往后看，越巴不得张小敬早点死
41,1069129184,40,zjh惠1990,5,1565015732694,64,2,张小敬这人物就是慷他人之慨，来成就自己的虚名，这种人其实比元载更可恶
41,684395867,41,夜星辰37340170,6,1565015520215,3,0,好烦啊，信张小敬的全死了
41,366951432,15,孤烟飘袅,2,1565015490776,11,0,何监的话好感人啊[大拇指][大拇指]
41,1079580650,7,喜欢1483068470227385,3,1565015480531,7,0,越来越喜欢鱼肠了
41,1361835654,26,蕊蕊54575,5,1565015222980,0,0,为什么不马上引爆
41,1189194247,14,狂生唐,4,1565014962062,1,0,靖安司里面也有一个老子像，看着整个长安
41,387347266,31,davinci41,2,1565014892161,4,0,这一集简直可以吹爆啊 何监的口才 还有圣人的理念
41,1063635779,19,吕文琪1480828326416239,5,1565014886289,21,1,越往后越不喜欢张小敬了。。。。。。
41,846135775,43,汪积庆,6,1565014853431,2,0,目标，先定一个亿的小目标[吐舌]
41,463823472,9,pp萱萱呶呶pp@taobao,1,1565014783901,5,0,何为正义？
41,1034692034,36,fnity70115,4,1565014724947,9,2,张小敬的心软实在害了好多人，
41,1380283807,2,apetsut23562,3,1565014621206,1,0,你们没听刚才太子故意大声说吗？就是说给太监听的
41,1497572388,11,嬑翎,0,1565014552691,2,0,我的心态也矛盾
41,1311465088,4,老娘是花很奇葩,4,1565014539663,10,0,檀琪的造型[吐舌]艾玛😑
41,324129926,80,会飞飞飞飞飞的蜗牛,6,1565014488462,1,0,大人物看进去了有大用
41,324129926,80,会飞飞飞飞飞的蜗牛,6,1565014471095,0,0,神剧
41,1002741828,44,红衣小熊_2008,4,1565014413259,19,0,何老之言，振聋发聩
41,401162471,4,wangbrenda,4,1565014054912,23,0,张小敬，执意不肯醒来的人
41,1743499447,15,淡淡很dex幼稚君,2,1565014051923,4,0,为什么不把李必扔下去直接摔死，挖这些填不了的坑干嘛
41,1726895896,8,小肥肥hot,2,1565013996226,3,0,杀太子
41,516885897,48,木石2019,5,1565013945009,7,0,要灭的也是灭大明宫，关长安的普通百姓干什么！
41,1020411743,100,海鹰1477209390196965,0,1565013818775,15,1,周一围这男配厉害👍。不多的戏份，居然能抢这么👍
41,723030176,47,班里的资讯喵,0,1565013798628,10,1,有的人啊，看个电视都静不下来，总是拖沓啊、快进呀，人生有这么急么？
41,920141810,62,830101qingshanyuan,6,1565013675393,2,0,爽
41,1227971394,47,俊4952771004,5,1565013635959,4,0,骂得好
41,1165263335,15,月下独酌影一人,6,1565013507588,0,0,彻底脱管了
41,915428931,28,轻快克莱曼婷de越发U,5,1565013351520,5,0,被鱼肠和萧规弄哭了
41,369526567,72,那一抹浅兰,6,1565013308810,2,0,看到这里不知你们心中的正义都是如何定义的？
41,439159417,40,喵喵好萌哟,6,1565013295521,0,0,精彩程度堪比GOT第四季小恶魔的法庭自白！
41,818801998,100,yz我的妖孽人生啊,4,1565013294435,9,0,这样的电视剧我只会看一遍，和我的团长我的团一样。看着心里难受，不舒坦
41,1589762638,13,de猪哥哥拉格伦桑,2,1565013292169,11,0,突然不讨厌鱼肠了
41,1728367282,74,科波菲尔若伊同学de,2,1565013240922,29,0,好希望萧规能成功
41,1002741828,44,红衣小熊_2008,4,1565013238141,6,0,何老威武
41,337426497,36,只是个模式化,0,1565013211701,3,0,太拖
41,772583802,28,老黄牛enjoy,2,1565013160148,23,0,韩童生韩老爷子演技真好！！！
41,526865656,47,→街边舞者,6,1565013144401,3,0,徐斌是大BOSS吧
41,1360373975,25,1非常自豪绿巨人的,1,1565013139861,4,0,何老[大拇指][大拇指][大拇指]
41,1082280049,10,侧卫24419,2,1565013125642,2,0,哎贡献什么仙灯 到头来还是被耍一样
41,1442414719,8,公西v黄豆,2,1565013068333,106,0,真相渐出，大唐浮华外表下的腐朽尽现。龙波的形象更加丰满，忽不舍其死。
41,1189102765,100,皮特-豹,2,1565013014861,3,0,不要拦我，我要看元载
41,905512913,14,Siegfried86154,3,1565012993824,1,0,好帅！
41,1095549819,100,走在你左边18219,3,1565012980537,13,0,更理解龙波，萧规。民能载舟亦能覆舟！
41,838453372,30,皮嘉尔,4,1565012952472,1,0,没爆，没意思
41,1040464338,50,倚心,6,1565012835963,35,0,说后面拖沓的可能只喜欢看爆米花式的东西，后面说的是天下是人民的天下，不是一个人的，这个真的😊
41,1130760514,50,傲世法尊,3,1565012821403,17,0,崔器哥战死，崔器续承，崔器相信了张小敬战死，姚奴能为了守护战死。都是战死，李必如果真为太子不能牺牲百姓，长安百姓都死了，就剩下一个光杆太子与李必有何用。
41,1160393538,100,秀5947523148,2,1565012817672,1,0,好慢呀好慢
41,574493191,51,湖畔烟斗,6,1565012747423,9,0,说得好！何老
41,1197232222,28,红色拖拉机123,3,1565012735653,0,0,叫你啊马的林九郎
41,1495766145,16,daming6897,2,1565012725061,0,0,为什么是半集？
41,1141205089,20,wanna799,0,1565012371760,6,0,全部的问题就是这句这是朕的江山。如果有这是百姓的江山的认知就好了
41,512324320,7,卧－龙,0,1565012255686,10,0,张小敬才是寓忠
41,1731939606,10,好一只逆天的哈士奇,2,1565012133212,20,0,超喜欢雷佳音，但突然间有点烦张小敬
41,1429092023,16,fernandofeng7,4,1565012120249,1,1,拖沓。。。。。。。
41,915428931,28,轻快克莱曼婷de越发U,5,1565012044057,0,0,40集后面拍的真是好
41,1445327707,4,杨俊鹏31389,4,1565011834510,1,0,越来越无聊
41,1066855312,46,社会你二哥123,5,1565011733658,2,0,可悲
41,861168590,16,Di-Da39819,2,1565011667635,0,0,前排
41,1728367282,74,科波菲尔若伊同学de,2,1565011519457,2,0,张大敬，哎……
41,554141341,31,高芥鼐,7,1565011496277,1,0,太拖了
41,775279558,25,谈说自己,4,1565011439887,1,0,太子党
41,378204493,72,sun2522454,6,1565011326479,1,0,李四郎真有圣人的心态啊？
41,1037673641,8,stanburg1478919132887663,2,1565011246274,2,0,后面这剧情，就像小羊拉屎一样。
41,1037031290,13,BoomBoom有浅钱,3,1565011205978,1,0,我来啦！！！
41,1711468774,11,维文同志极度热烈的,2,1565011175451,8,0,以古喻今
41,503408420,38,echolee11,5,1565011083535,0,0,鱼肠好油腻一女的
41,1742025015,11,的费利克斯H特安定,2,1565010986177,0,0,圣人活了太子就不能活
41,1147219651,10,昨日重现29111,2,1565010963326,0,0,看的急人[勉强]
41,704282574,55,╰❥゛探✿赜,5,1565010806908,2,0,太拽了！
41,1597898740,9,lanlan18620,2,1565010751494,3,0,后面真的是拖沓到不行。。。。。
41,704282574,55,╰❥゛探✿赜,5,1565010744499,2,0,昏君！
41,1405944010,12,梦槿64214,1,1565010514125,3,0,李密李密
41,1503669223,16,老安元,3,1565010022267,1,0,来了来了
41,984272535,54,shawei9295244,6,1565009604903,29,0,好希望反派可以赢
41,1194764675,32,茹果呼呼,4,1565008223555,3,0,好棒
41,1207758038,21,千玺的红话筒,2,1565007033900,3,0,我来了
41,424333628,24,闰土菇凉,3,1565006995056,2,0,嘻嘻😁
41,495215474,33,汪汪汪小璿,2,1565006423802,4,0,来鸟来鸟
41,418373316,14,贝备123,2,1565005900861,3,0,沙发？
