,uid,userLevel,userName,vipGrade,createtime,voteUp,downCount,content
16,1153484579,13,陌繁llz,3,1562651919930,0,0,哈哈 我喜欢那个奶胖奶胖的婢女 小丫头说话有意思
16,1305428081,25,笑若忘书-,2,1562651607127,0,0,何监是大boss
16,1721555121,12,de白饭i十分灼热,2,1562651214518,1,0,小胖孩有点醋意
16,371145398,65,TxiaocaoT,5,1562651150291,0,0,吐槽更新的各位看来都是会员啊
16,1721555121,12,de白饭i十分灼热,2,1562651078686,2,0,高兴😊，又看到小胖姑娘了
16,1035790964,47,念有88,5,1562650808539,0,0,"也太
好看了！！！不想等啊！"
16,1472975485,12,白色23238,2,1562650689844,0,0,这是真正的度日如年啊[勉强]
16,927213082,22,敏捷的伏地魔同志,3,1562650289648,3,0, 四字弟弟不错！雷佳音演技真的让人跪服！
16,1507453286,3,当里咯儿当我就是王小当,5,1562650215112,8,0,色系，配乐，每看一集简直就是看大片，细节做的太厉害了，剧情烧脑，张都尉，步了好大一盘棋子，应该就是为那些一起在战场的兄弟报仇，大概是这样
16,1724585890,13,桑充沛非常-橙子滴,2,1562650146396,1,0,后面几集，灌水太厉害。切勿自己美剧24小时，有差距。
16,835281041,37,倾田一生,3,1562649948356,3,0,陆三这一天也是真能跑[泪][泪]霓虹优秀马拉松选手来长安当传信的[黑线][黑线]
16,1239791745,39,better0809,6,1562649909087,1,0,最后这情节也太假了吧[狂汗][狂汗][狂汗]瞬间拉低了分数
16,835281041,37,倾田一生,3,1562649823060,2,0,徐宾这死的也太难受了吧[黑线][黑线][黑线][黑线]
16,565438229,91,linaynkm,3,1562649505984,0,0,有本事一周更新一集～
16,833811928,100,心若一動淚便傾城50867085,4,1562648973233,4,0,美剧 。。。一周一集  也没见你们埋怨过
16,414710403,49,海和天空55880222,5,1562648804530,49,0,那个品种就那样，叫细犬//那只狗狗好瘦有没有人给它吃的，而且刚一抬腿就吓成那样，看来没少挨打，好可怜的狗狗
16,1537677343,20,清清00646,4,1562648768363,2,0,张小敬拉的那个马车快要撞上坐在地上的小孩，马车的轮胎从小孩抓的辫子上划过，好惊险啊
16,928989062,61,niu8006570271,6,1562648595596,3,0,不是不播不是播的慢 是在等商机 等大的赞助 营销模式而已
16,1042589890,17,miumiuhe008,5,1562648572605,0,0,这更新方式也是醉了
16,1550236909,9,1多才de萨克巨人,2,1562647571477,3,0,不相信徐宾就这么死啦！不甘心
16,1326135747,100,游传珍2013,0,1562647525458,2,0,好看精彩
16,1326135747,100,游传珍2013,0,1562647519871,0,0,更新太慢了
16,1059888908,42,街角丨人民49316,4,1562647343672,1,0,25集变48集了，看来剧情要拖沓呀
16,903384369,32,亚会00000,4,1562647133622,0,0,这种更新速度对于悬疑剧来说，简直是致命伤啊！为何不每天更新，这样看起来剧情才能连贯，看得也酣畅淋漓。
16,1518741075,29,善解人意de芒果A,5,1562647015455,21,0,那只狗狗好瘦有没有人给它吃的，而且刚一抬腿就吓成那样，看来没少挨打，好可怜的狗狗
16,1492878340,27,郑磊1252,5,1562646910053,0,0,怎么还没更新？
16,390891847,73,贝塔和舒克工作室,6,1562646840115,1,0,这是不是要一年出/10.集啊
16,1041082498,34,慢慢_mushroom,5,1562646637339,1,0,千玺说话不清楚 剧情真的有点好看吖 千玺加油 徐宾盒饭了 我很伤心啊 
16,1238310153,18,tb232710_44,2,1562646317739,1,0,怎么还不更新，好烦哦
16,1213511770,24,ZaniLia女神,4,1562646292184,1,0,好看，易烊千玺只是听不懂词
16,1045659747,16,慎重姬儿的尤其-,2,1562646174135,3,0,那些说剧情简单的，因为前面的都是开胃小菜，大戏还没拉开序幕呢，
16,382098616,100,A_苏大爷,3,1562645585204,0,0,"还是星期四晚上10点更新吗？
[飞流吓死了]"
16,1474033139,100,小花67869,3,1562645503960,0,0,周一为啥不更新
16,1233213148,26,HoH赫德森v,4,1562645498142,0,0,为了追剧，充了会员，结果要周四才看得到，而且一周才四集
16,989213356,100,汤姆布利伯_,2,1562645410937,0,0,靠重刷度日[吐舌]
16,1047691690,22,zy19971479278353447432,5,1562645396273,2,0,"一天两集不好吗,,Ծ^Ծ,,"
16,1505073852,12,翎上_十三,2,1562645238839,3,0,为啥还不更捏 着急死我了
16,1214120478,28,成凯76663,2,1562644972821,0,0,怎么还不更新啊 
16,1727566179,100,未央嘉禾,2,1562644495754,1,0,每周四更新4集，等着吧//为什么看完16集以后就不更新了呢？啥时才能更新呢？很期待啊。
16,1727566179,100,未央嘉禾,2,1562644393675,0,0,这种更新方式也太怪了，会员一次4集 非会员一天一集？4集一般一次性就看完了 剩下6天干嘛？
16,1147406935,100,蚂蚁111321,4,1562644391859,3,0,一下子给我看四集，还不如一集一集看呢！哼
16,346404553,35,风起时酷,5,1562644302789,0,0,"我以为周一到周四 一天一次 天天来看 咋还没更
 "
16,1431287439,21,蓝色眼泪豪儿,2,1562644127943,0,0,能不能多更新啊，要不就一天2集好了
16,1316767679,85,的霍齐亚T热情同学,5,1562642927018,4,0,更太慢  一周四集看完完全放空了
16,1013775713,19,小康康42427,4,1562642524899,2,0,我去，我以为就12集，结果48集，后面故事怎么演？别拖沓剧情凑集数，好不容易看到一个像样的剧，别烂尾！加油
16,1140826893,30,QAZPLM1234567890PLM1234567890,5,1562642292788,0,0,更新呀，怎么不更呀
16,946990392,52,阿黎199240018,0,1562641430609,0,0,昨天为什么没更？？？
16,1523107269,11,文明的水笙同学,0,1562641232641,0,0,不是20几集吗 怎么48集了
16,1537322640,17,0忠心耿耿de埃文,3,1562641190980,1,0,真累多放几集
16,1439790589,28,yxh1198162736,4,1562640622535,3,0,更得太慢，没热情啦，看小说去咯！
16,1192024556,22,佳欣96409,0,1562640254640,0,0,更新太慢了
16,701812117,23,ss2xx,4,1562640236333,0,0,会员看完不加更，还要等着非会员一起？？！！太……会员有啥用
16,1018347608,10,美嘞美嘞43392,2,1562640133553,0,0,24小时
16,1057558505,42,绿水何忧,6,1562640019666,0,0,长安十二时辰 什么时候 加更啊
16,911181742,11,购物的耶路撒冷,3,1562639560272,24,0,"徐宾能不能不要死，大案读数是他发明的，竹纸也是他发明的，张小敬也是他救出来的，一心为大唐的也是他，这么好的人，怎么可以死。
"
16,1061633311,19,sifucheng1480518488494992,5,1562639340596,0,0,一天一集吧
16,1016779169,23,凡夫俗子6603,0,1562639122493,0,0,昨晚为什么没更新
16,996315566,39,火柴头头43304,4,1562638713326,2,0,啥时候加更
16,1522527993,11,阔落10027,0,1562638564717,0,0,为啥没有更新啊[不高兴]
16,944730369,20,安达燃气,2,1562637549800,0,0,会员周四四集，非会员周一到周五一天一集？啥规矩
16,850398711,42,英梅666,6,1562636863286,0,0,更新太慢，我要暂停追剧，等全部更新再看
16,1199531281,10,杜杨72031,4,1562636535545,2,0,崔器，徐宾同样是好样的，得力干将，就算冒着被怀疑的风险也要守护长安百姓。姚汝能到底是好人还是坏人呢，看剧情有点像右相的人。
16,809747920,22,灵犀公子,6,1562635960583,0,0,只有周四更新，不够看，加更
16,1014633509,29,九爷98882,4,1562635898625,0,0,剧是好剧，更新速度是硬伤
16,940348143,8,觞痛521,6,1562635758756,0,0,更新快点吧，没准备好就不要放出来，你这样是啥意思？豆瓣给你差评是有原因的，
16,807606127,25,CreditEase庞龙,6,1562635750953,0,0,演员表里为啥没有我崔器哥哥😄
16,1599277898,15,略微的苦恼哥尔斯密,3,1562635491101,0,0,怎么没有达
16,1045179138,40,昵昵小太阳,5,1562635464829,1,0,为什么从24集改到48集呢？12个时辰能拍到48集吗？为后面的剧情节奏担忧。原来以为高潮要来了，也快结束了，突然看到变成48集，想不通啊。
16,1727352409,10,_纯净的_帅帅灰常,2,1562635428905,0,0,为什么还不更新
16,1349373310,37,琴5257946987,5,1562635314009,0,0,很快中国也要一周就更新一集了
16,912372163,25,yaoyao261313,3,1562635061456,4,1,总体来说智商还是普遍偏低，搞笑剧情太多，逻辑不密，不合适！
16,1246490798,14,墨渊上神1996,3,1562633696462,0,0,强烈支持改进更新方式！
16,1046603157,16,张丹1479251311453694,4,1562633153399,0,0,这是什么更新方式！！！
16,1456329527,11,颜_诸葛神候,2,1562632710806,0,0,算了不看了 更新慢 等出来下集上集说的啥都忘记了
16,842611714,20,毕津豪,2,1562632411381,0,0,"在不更新会员到期了
"
16,408704198,50,风儿吹----,0,1562631778752,2,0,为什么现在的电视剧都是大几十集，就不能少点？
16,1087199253,35,雷神耍大锤,3,1562631574720,0,0,为什么看完16集以后就不更新了呢？啥时才能更新呢？很期待啊。
16,1589693266,10,浅浅的面包97850,2,1562631506692,0,0,我易加油，帅呆了
16,1133016913,25,v孤独的赫德森,3,1562631187999,2,0,这更新。太慢
16,1504889866,17,吉祥如意小胖胖,2,1562629444194,0,0,好剧，真心点赞！
16,1214893200,34,w斯威特-,6,1562628504357,1,0,近几年以来最好的剧
16,449466217,27,理解各不同,2,1562628323151,1,0,不是24集？怎么回事
16,1337298912,38,景x小草,5,1562628157890,0,0,昨天就没更新。才16集。
16,337864534,12,大猩猩ken,2,1562625856115,0,0,我一晚上从2点开始看完了16集[吐舌]，现在马上早上7点了
16,340916049,35,顶天立地一男子,5,1562613917195,0,0,咋还没更啊
16,321232027,49,DCW-钰婷,5,1562610730277,2,0,剧情紧张，画面精良，原班人马，同一ip，故事情节能衔接上一季，能让人追十年。
16,988220981,26,爱的礼物1999,5,1562609973112,2,0,越来越好看了
16,1460900684,16,TiAmo你奶奶个腿,0,1562608330641,1,1,看到这集一星不能再多了
16,907050836,29,穆如铁骑,5,1562606357688,7,0,此剧凭一己之力拉高了国产剧的标杆！
16,1186155673,42,我是贾仁禄,6,1562606024379,4,0,强烈要求每天更新！同意的顶！
16,1499156732,11,消瘦de妖精Y,2,1562605433707,1,0,不看了不看了，等更完了再看，太累！
16,1716845218,12,罗斯金特滴x素雅同志,2,1562605297774,1,0,评论右边的长知识，看完你就是“长安人”了，观剧更爽
16,1655730591,12,滴同学菠菜厉,2,1562605218073,2,0,催更
16,1716845218,12,罗斯金特滴x素雅同志,2,1562605157718,2,0,三女应该是姚如能，姚如两个女，能算不
16,676698793,20,_48576435,2,1562604140826,1,0,就想问，张小敬的刀是摆设吗
16,1485892024,26,老杜0769,4,1562603766048,3,0,很久没看过这么巴适的剧了，更新太慢最大的遗憾
16,1207848776,16,爱跳舞的娣娣,2,1562603607628,2,0,好剧，是一部难得的好剧
16,1719475007,10,滴昭君u格外轻率,2,1562601838964,0,1,热血长安也很好看，大家去追吧，不用等得那么焦虑
16,1436879549,22,尊敬的盖尔,3,1562601323875,3,0,更新太慢了！[鄙视][鄙视][不高兴]等到花儿也谢了…
16,1485711367,24,VIP7442686474,4,1562601115155,18,3,几个人就可以把长安搞成这样，守长安的就这么点兵吗？拍的挺好，就是感觉太不现实了
16,1034974130,51,我不是会员哦哦,6,1562600985198,0,0,下周更新见
16,820128654,23,Dou93953016,0,1562600933048,5,0,可笑的是居然有人说剧中都是日本元素
16,1622424169,9,猫咪喵呀喵11191,2,1562600871334,3,0,精彩才刚刚开始   太好看了
16,1722596727,5,de谢利v十分威严,2,1562600663686,0,0,要么就一天一集
16,1496189207,13,此时此刻思无邪,2,1562600544708,6,0,拍得确实牛逼 比一些电影拍的都好
16,638664124,100,_110988566,6,1562600362106,0,0,这狗这么瘦不会结石了吧
16,1622424169,9,猫咪喵呀喵11191,2,1562600201504,3,0,太好看了 越来越精彩了
16,537953595,3,風捲殘雲Chan,3,1562600089342,0,0,原来会员周一不更新呀？
16,1186322574,42,妖妖111888,4,1562600069925,2,0,雷佳音演的太好了，怎么演怎么好看。
16,537953595,3,風捲殘雲Chan,3,1562600067332,0,0,同意
16,1565371309,29,我爱吕小雨,3,1562600050931,5,0,徐斌啊徐斌，可惜了
16,1546511876,9,饱满的惠特同学,2,1562600039236,0,0,请问是不是一周更新一集？
16,1143713359,21,素茉茉1492745653944853,3,1562599551983,0,0,周几更新啊
16,1050775272,22,蕾8914094907,4,1562599516210,2,0, 怎么不是每天一集？？？为什么是周四四级？这什么播放方式？
16,1043609983,39,小情绪1479046982746787,5,1562599300849,1,0,俗话说好人不长命，祸害吃千年
16,1136081367,2,311612jp,5,1562599278960,0,0,[怒][怒][怒]
16,838499086,42,海星er1314,6,1562599027711,1,0,好看[真棒]
16,1137888075,43,哎呀妈呀滚,0,1562598752769,0,0,什么时候更新呢？好想看下去
16,630465310,4,蜡笔小新喔喔喔,4,1562598567426,2,0,徐宾的死是不是崩了？就算认识这时也不该如此跟着去吧？还是说前文提到不善于交际的原因？
16,1466709234,100,正常de饺子同志,0,1562598564546,1,0,很良心的剧
16,957098108,22,sunwp998,3,1562598471768,1,0,很多地方情节乱七八糟不合情理啊
16,1494563117,100,焦尔滴公治同学,2,1562598313214,3,0,更新太慢了，我要告诉李必内鬼是谁
16,741711491,21,飝飝91826611,0,1562598206507,0,0,更新还要2个月？好吧，那我2个月以后再来
16,1330868027,100,宋x鲜果,0,1562597828368,6,0,没有觉得元载很聪明吗？一箭双雕了得到了林相的重视还能得到到官二代的青睐。
16,638611498,100,_114943318,5,1562597785667,1,0,太次了
16,1103157489,41,微光漫小城x,5,1562597720524,0,0,崔器气死我了
16,789811838,24,koodnli01,6,1562597712583,0,0,更新太慢，实在不行全出来了再看
16,1469783134,11,爱买住来_2008,0,1562597670311,0,0,更新太慢 不会玩
16,1506690062,17,van小花93705,4,1562597664527,0,0,更新的太慢了……
16,500438115,25,黑暗中的隐士,2,1562597643412,1,0,牛牛牛
16,1046757705,43,圆西圆瓜aa,6,1562597229388,0,0,不是21集来？？
16,1232814443,11,youk07070,0,1562596926468,5,0,曹盾牛x
16,1548657871,22,多彩人生33828,4,1562596878128,4,0,今天不更新？？非会员周一至周五更新一集，会员连一集都没有吗？还要等到周四，？
16,1034836137,27,Xn_n,3,1562596746482,0,0,太子是大boss
16,1167901762,10,bearjiajiabao,2,1562596615872,1,0, 怎么还不更新？什么时候有？
16,1441828217,13,踏夜晨之旅82583,0,1562596551969,5,0,真是不懂，李必都到了，为什么那些士兵还没赶到，感觉这剧还是过于突出猪脚光环
16,638611498,100,_114943318,5,1562596545148,1,0,什么乱七八糟的
16,1019973051,18,讨厌酒却爱上了醉的感觉,2,1562596514872,1,0,啥时候更新啊
16,1106982554,19,欢欢喜喜lyh,0,1562596499626,0,0,会员一周四集，根本看不过瘾呀[勉强]
16,1019973051,18,讨厌酒却爱上了醉的感觉,2,1562596498610,0,0,急死人，更新速度也太慢了
16,327660409,12,夜华一生爱白浅,4,1562596408692,0,0,等太久了
16,331717180,34,frtgdg,5,1562596155254,1,0,还没更新。。。
16,574213368,35,gf4899,6,1562596017410,1,0,请更改播放方式 太难等了
16,1679380835,8,一个亿少女的梦,2,1562595964571,0,0,   我完全没有心态了  这样下去马上我就忘了
16,1217776412,27,ChinPenFe,4,1562595875930,3,0,1天两集周五四集周六日不播可以吗[鄙视]
16,1547083164,23,y守信用de李靖,2,1562595681087,1,0,第一部有美剧的感觉！
16,1709540410,12,de分外写书u宝物,3,1562595178653,1,0,各种好棒，就是更新太慢啊
16,1709540410,12,de分外写书u宝物,3,1562595114398,0,0,慢啊
16,1024541943,3,sc20050354,5,1562595051168,0,0, 说好的一共25集？？怎么又一共48集了？……
16,440974818,36,fengjia821222032,3,1562594950120,1,0,陆三像是个韩国人这发音
16,1516735997,15,活蹦乱跳的小雎宝,4,1562594941770,3,0,十二时辰是近些年我见过最好的电视剧
16,1241853907,29,春竹同志oTo,5,1562594898286,0,0,为什么今天没有更新啊啊啊啊啊
16,579539476,61,li2770,6,1562594848169,1,0,更新太慢
16,381330568,11,青叶之音,2,1562594795447,4,0,更得太慢
16,1727916607,10,郦的守护者酱,2,1562594747556,4,0,徐宾太蠢，跟内奸独处
16,984803386,32,刘语晓18,4,1562594705615,0,0,24集啷个搞出48集来的？又要等好久才看得完哟
16,860661587,34,wuyan584,6,1562594656970,0,0,今天还更新吗
16,1459042493,16,尼卡龙z,2,1562594633753,1,0,哭辽  能不能改变一下更新方式  一周四集  我等得好苦啊啊啊啊啊啊啊~
16,1375576843,7,守护神24335,2,1562594577657,1,0,都十点多了还不更新
16,1726404563,1,de密德尔顿x略微松散,0,1562594529570,0,0,还要7周才更新完
16,1553367921,36,-蓬勃的傲芙,5,1562594239195,0,0,一直以为自己理解错了，拉到最下面大家也一样嘛！更新啊
16,1303886354,4,绿色拼接修身牛仔,4,1562594047244,0,0,什么时候才能更新啊
16,1026650293,22,东莞中航金属---杨晴,3,1562593865862,0,0,请问一下周一不更新吗
16,1037948957,11,jzsjr1478920854133565,2,1562593817810,3,0,什么时候更新啊？一周四集不够看啊！！小鲜肉的表现值得夸赞，易烊千玺跟大神级演技的雷佳音对戏居然不落下风，非常厉害了！终于看到一个认真学习的小鲜肉了！
16,411197712,26,消逝ヤ情,2,1562593350687,0,0,什么时候更新啊
16,1477262455,15,ElliotM82204,4,1562593274184,4,0,虽然很多地方较美剧还有差距 但不得不说确实是用心之作 不管服装道具还是剧情都有长足长进 但更新速度确实有点费劲 纯属消耗我们的热情
16,704377145,20,X瓜太郎,4,1562593259370,1,0,剧集加了一倍，更新可以稍微加一点儿嘛[委屈]
16,1332232765,32,析泽25429,5,1562593004598,0,0,今天有更的没
16,1034640973,86,小虫子_yy,2,1562592564117,0,0,十二时辰能拍三百集的节奏
16,1527011735,18,邵壮25673,3,1562592469446,1466,2,这片的更新速度不太合适，一下子放4集剩下6天完全放空了。不好保持热度。应该两天一集。或者每周一三五七更。这种6天空窗期太毁热度。希望片方好好考虑一下~
16,1440902471,14,shelly720803,2,1562592349008,1,0,强烈建议改变更新时间和集数[太开心]
16,1040979675,52,泥鳅也是yu1478957853415431,0,1562592340172,0,0,看到现在的进度，我以为20集就完结了，居然48集[冷]
16,722370600,16,你嘛12547550,2,1562592277149,0,0,连续看16集，居然没有了但是预报看的也过瘾啊😄
16,1161683485,12,蓝月亮2393858837,2,1562592225291,0,0,搞啥呢
16,1161683485,12,蓝月亮2393858837,2,1562592216866,0,0,周四才更新
16,1161683485,12,蓝月亮2393858837,2,1562592179424,2,0,疯了吧
16,1161683485,12,蓝月亮2393858837,2,1562592172823,0,0,非会员一周更一集？
16,1161683485,12,蓝月亮2393858837,2,1562592146252,0,0,怎么更新的啊
16,1019973051,18,讨厌酒却爱上了醉的感觉,2,1562592135697,0,0,什么时候更新啊
16,438299498,20,婉瑜妈妈,3,1562591991798,1,0,刚看完小说，大boss出人意料！
16,1158897162,51,and布丁小可爱,5,1562591593198,0,0,喜欢这部剧 超级喜欢
16,1036338736,62,tb599842_11,5,1562591578621,0,0,说好的24集咋变48集了？
16,1035453855,20,nima5834230c,0,1562591576008,2,0,有点权游的味道
16,1042430950,49,hap168_2009,6,1562591529535,1,0,为什么周一还不更新？？
16,1388744114,22,吴同志的利奥波德,3,1562591465736,0,0,几点更？
16,1439271849,22,来自东方的少年,4,1562591401710,0,0,这个剧怎么更的啊  是周一到周五每天八点更一集  然后会员周四多更四集么
16,801523092,2,何圓,4,1562591257611,1,0,传令兵是日本人吗？
16,1193476563,43,15549338258通用之,6,1562591248083,0,0,拖了一个小时没更新，是不是周末一分为二剪片子没剪完呐。
16,394754340,43,远行的路o_O,6,1562591235112,1,0,更新太慢了
16,1201333375,11,tb3885205_33,2,1562591218922,0,0,为什么今天没更新！是我理解错误吗
16,920116331,34,l镇定的朱丽叶,6,1562591211869,6,0,虽然节奏太慢，说话慢条斯里，但剧情还算紧凑，画面唯美真实，让人忍不住想看下去
16,1098567223,50,小胆狂徒,5,1562590703611,1,0,赶紧抓紧更新，等的蛋疼
16,926512780,37,WillWillWill132,5,1562590656413,0,0,什么时候更新啊？
16,1720122568,9,安德森尼古拉同学滴,0,1562590602603,0,0,这个语音，有意思  好听 可文雅可市井，
16,1234849011,10,西瓜冰皮皮虾,2,1562590381258,0,0,有点牛逼🐮
16,983047122,24,讨厌苹果的丢丢,6,1562590149015,6,0,这种节奏紧凑的片子不适合这样更新，太慢的，一天保持两集最合适，这点应该向《破冰行动》学习。
16,1230046838,29,雪山飞蜗,4,1562590063218,1,0,怎么还没有更新
16,1033379657,16,杉8963843172,2,1562589801900,0,0,还不更新
16,1722780282,4,马特达蒙de酱以蓝,2,1562589764158,1,0,到底好久更呀？
16,1093979740,15,港岛妹妹88393,2,1562589521649,0,0,多播放几集啊！
16,564443538,45,凝眸万千a,5,1562589424648,0,0,8
16,1508588484,21,李先生46935,3,1562588903300,0,0,这个更新的进度实在太慢
16,1218662152,26,荷笠孤舟,4,1562588828893,0,0,等星期四。。。
16,534848849,100,river_sharon_ma,5,1562588767902,0,0,看完16集了，没片看了，希望快点更新
16,1066312728,12,钱木木1481199737843508,0,1562588699226,0,0,好看死了，大头大头，更新太慢了太慢了
16,1512329375,16,池晓茜,2,1562588570984,2,0,强烈要求改更新方式！一周四集，开了个会员一周就等周四一天更新四集？！
16,1140388275,16,gang4188,4,1562588358672,3,0,更的太慢了，中途有其他好剧，小心掉粉[不高兴][不高兴][不高兴]
16,1140388275,16,gang4188,4,1562588317924,3,0,更的那么慢，小心掉粉哦
16,1722832479,4,1外行滴l菲丽丝格外,0,1562587897646,0,0,20点了没更新吗
16,1372501587,33,啵啵的草妹,3,1562587677840,1,0,等更新
16,611777115,100,大陈和小成,4,1562587524113,1,0,今天没有更新吗？
16,833408106,100,郑小林丶丶,4,1562587366867,1,0,一口气看完16集。啥时候再更新啊[泪][泪][泪]
16,1038102752,15,tangth_tanxiao,5,1562587319558,0,0,怎么没更新？？？
16,1497613399,17,逆流6211382425,2,1562587310190,0,0,今晚更不更？
16,377401652,29,FightingDreamer37492424,3,1562587015551,0,0,几点更新？
16,1059331325,31,路遥知星辰,3,1562586803291,4,0,我不相信徐宾就这样领盒饭了，我不允许
16,1331919020,8,G_Dice,0,1562586657555,0,0,好看
16,361655525,37,哦啊兮兮,6,1562586440337,1,0,希望以后这种好片多一点
16,1052711829,29,Mu苏hua,5,1562586349653,0,0,不是24集吗？
16,1532811304,14,微信用户1535770105954845,4,1562586342300,1,0,每周四更新才四集[汗]，有丢丢少啊[泪]
16,1440425414,24,昔幻57654,4,1562586223300,2,0,周一围演什么都一个样子
16,1641848790,21,香菜同学很轻易滴,2,1562586056879,3,0,更的太慢太慢了😡😡😡😡
16,1222750827,7,雨后彩虹ax,2,1562586020321,0,0,节奏有点慢了，如果多条线，多屏幕穿插会更好玩点，总体还是不错的，加油
16,1725695562,6,安de黑亚当酱,2,1562585711711,0,0,每天几点更新，一次几集啊，谢谢了
16,1143079638,38,Unpredictable_沈温暖,6,1562585195733,62,0,那个传讯兵是把自己的舌头吞在喉咙里了么 这口条 还让他传讯呢 不怕误传么……
16,1145452930,35,guoping5151,6,1562585178342,2,0,今年最好看的一部剧，可惜更新太慢了，[吐舌][吐舌][吐舌][吐舌][吐舌][吐舌][吐舌][吐舌][吐舌]
16,1722280179,2,o新式滴-詹姆斯非常,0,1562585134368,0,0,今儿更新么
16,1152032502,39,阿拉一族y统帅,5,1562584576309,4,0,我说两句，阁下看看理不理！不知阁下听到传通说徐宾媳妇送鞋子给他这句话没有，在古代送鞋子可是关系很好的才可能有的情况，就是放现在，若阁下媳妇能送鞋子给的人，阁下认为那人会杀了你不？？怀疑归怀疑，可也不曾想就会灭口吧！再说单人追车这里，阁下可知当时长安城多大，160万左右人口的城市，那么大的城市，突发事件，也不可能马上有人能支援吧，别忘了，当时也是有堵塞情况的（人家在过节）。放现在哪里突发情况，遇到上下班，信不信随便堵几个小时都正常！加之各方势力牵制，人人自保，不害人已是万幸，还出人帮忙，莫不是脑子瓦特了！不良人又闹崩了！！只是我吐槽一点，就是又不活捉，为何不出刀！莫非带了个刀鞘，唉╯﹏╰
16,1496402675,17,冰雹小路98573,4,1562584448692,1,0,"16集看完了，没过瘾！

"
16,1063834310,14,培城1480848460823484,2,1562584393463,0,0,还不更新
16,990324590,100,年华依稀似水流,6,1562584022994,2,0,林宗辉
16,565490866,17,柳甜甜1234,3,1562583714337,0,0,长安队长雷佳音
16,792999469,11,男人如酒74225881,2,1562583648894,1,0,更新太慢了吧，我受不了啦！强烈要求每天更新！
16,1565095300,11,沛9205682887,0,1562583470166,4,0,作为一个西安人，上面全是我们的地名，金光门，安仁坊，朱雀大街，西市……欢迎来西安旅游！
16,900938834,10,白雪丫丫12,0,1562583346382,1,0,今晚更新吗
16,1336104490,23,意外酱l米尔恩A的,6,1562583320774,2750,1,更新方式能不能重新考虑下，一周四集太累了，哪怕一天两集也好啊。希望大家顶上去。
16,1221385551,17,鲜无名,2,1562583311471,1,0,更新的不够看啦
16,709626005,35,大石头yy,6,1562582817248,0,0,趁热可以考虑出个剧场版拍个电影
16,348613969,33,早知如此绊人心o,0,1562582544984,2,0,背那么多武器，就是不用
16,902085975,36,紫莫林41246,6,1562582429535,1,0,越看越带劲的一部作品！
16,826323803,43,帅大师13936,6,1562582201757,3,0,24集改48集这剧情就有点拖沓了
