,uid,userLevel,userName,vipGrade,createtime,voteUp,downCount,content
12,1481414815,20,东边山下,2,1562144882643,4,0,剧情严谨，演员演技精湛，不像仙侠剧那样幼稚！新的突破，好久没有这种剧了，吸引力够强，让我12集一口气看完
12,339784616,51,宇智波鸣人-,4,1562144875658,0,0,这老吃薄荷叶是什么意思
12,1697327243,8,的凡勃伦y可人十分,0,1562143862513,0,0,更新的太慢！！！
12,1400847091,20,胖粉嘟嘟,3,1562143639894,0,0,什么时候更新
12,1550558899,9,x辛苦的冬日战士,2,1562143149859,0,0,[疑问][疑问][疑问]
12,1247188558,12,卤味芒果干,0,1562142773489,0,0,在线傲娇
12,1401388323,5,就爱小朋友1,5,1562139818726,0,0,我竟然没看懂讲啥里
12,718671856,27,试过好几个电话价格订购,3,1562139668608,3,0,演的最好的是曹破延
12,970662732,21,伤心的人_61,3,1562139601880,0,0,你输了
12,1411677082,35,雪雪的阿心,4,1562138697402,0,0,更新好慢啊、总感觉内奸实际是姚
12,1389653977,41,乐同志的理查,4,1562137982351,0,0,咋还不更新啦那 
12,806142906,21,好好看剧321,3,1562137969037,6,0,非常棒！本来在看少年派和留学，都没看下去被这部勾引过来了！！！看电影一样又比电影过瘾！24集比九十几集的电视剧看着舒服多了！
12,330639768,41,提拉米苏19881201,6,1562137898772,0,0,那些个狼卫简直是鸡肋
12,330639768,41,提拉米苏19881201,6,1562137872337,0,0,越往后面越没意思了
12,903470507,30,优姬酱123,6,1562137738839,0,0,这剧缺乏美女[汗]（勿喷）
12,357752212,24,alex707b,6,1562137614969,0,0,什么时候更新什么时候更新
12,1232239367,54,小火锅在奔跑,3,1562137321494,32,0,就没人觉得谭琪是那个奸细嘛？她有一次不是自己偷偷去翻了典籍还被徐宾撞到了[疑问]
12,941182565,56,tt_3333333,6,1562136948699,0,0,对大头和4字弟弟长草
12,1183044988,32,吃藕丑-chou,3,1562136519940,0,0,告诉我 谁是卧底[泪] 脑子都烧坏了 也没猜出来是谁[勉强]
12,828483652,26,咕噜噜03299068,3,1562135257690,0,0,"喜欢这种制作精良的剧。
电影的画质，紧扣额的剧情，没有口水的时间。"
12,828483652,26,咕噜噜03299068,3,1562135123108,10,0,"能不能更新快点啊！
前段时间看完权游，已经很久无剧可追啦！终于等到这部十二时辰。赞哦！"
12,1469197735,18,强大的安杜因酱,2,1562134881684,2,0,易烊千玺你的发箍太逗了，好想给你正到过来[太阳][太阳][太阳][太阳][太阳]
12,1608154427,9,不易朱雀滴最,2,1562134341124,0,0,咋还没更新啊
12,1370990710,37,忧郁的萨克巨人78380,4,1562133159229,0,0,快点更新吧
12,1407681764,35,动人de道尔顿酱,5,1562132954085,0,0,没事就嚼槟榔，也没记载那个时候谁得癌症了，果然大唐盛世[哈哈][哈哈][哈哈]
12,1430493771,28,小乔流水人家93473,4,1562132770081,1,0,看完一集更想看下集，我滴妈丫，一口气看完12集
12,798921684,70,爱崴脚ZL,6,1562132381885,0,0,太子这是要火骚长安保住皇位啊，心太狠了
12,1334394699,9,无名9112159518,0,1562132193896,1,0,不错的一部古装剧
12,1690893114,4,酱绿色相当滴迪莉娅,2,1562130354495,0,0,非常非常非常好看，我的确未开快进♥小的有一个疑问——啥时候更新更新更新！！！
12,1011244146,16,jjskg23,4,1562130197848,1,0,很难得的改拍电视剧比原来小说还好好看的
12,1029031155,62,亚当斯的丽影,6,1562130006061,0,0,为啥吃薄荷呢
12,434458796,5,青椒肉末斩蛋,6,1562129031454,0,0,制作精良，主演不行，反而配角很出彩
12,753364155,36,君自兰芳98047080,5,1562128472377,8,0,为啥我看到周一围演啥都觉得出戏？！
12,1006094060,50,窜天小樱桃,6,1562128322805,0,0,这更新的也太慢了吧，每天更两集不行吗
12,1173443078,56,清颜8904,5,1562128034808,1,0,太好看了，本来想留一两集慢慢看，结果不知不觉就把更新的看完了[难过]还得等
12,499403409,5,无敌小月321,6,1562127981381,0,0,重复看好几次了 就等明天更新了
12,321182524,66,9_號,7,1562127738736,1,0,好看，喜欢看，非常喜欢这剧[呵呵][爱心]
12,900354234,39,颦颦如婷,6,1562127666230,0,0,一看总集数，该是部好剧
12,1434471493,14,奥利奥是大哥,0,1562127459085,0,0,这是什么神奇的缘分
12,1337917893,50,庭迷,2,1562127205454,0,0,咋还不更新
12,1670146903,11,优酷用户1556790844432269,2,1562127167538,0,0,我觉的这个剧达到美剧的中上等制作水准，剧情不拖沓，节奏明快，细节到位，人物鲜明，一级棒。
12,1209026280,30,郭伟87883,5,1562127071543,0,0,这什么时候更新啊。
12,827575425,70,名堂48224375,6,1562126064253,2,0,不管是服装还是演技都让我焕然一新，近年来难得一见的佳作！非常好看，没有一个地方快进看的，相当紧凑！
12,1230150834,20,封闭货车y二十,2,1562125589908,0,0,坐等更新了
12,774985087,26,DestinyLik,0,1562125474149,1,0,这集开始说不想让李必看到的那几页，是不是他婢女斯了的 因为他婢女之前再找让看管档案的那人看到了。
12,1606789368,18,永远丶su,0,1562125351216,2,0,啊啊啊啊，为啥还只有十二集[惊哭][惊哭][惊哭][惊哭]
12,539048233,55,Meteor1992,5,1562125181534,0,0,一共多少集啊？
12,501844512,39,jdd668,5,1562124905598,0,0,这概要剧透的不错
12,1042815110,37,酷三点,6,1562124666115,0,0,剧情吸引人，画面美，细节控，演员演技在线。👍
12,766601164,19,xueyuan6812356,5,1562123834196,1,0,好看
12,1036569021,24,灵芝草ing1478911601339944,4,1562122730653,0,0,一口气看到十二集  更新完了再看  不然等的心累
12,1039555115,25,hi_lixiaoyu,5,1562120925835,0,0,还不更新
12,1367308291,48,彩玲12010,2,1562120328583,0,0,快更新啊啊啊啊
12,993813535,31,de威尔o_称心君,4,1562118382407,0,0,等不及啦，快更新呀
12,1029634705,33,希拉的休利特,5,1562118217001,2,0,细节决定成败，从道具制作到服饰搭配，从演员对白到动作设计，从主演到群演，没毛病，细节之处见真章，导演很用心，演员很用心，剧组很用心，是当今少有的良心剧。刚发现这个剧，一个通宵一口气看了12集，更新太慢，已经看了两遍了。
12,992104578,17,yi北野的girl,3,1562115598151,1,0,千玺多和老戏骨搭戏演技定有增进，看好你加油[haha]
12,1584610367,15,8侥幸的小狼,3,1562114608132,2,0,为啥就12级，为啥，为啥[不高兴][不高兴][不高兴][不高兴]
12,1334691208,19,吾家懒喵,5,1562114261636,41,0,知道雷佳音演技好，但是越看他剧，越有惊喜感，想不到我的前半身里又老实巴交得让人觉着可恨的男人在这却痞得让人心动牙庠，很期待他后面的作品了，加油！
12,527945456,17,爱啦猫猫宝贝,3,1562113329601,2,0,有点美剧的意思
12,1332916828,19,yuki是尤溪,6,1562112868848,2,0,好看
12,1160559351,28,张伟1495184308547125,0,1562112169817,0,0,跟小说不一样吧！小说看完了。
12,958181822,6,zhiaiyan0608,2,1562109253753,4,0,我觉得这部剧每分钟都不想错过
12,1038714913,14,纳兰大中国,3,1562107851634,0,0,好好好
12,1574974400,100,M妥善滴含蕾,0,1562107459718,2,0,看过书以后再看剧，发现剧一般没有书精彩
12,479426252,37,HH56358244,6,1562095455744,0,0,这拿个白拖毛是太监？
12,1037967410,15,faydemon1478920976516431,5,1562095057519,1,2,越来越拖沓
12,1034598803,36,你的李阿哥,6,1562093137434,0,0,一夜没睡，12集一晚过了。
12,1525961870,7,致密de李子同学,0,1562090071467,4,0,好久不看电视剧了，这剧值得追
12,1461745044,12,池子尹,2,1562089880433,0,0,老戏骨就是不一样，大头的演技好好的
12,985405269,54,L5295249134,6,1562089028085,1,0,人物角色设计太赞，画面质感最佳，场景丰满，思想性很高，世界级电视剧
12,1448534274,13,数烊的丸纸,4,1562088086909,0,0,这剧真的一看停不下来，好希望一次性更完啊！
12,989884360,19,D小调雨后63058,2,1562087853232,0,0,情节还行·够紧凑·画面质感都不错·和美剧反恐24小时相似·
12,1334288126,35,蹭腿猫,6,1562087423421,3,0,道具 服装 美的一批
12,1047607089,23,denganhua6851,0,1562086315235,0,0,什么时候更新
12,1442864665,13,分子分母才是分数,1,1562085386945,0,0,我就问一下啥时候更新？
12,1049339722,20,钮钴禄大头,0,1562085190939,1,0,城墙上打仗的戏是我有史以来看过最好的！包括动画片里的！真的感受到箭阵的威力，箭雨袭来的恐惧！给这部剧所有工作人员点赞！[爱心][爱心][爱心]
12,804907206,35,素叶叶子,6,1562085105407,0,2,雷佳音古装多少有点别扭，不过也挺新鲜。至于某流量的演技实在是让人呵呵。
12,1160243926,24,A直爽的达斯,6,1562085046439,1,0,怎么不更了
12,440225366,58,江诗丹顿w,6,1562084861151,0,0,不更了？
12,1039946452,30,何君jimmy,3,1562084294679,0,0,一口气看了12集，超级好看，期待更新
12,427853622,31,静享微风三月,4,1562084108552,0,0,我就想问今天为啥没更新
12,1617475492,5,亲休谟厉害相当de,4,1562083750574,7,0,好剧 那些乌七八糟 胡搞瞎搞的强太多了。不是拍不出好剧、而是那些眼中只有利益 不去用心的人。赞这好剧、赞里面每个角色演员都用心去饰演各自角色的特色。不管到主演 还是群众演员 就连一个小姑娘都演的人心动动
12,1386994768,36,双龙盘,5,1562083424404,5,0,刚开始的时候我一直以为自己在看一部电影
12,1524182706,24,啥8226662077,2,1562082975441,8,0,易烊千玺这个年纪已经很棒了，但是总是能听见千玺讲词中有sh的，全部都跟刺耳，听着有那么些许的难受，不过影响不大呀
12,1119258888,6,i老练de晓雯,2,1562082952817,0,0,ycz
12,1679469424,18,同志小虾米皇族de,2,1562082392172,0,0,更新啊
12,1074448217,18,汤屁dur,4,1562082083415,1,0,千玺把那种年少便肩负重任，所以一刻都不能松懈，一处错也不能出的紧张感和高压感都演出来了，还有将修道之人的风骨气质也展现出来了，还有神童加持下的小傲娇小高傲都能从小表情中窥见，这点非常可爱，因为李必总共也才是二十三的少年人嘛。总体看下来李必这个人设更鲜活了。
12,1506792514,18,鸢尾花-熊笨笨,0,1562081805661,4,0,一口气看了12集，好看，雷佳音棒棒滴
12,1193371216,34,书生27667,5,1562081713769,0,0,什么时候更新啊，坐等
12,434745590,39,迷茫20647178,5,1562081513328,0,0,更新呢
12,1637969141,16,罗小兮小兮,2,1562080786426,0,0,我想说会员周四更新四集，非会员周一至周五更新一集，那就是会员还不如非会员
12,1358440117,41,于1面包,5,1562080625912,5,0,这个剧有种美剧的感觉，根本不像国产电视剧
12,1358440117,41,于1面包,5,1562080566018,0,0,为什么不更新啦
12,1492621605,34,T温文尔雅的净坛使者,4,1562080298014,2,0,这个编剧也够牛🐮的，一天发生的事，尽然编出了25集，想象力丰富。
12,902501173,27,小猫咪47287,5,1562079869899,0,0,等更新好累
12,1018952221,14,初三15395,3,1562079742321,0,0,啥时候出13集？
12,1508777629,16,MNJ9046065353,2,1562079611456,1,0,好看好看
12,961032612,7,显示陌生人cmm,6,1562078892951,4,0,有时候会突然想写一下剧情的情况，但是过了时间现在想不起来了，总之这部电视剧📺很好
12,1136307533,42,U非常自觉狄龙de,5,1562078635589,0,0,为何还没更新，等等等等等等等[酷][酷]
12,913157736,45,Kevin11159,6,1562078586158,0,0,不是说有黄海波吗 没看出来！
12,861152878,58,持04743136,6,1562078575720,0,0,各种🌈💨上线
12,849918878,3,周徐林娟,3,1562077526630,2,0,毕哥哥真酷，是演员易烊千玺没错了。
12,1221567902,85,V_V贝内特x,0,1562077121602,3,0,为啥我觉得好几个大舌头？又跟我一样感觉的么？
12,388206930,22,何国惠47933,3,1562075687456,0,0,只想问一下什么时候更新？我都三四天没看了
12,1302877014,11,morebiaopi,0,1562075439020,0,0,好剧，坐等更新
12,1674962852,17,欢乐君滴汪汪v,3,1562075367666,1,0,好看
12,1182205556,20,jie5601,3,1562075293765,0,0,我是vip能不能开个vvip给我一次更新完？？？？？？？？？？？？？？？？？？？？？？？？？？？？？？？？？？？？？？？？
12,1182205556,20,jie5601,3,1562075215645,0,0,更新太慢了，急死我了，一集收我6块钱全给我更新了行不行
12,1183639862,23,阿黎梨啊,2,1562075060266,0,0,连崔器都想往上爬保卫长安
12,1183639862,23,阿黎梨啊,2,1562074991418,1,1,可是让我最有意思的不过是长安城里最普通的这些人[大拇指][大拇指][大拇指]
12,1173034041,35,嗯哼哼先生,5,1562074306774,36,0,小乙那集哭死啊！特别是主动暴露自己的那位不良人！就一句“张帅，可安康？”印象深刻！！！
12,332364371,19,伤心的奥利奥,0,1562074297297,2,0,催器越来越可爱了
12,522253723,78,cy11011,6,1562073967239,0,0,难得的好剧，电影的画质，算是国内古装剧的巅峰了吧。。。
12,721654499,40,超70598172,4,1562073854688,0,0,啥意思，会员一个礼拜看四集？还只能礼拜四看？非会员一个礼拜看五集？
12,932612191,51,H牢固de菲丽丝,5,1562073642623,5,1,画质太好，场景太真实，其他古装剧完全看不进去了
12,830470029,37,称赞的金针菇M,5,1562073613494,0,0,一直都不更新，害我开通Ⅴlp来看结果都不更新[勉强][勉强][勉强]
12,942695983,22,老公赫宰,4,1562073378559,0,0,太好看了，快进算我输
12,1383304417,34,滴如来o相近桑,4,1562073194469,0,0,会员是咋更新的
12,1423122019,10,蜀山666,4,1562072985701,1,0,好剧，值得一看。
12,754072535,100,萨菲洛嘉,6,1562072238722,0,0,过瘾
12,320476850,32,装逼王_ZBW,2,1562072089821,1,0,太好看
12,1239145168,50,知难而上酱U贝克T滴,0,1562071902996,5,0,曹破延演技太棒
12,1022158397,45,坎伯兰的朱雀,6,1562071874153,0,0,一口气刷完12级，只是……何时更新啊[喷]
12,1718893534,5,今晚月色真羙,0,1562071694536,0,0,更新更新
12,1142473955,20,何世鑫1,5,1562071472992,0,0,几时更新13/14啊
12,935655090,20,凝眸深处82191,4,1562071254037,0,0,我感觉那个姓姚的应该是内鬼。
12,1323153886,35,我是-地球人,6,1562071229102,0,0,怎么还不更新
12,1616995604,1,华为用户1549695998617759,0,1562071220197,0,0,为什么还不更新
12,1009082617,26,天女-瑜,3,1562071207005,0,0,星期一怎么没有更新
12,1154638809,55,叫我詹大彪咯,4,1562071002732,0,0,为什么不更新，停留在12集好几天了吧
12,1373333252,24,八级风2007,0,1562070622487,0,0,这25集是上部6个时辰   看不懂剧的去看小说先  很烧脑的  
12,1373333252,24,八级风2007,0,1562070320500,1,0,很烧脑的剧  完美还原了原小说的精髓  主演演技全部在线  今年最好剧集  没有之一   给雷佳音点个赞希望更新快点  都看了三遍小说了
12,682687627,18,_83481170,0,1562070269020,0,0,怎么不更新了？
12,1479531807,24,九卿臣jerry,4,1562070130119,0,0,过了八点了怎么还没更新
12,1035190344,7,淘宝clareeeeee,5,1562070088777,0,0,为什么不每天更新啊
12,786264873,20,天弓开舞,5,1562070039007,0,0,整个细节的处理和以往的电视剧相比的确是上了一个新的高度，演员演技在新一代里也的确属于实力派，好看，推荐!顺便问下，13集什么时候播放!？
12,499649486,80,2333688,6,1562069237152,0,2,剧情不吸引人
12,1232131311,44,烊光惊玺,5,1562069017819,4,0,小姑娘嘴太毒了
12,1629972757,20,非常静距离的心疼,3,1562068903190,2,1,非常好的一部作品
12,496226572,35,lingbing007,5,1562067447316,0,0,"咋没更新
"
12,1319214764,10,小孩58868,0,1562067229999,2,0,超级好看啊，几条线都发展的很棒，而且质感很好跟看大电影似的
12,911608549,14,空中飞鱼仔1,0,1562067190333,0,0,怎么这么久都不更新
12,991769948,100,晨曦露YF37921,4,1562066810337,0,0,為什麼只更新到12集，就不更新了呢？
12,465797616,100,JIANGXIAO渔,4,1562066781894,0,0,啥时候更新啊
12,1251682747,20,卢i比顿,0,1562066757069,0,0,为什么没人说不更新的事？？？
12,1251682747,20,卢i比顿,0,1562066715217,0,0,为什么不更新？
12,777535433,11,小小泥巴城里的我们,2,1562066485802,0,0,什么时候才又更新呀[乖]
12,1460472857,66,有为的西奥多同志,2,1562066186591,0,0,什么时候更新？
12,1694640412,18,淡淡1779,2,1562066051350,0,0,怎么不更新
12,913385906,47,暖风吹来淡淡香,6,1562065683818,0,0,更新太慢了
12,554641174,66,TenWordsNotFour-Letter-Word,6,1562065620801,0,0,西晋时的书，是这样装订的吗
12,1319214764,10,小孩58868,0,1562064941279,1,0,超级好看啊，几条线都发展的很棒，而且质感很好跟看大电影似的
12,1203637912,33,名字真难起啊啊啊02317678,3,1562064888917,0,0,真好看！！
12,1203637912,33,名字真难起啊啊啊02317678,3,1562063720069,0,0,真实感强
12,693098027,42,zjylgz,6,1562063540092,0,0,就不能一口气更新完吗？等的可折磨人了！
12,948700258,26,喵喵呜kk,3,1562062881959,1,0,基本演技在线，就连群演也很用心。最最喜欢曹破延，人物形象很鲜活。
12,430131264,3,hidden-man,6,1562062680173,1,0,啥美剧，很一般
12,1039201685,4,痞子-LV,5,1562062368661,3,0,我觉得崔旅帅演成了巅峰之作！
12,1595982336,6,北野今天还爱狐狸吗,2,1562061579745,0,0,周四更新，正好考完试[哈哈]
12,1207360447,27,和汉纳,0,1562061137100,1,0,非常好看  近年古装剧的顶峰
12,834798242,48,wing-磊,6,1562061022170,2,0,口香糖不错
12,1501149484,12,o碎花裙o,0,1562060963122,1,0,赞赞赞，好看的不得了，演员演技都太棒，画面场景看电影一样的感觉！剧情也不拖沓，良心剧[玫瑰]
12,1151042215,86,柠檬绿33175,3,1562060933075,30,0,难得的好剧，有＜＜猫妖转＞＞里的大唐盛事，也有＜＜狄仁杰＞＞里的紧凑剧情，人物刻画丰满，主角绝对的抗得起角色，配角也是绝对的担得住。迄今看到唯一一部能全美显示大唐繁华和落败的电视剧，每集都似电影一样大片的感觉。
12,1536039957,11,长源的阿深,0,1562060329969,0,0,什么时候更新呀！
12,944454902,47,谷恒斌周,6,1562059861876,0,0,在不更新我要发霉了，好久没有这么期待过国产剧了[委屈]
12,354736114,52,分享耳朵,6,1562059636269,2,0,一口气看完的，真是太好看了！
12,1169469553,3,傻乎乎的葱,0,1562058937306,0,0,什么时候更新呀
12,1540173930,37,分散de神奇女侠同志,4,1562058227597,0,0,竟然觉得这个胡人挺可爱的
12,769872065,29,ykapp_lj8lz8xf,4,1562057358070,0,0,更新太慢了什么时候更新
12,1718835420,8,YK一羊,2,1562057000837,1,0,这个剧也太好看了叭
12,1238513954,19,浪里个浪啊xxx,4,1562056521386,0,0,坐等13 14集[哈哈]
12,1334626172,27,蓝蓝蓝蓝蓝蓝子,6,1562056294802,0,0,什么时候更新，多久更新一集
12,1548204967,30,a对称的穆琳,2,1562056278516,5,0,雷，一直喜欢。人物众多，有点吃不消。各个演技在线。都一次看到这样的作品。
12,1470995834,14,小胖44914,5,1562054222425,1,0,我觉得崔旅帅黄渤演电影版的很合适啊！哈哈哈
12,729272339,20,Angry仕Cc,5,1562053516868,0,0,为什么只有周四更新？
12,1385267515,46,YuKi354,4,1562053468741,1,0,高质量的电视剧，爱了
12,456887570,4,阿信传媒工作室,3,1562052935043,0,0,为什么老是看到周一围？
12,338708784,72,2316087,5,1562052488979,0,0,好看的神剧 我真是一点没快进过 希望在出第二部[委屈][委屈]
12,1184480960,39,蓝色的缘分1336,2,1562052368738,0,0,"什么时候更新
"
12,1717172528,100,君正人君子格外u醉易的,0,1562051783366,1,0,喜欢
12,1714432179,8,闾丘滴曼文同志,2,1562051426895,0,0,什么时间更新
12,556410170,37,刘卫玲44674,0,1562051254657,0,0,这片适合翻来覆去来回看，更新太慢，又找不到同质量的电视剧可代替，反复来回看，慢慢品味[吐舌]
12,851018630,32,CIBN_hLOKe5np,5,1562050539924,9,0,这部剧又动了谁的奶酪
12,761515250,45,光之咏叹调皓月,5,1562050251755,1,0,能有周一围可见此剧不简单
12,761515250,45,光之咏叹调皓月,5,1562050093936,0,0,长安十二时辰是什么意思片名
12,761515250,45,光之咏叹调皓月,5,1562050044109,1,0,好剧，
12,1002783019,14,艳111w,2,1562049539268,10,0,"真的超级超级喜欢我家千玺弟，自从看了街舞就圈粉了，直奔他来，果然不失望，记得第一季他对小P说了一句，“斯为泰山而不骄☜，真的惊到我了，这么小的年纪，这么有实力（唱歌跳舞演技智慧聪明善良）都了不得，特别是人品好到爆炸 。单
但是你越好就越心疼你，可不可以对自己好点，放松一下，别太要求自己或者给自己压力，我们都希望你开心就好，不是要求你完美。不要在意别人的评论，自己觉得对的就去做，让自己开心就行。真的喜欢你，也希望你一直好好的。"
12,1015813300,35,彬彬13237,5,1562047587877,0,0,一气呵成追了12集就没有更新了
12,987225556,42,请你吃小烤肠,6,1562047562702,0,0,每次看都是要往回拉的，根本不能快进！
12,1086222465,21,恰似你的温柔丶J,5,1562047538546,0,0,为什么还没更新啊？
12,981999122,38,蜡笔木有小新了,6,1562047503204,0,0,天天等着更新
12,1315131597,37,寿8乐乐,4,1562047395765,4,0,感觉可以多次回看，第一遍专注剧情了，感觉有些细节还可以回放回味下。
12,1315131597,37,寿8乐乐,4,1562047290519,2,0,边看精彩剧情 还能边普及了古代常识，真心好剧，好久没有这么良心的剧了，👍
12,1311267589,29,夏夏smile_,4,1562046870663,0,0,哇，一下全部都更新不好吗，非要等，急死人了。
12,1187591196,30,詹玉军41326,2,1562046656936,0,0,情节不复杂，刚开始几集还能看看，后面落入俗套，我是快进看的。按照这情节，人物架设，演员演技等，如果我评分，最多7.3分。
12,1358352235,23,彩香04387,3,1562046489116,0,0,剧情很能抓住人的心❤，演员演技很好，有强烈的带入感。
12,1246975699,22,爱康康好康帅,3,1562046166511,1,0,特别好看
12,1577687505,22,成都天琪珠宝定制工作室,3,1562046051419,2,0,这部剧让我们真切的看到我康盛景，很震撼！！！
12,1301392639,18,蔡1沙悟净,0,1562045412865,0,0,我都没看懂[哈哈]剧情
12,326928076,17,sophie_chiu,2,1562045294054,2,0,突然喜欢崔旅帅
12,1302360031,16,tttttt6666667,4,1562044602455,13,0,晚上7点开始，一直看了12节，没快进，在现在已经很少看到这么种题材的剧了，各种镜头拍景构图都很棒，群演也都演技在线，真的很用心的良心剧
12,1434456697,33,龙龙宝的小精灵,2,1562044423263,4,0,跟着剧情心惊肉跳，每一个演员完完全全就是戏里的人物，特别有代入感，简直是电影大片画质，一集又一集根本停不下来，所以快点更新吧😭
12,806132959,11,千凌2110,2,1562044004534,1,0,为什么没跟新
12,1548268469,50,清风明玥踏歌行,0,1562043382044,1,0,喜欢易烊千玺所以追剧，结果被剧套牢[赞]
12,1385233153,30,我在四川看熊猫,3,1562043175436,0,0,更新太慢了。。
12,1378505978,18,暮商一八,2,1562043062173,0,0,每天都来看一遍到底什么时候更新啊[吐舌][吐舌][吐舌]
12,1016779169,23,凡夫俗子6603,0,1562042048862,3,0,我竟然喜欢曹破延
12,1065217729,33,呢喃的人心,5,1562041975235,0,0,什么时候更新
12,1601520243,16,十分的合作贝拉米,4,1562041869612,0,0,姚汝能，汝=三女，他是内奸！
12,1535558253,20,mrvincent14252,3,1562041751880,3,0,古装版《24小时》，可以啊
12,449520264,25,__小于,0,1562041575718,1,0,怎么就断更了
12,1199753239,18,蜜糖旋律2010,4,1562040769664,0,0,什么时候更新啊还是只有12集啊啊啊啊啊啊啊啊啊嗄[难过][难过][难过][难过]
12,1152807568,18,巴蓝蓝蓝蓝,2,1562040538142,0,0,为什么都盼着二十五集变成十二集，十二集根本讲不完，除非一集两个小时，两个小时也不够，还有演员场景切换，得一集三个小时
12,1152807568,18,巴蓝蓝蓝蓝,2,1562040484200,0,0,这年头难得碰上一部配角群演都在线的剧了
12,1152807568,18,巴蓝蓝蓝蓝,2,1562040457087,2,0,配角都很出彩
12,1152807568,18,巴蓝蓝蓝蓝,2,1562040380942,1,0,下一季不知道什么时候出
12,1060027870,25,玲漓6407,0,1562040344795,0,0,咋成25集了？不是原来还是50集吗？想多看一点啊[惊哭][惊哭][惊哭][惊哭]
12,1152807568,18,巴蓝蓝蓝蓝,2,1562040284021,0,0,好剧就应该多输出
12,1152807568,18,巴蓝蓝蓝蓝,2,1562040269007,0,0,海外党也可以看啦，开心
12,1152807568,18,巴蓝蓝蓝蓝,2,1562040200585,0,0,焦急等待更新中
12,1690893114,4,酱绿色相当滴迪莉娅,2,1562039105224,0,0,啥时候更新啊啊啊！！！
12,350016726,40,wjyk123,6,1562037912272,0,0,这周啥时候更新啊
12,1149772364,42,詹晨光,5,1562036665422,6,0,服饰，语言，场景九成还原，主演到配角演技在线，官斗与厮杀形成鲜明对比，埋线索留悬疑吊足胃口，近年古装剧的上乘之作，国产剧如果都这么用心谁还去看美剧！
12,1423964737,30,Y相当冰凉惠勒de,5,1562036541771,0,0,更新太慢了  等不及
12,330207164,57,waiqi0108,7,1562036365028,0,0,什么时候更新啊
12,1047758873,34,高美玉01,5,1562036317567,6,0,以前都是我因为电视剧喜欢一个人，现在因为一个人喜欢电视剧。过一两年就记不住演的啥了。
12,1521522907,4,陈美娟35384,0,1562035961364,0,0,值得守护的收视率，买会员
