,uid,userLevel,userName,vipGrade,createtime,voteUp,downCount,content
12,1132847959,28,Fly1nSky_,6,1566127267200,1,0,"真的是太良心剧了 从群演的装到布景 太用心了
"
12,603319378,21,非常烦没有空,5,1566127011800,0,0,打卡
12,1069260700,12,乾道智库,5,1566119654569,0,0,绝对的里程碑大剧
12,1069008927,44,功夫宝贝008,6,1566112138803,0,0,表示看不懂
12,1734276063,5,de锡西w特不耻下问,0,1566109177977,1,0,就不喜欢闻染，好作
12,1683380635,7,吕文泽曲芳欣,3,1566109051513,0,0,哈哈哈个
12,365655740,50,嘿你的益达82595721,6,1566107878886,0,0, 还行吧
12,1498993212,4,晶莹埃尔韦拉的分外H,0,1566102769292,0,0,是一部真正的好剧，但是剧中人物对吃的车西如水盆羊肉等频频出现，感觉有点硬推赞助，拖低评价。
12,1035574028,16,沙漠浪子0007,0,1566096498225,0,0,长安，真实写照应该不是这样的
12,1035051239,48,说好的菇凉去哪了,6,1566095321909,0,0,，
12,1025494947,14,zsj1994060554994,5,1566092214289,0,0,。。
12,618461654,6,↘凝芸冰澜,5,1566088809937,0,0,良心剧
12,1718469552,6,滴秀才天行者同学,1,1566078938766,0,0,真的好看(｡･ω･｡)ﾉ
12,822203638,11,褪下戒指大胆前行m,0,1566057018411,0,0,不错
12,364968293,17,寥落的秋风,0,1566053179387,0,0,这个剧好看，不是，也不止是两个主演，是所有演员，特别是配角门的努力，我都看见了，我都记得[呵呵]
12,603319378,21,非常烦没有空,5,1566050763971,0,0,打卡
12,1216781325,18,kecoqinqin,5,1566050672721,0,0,👍
12,1538965355,4,-悠闲de格格,0,1566045865690,0,0,加油易烊千玺[大拇指][大拇指][大拇指]
12,1335619751,17,诺伊斯宿0,3,1566045174312,0,0,我也看的糊涂
12,1081530241,9,Koko99573,0,1566041098867,0,0,不认真看就有点懵。不过是考究的剧
12,1300087213,14,双全85830,1,1566038129578,2,0,靖安司的大数据用得不错，服务器配置高速度快。
12,1221903149,48,王思宁60988,5,1566003022195,0,0,我来领奖品了[啊]
12,1621467474,26,氵斿龍戲鳳,2,1565984032038,0,0,...
12,786259060,3,wangyouzhe83,0,1565963927969,2,0,千玺这孩子眼神透彻一身正气，比那俩小子强太多
12,836461779,45,我不是故意的850,6,1565962801550,0,0,[大拇指]
12,686555388,4,小煜煜的娘亲,6,1565962108476,0,0,我为什么看不懂
12,1224031285,24,小小槿榆,3,1565961585384,0,0,。
12,603319378,21,非常烦没有空,5,1565960242613,0,0,打卡
12,1753488137,5,的斯特朗枸杞亲,1,1565956931215,0,0,非常好看
12,1704885732,10,君娜娥迷基托的,2,1565945328967,0,0,超级好看
12,1346073639,20,月9051223350,2,1565936355763,0,0,[真棒][真棒][真棒]
12,1692689853,10,滴分外真诚1锡特尼,2,1565933964537,0,0,在
12,1742574294,6,销魂朱莉安娜过于dem,0,1565929998526,0,0,打卡
12,591641452,50,朝日山乘,5,1565928741973,0,0,一共48集，每集30分钟左右的正片，正好十二时辰。
12,1050504568,7,刘佳1479453047986499,0,1565924862483,0,0,牛批牛批
12,964339720,100,微风ld,3,1565917752340,0,0,不错
12,603319378,21,非常烦没有空,5,1565879167535,0,0,打卡
12,1435132257,6,逯o瓦特,1,1565868580918,1,0,锤子为什么掉不下来？
12,691730659,8,栗壳子万花筒生活站,0,1565859270666,0,0,为什么看到第12集的时候，对它的完美感在闻染这里中断了呢，哎，谁能哄哄我吗[汗]
12,1491311015,18,梦啊梦04330,3,1565841466178,0,0,看的很费脑，不过剧情不错的
12,1111008100,11,的章荣耀同学,0,1565836592274,1,0,看了十二集了，唯一的遗憾就是打斗场面欠缺点，其它完美！
12,1090750498,5,何立洋94924,0,1565795450341,0,0,娱乐圈整治是有效果的，不希望一直直看到那几个霸占荧屏
12,603319378,21,非常烦没有空,5,1565787605606,0,0,打卡
12,1020055421,9,不念过去不畏将来74000,2,1565782868102,1,0,他们总嘴里嚼的是什么东西
12,405712248,48,holle一诺君,6,1565768772952,0,0,大结局脑洞狠大
12,460458230,3,shijiugong72195,1,1565752812557,4,1,卧槽，那个苹果耳机的广告不静音过不去了，总是把我手机上的siri给叫出来，然后一直重复[汗]
12,759234032,100,王柚柚zz,2,1565746932090,2,0,千玺好帅
12,951869639,44,243826850博博,6,1565721192169,0,0,。
12,1456876211,6,顾桑de斯內普,0,1565714704795,0,0,这是我至今为止追过的最心累的一部剧。[冷]管你头痛不头痛就是头痛。
12,1456876211,6,顾桑de斯內普,0,1565713294064,1,0,开了最小倍数，还是念得贼快，而且还听不清，还得不停地按暂停，心累，我看个电视剧容易吗[疑问]
12,1524400387,18,壮烈de银饰桑,0,1565695404798,1,0,这是电影吧？
12,1524400387,18,壮烈de银饰桑,0,1565695249556,0,0,看了晚上不敢睡觉
12,603319378,21,非常烦没有空,5,1565690581913,0,0,打卡
12,1316561461,6,tb50650796,1,1565674431431,0,0,其实这个两个狼卫本性还是善良的
12,1515995669,38,秦余磊66,0,1565664108547,3,0,怎么昨天看还是9.0评分，今天就成8.9了……
12,934049138,62,哈哈就是呵,6,1565658346372,0,0, 啦啦啦
12,1190899631,10,的云冰蓝桑,4,1565626866277,2,3,还里程碑十二时辰  足足演了48集  那么多内容12时辰  首先名字跟内容都不符
12,1029209165,7,风停了雨还在下1478262525115403,0,1565621880805,0,0,你还有
12,1029209165,7,风停了雨还在下1478262525115403,0,1565621824625,0,0,好看吗
12,1053666825,9,无恙然安,1,1565617571495,1,0,为什么结尾不让谭琪和张小敬在一起、为什么不把王和元杀了！还是要有始有终
12,455426372,14,云水谣_YSY,0,1565616750225,2,0,编剧一级棒！制作班底一级棒！演员一级棒！
12,455426372,14,云水谣_YSY,0,1565616681839,3,0,古人用来清洁口腔的东西就是薄荷叶吗？哈哈哈，也就是现代的口香糖啊！这剧真好！让我们了解了一些真实的古人生活方式。
12,593231453,41,贱贱的糖宝,5,1565615607370,0,0,🙈🙈🙈🙈
12,1502004845,13,lnimfinite,3,1565614269324,0,0,还可以！
12,603319378,21,非常烦没有空,5,1565611616328,0,0,打卡
12,1069518289,100,網名難產中,3,1565608452852,1,0,好看！
12,1036694081,15,linaliwen1478912783065407,0,1565607425167,1,0,好看
12,1543617186,4,杜bomer,4,1565604854521,0,0,！！！！！！！！
12,1530973659,5,xi玺你成疾,0,1565595754924,1,0,为千玺打call
12,1044201791,58,渣人不渣,6,1565590293459,0,0,1
12,1199610754,17,写实滴兰花,4,1565549322075,0,0,曹什么这个他们的人才傻，好可怜
12,1714046876,21,好爱烊烊,0,1565535700177,1,0,这部剧真的很不错  本来是因为烊烊看的这部剧  想过会不错但还是惊到我了
12,327424297,7,马德里的小鞋匠,0,1565526778464,0,0,挺不错的
12,1378504402,20,过火de老王,0,1565523325249,3,1,都是一群被所谓的信仰和愚昧坑了的人
12,1378504402,20,过火de老王,0,1565520636800,1,0,这帮人嚼的薄荷叶可能是阿拉伯茶
12,1758328674,4,H急性dei靖雁最,0,1565518210543,0,0,所以说徐宾是好是坏啊
12,1055627835,18,tb2461109_2012,5,1565511956118,0,0,12集坐几个胖子中间是用屁熏吗[勉强]。
12,1441014205,11,油菜籽8585,0,1565506400155,0,1,这个闻染死不足惜
12,1441014205,11,油菜籽8585,0,1565506232447,0,0,感觉这些狼卫都是傻子吗？被这个利用完被这个利用的。
12,1718386044,2,宛儿de君守望者,0,1565505382336,0,0,看了几集感觉还行
12,603319378,21,非常烦没有空,5,1565498071395,0,0,打卡
12,322023050,60,broken198458,6,1565485435829,4,0,一部没有必要挑刺的好剧
12,1163336559,25,black先森任纪元,2,1565463511506,2,0,用人挡风，大哥你真会玩啊😄但那人排气怎么办[勉强][勉强][勉强]
12,1163336559,25,black先森任纪元,2,1565462961063,0,0,狼卫那帮人怎么跟个野人似的
12,437284292,23,陈味儿oba,0,1565458575781,3,1,这个周一围演戏演的过头了吧，总感觉有点自以为是的亚子，不是演技不好，就是感觉演的太用力了，很让人出戏
12,1045284687,10,兰某某妞,0,1565455534745,1,0,所以是不是这里每个人都有自己的小秘密
12,1199482265,10,莎娃79869,0,1565449565036,0,0,还狼卫。
12,603319378,21,非常烦没有空,5,1565446180582,0,0,打卡
12,326348974,6,44933欣赏美,1,1565432361538,0,0,画面很美，但剧情有点拖沓，二十多集就好了
12,421084071,100,孙超30342,5,1565412437890,1,0,片没想象得那么好
12,858967881,26,买辣条的大帅比,5,1565407189709,2,0,长安跑酷？？？
12,1106779875,20,李褚天昭,4,1565406796782,2,0,公子，等着吃饼啊，吃了饼，好做梦[滑稽][滑稽][滑稽]
12,1093351336,100,抗原决定族,6,1565403041008,0,0,好
12,1750184900,2,_紧迫的1胡椒极其,0,1565366320531,5,0,一天24小时，一集半小时，正好48集，12时辰
12,603319378,21,非常烦没有空,5,1565348596491,0,0,打卡
12,1578724006,6,轻闲的沃尔特酱,0,1565345274652,1,0,他们吃的什么
12,1471908692,22,m月牙m,2,1565331463558,0,0,我儿王腾有大帝之资
12,1494320961,26,xap_0609,4,1565318375624,0,0,ᵎ(•̀㉨•́)و ̑̑ 加油
12,1469785724,1,妩娘姿,0,1565316826994,3,0,有种看电影的感觉，太真实
12,1749852977,7,哈姆雷特略微deA冰肌玉骨酱,1,1565316365602,2,0,不错，都很好，千玺年纪小，这样很不错了
12,1046928381,27,叶凋零1479257921601646,6,1565282233555,3,0,好喜欢曹破延
12,1201655211,100,潘妮的林德伯格,4,1565281298318,4,0,一天的事情能编电视剧四十多集电视剧，人才啊
12,906017169,43,崛起的雨寒桑,5,1565254649732,1,0,堪比电影大片[花心][花心][花心][花心]
12,748690099,5,T于密德尔顿,0,1565244174930,0,0,有毒
12,748690099,5,T于密德尔顿,0,1565244144043,1,0,那个太监有毒
12,591473375,41,你是我的小幸运哦,6,1565238423971,3,1,画面很好，良心剧，加油我的易烊千玺！
12,1225467054,8,-困苦de黛娜,0,1565236666018,4,0,这个胖妞演技好好，感觉很灵动，神印也好听
12,1225467054,8,-困苦de黛娜,0,1565236568335,8,1,李必和檀祺的感情戏演的很好
12,1175403735,18,wanglina43883,1,1565235542030,8,2,只有我觉得狼人曹破延他们太可怜了吗 真不希望他们死
12,1494320961,26,xap_0609,4,1565217296233,0,0,|｡･㉨･)っ♡　喜欢你♪
12,1738200643,11,酱蓬勃极x半梦滴,2,1565189104914,5,0,大唐牌口香糖的吃法真豪迈
12,1712746027,4,m浓厚dem莎柏琳娜略微,0,1565185759328,2,0,什么时候都有坏人哈，不对，是恶人
12,1370235400,8,翔9170800294,2,1565176861085,2,0,怎么我看不了第12集，你们正常吗？
12,1612605467,9,暗黑l越发寄灵滴,1,1565156013174,0,0,"双锤啊 骨朵是龙波那个是 铁
骨朵"
12,323472848,48,左岸青春右岸年华,0,1565152193699,0,0,12
12,816702500,4,曾经陆军,0,1565148856807,3,0,这部古装我要评论10分[真棒][真棒][真棒]
12,1494320961,26,xap_0609,4,1565135838800,0,0,ᵎ(•̀㉨•́)و ̑̑ 加油
12,1237353035,23,随波逐流16086,4,1565122861682,8,0,什么是电视剧中的大片，这就是！无论是细节，服装，场景，色调，特效，情节，大小演员之演技都堪称完美。那些所谓的名导们可以回家洗洗睡了，不需要你们超越只需要你们达到这部剧的水准就行。
12,1577698221,5,老吴很的0特别君,2,1565119970044,2,0,阿细太瘦了 也不笑 看起来并不开心希望拍完戏被善待
12,1193611116,25,校庆wang,0,1565113965732,4,0,作者可以把十二时辰描写的这么细腻，天才。
12,1093351336,100,抗原决定族,6,1565099902711,0,0,好
12,353829248,20,好聚莱衣柜夏冠业,0,1565099284199,0,0,6啊
12,1747545693,7,酱灵敏过于1胡椒的,0,1565094779019,1,0,張小敬可真是有本事！就連永王都得遵命！
12,1747545693,7,酱灵敏过于1胡椒的,0,1565094704700,3,0,胖胖的小丫鬟都演的如此好！真是精彩！
12,1188011534,11,玥瑤69145,0,1565093904075,1,0,十二个时辰过得好慢
12,603319378,21,非常烦没有空,5,1565087553228,0,0,打卡
12,1196307947,17,张田田1212,0,1565083130030,0,0,徐彬是主使
12,1079753646,17,岑丝柏凌1,0,1565079666919,0,0, 为何要吃薄荷叶呀？
12,1695498337,7,惜雪沃纳同志de,0,1565069479868,15,0,这片子不拍成电影可惜了，无论色彩，取景，音乐，演技无可挑剔啊，每集像看大片一样，这剧应该放电影院轮流播放
12,1732313707,10,审慎南莲特dea,0,1565056055863,2,0,千玺这小东西演技还挺好。
12,340828727,21,错过蓝天,0,1565051950848,2,0,放了我张小敬的人：我可能另有其人，不是指张小敬
12,1175408147,26,dandan08468989,0,1565021948935,7,0,我以为琅琊过后再无古装剧 还好没错过
12,763914767,35,欧阳的晋同志,4,1565013025684,4,0,千玺缺乏微表情
12,1754570298,3,de极其任性长老同学,0,1565010516810,1,0,跑了一条街了，就没个官兵吗？
12,603319378,21,非常烦没有空,5,1565002655804,0,0,打卡
12,1038814332,13,198905qin,1,1564980425126,4,0,细犬 哮天犬元尊
12,1688939151,4,de艾谱莉百里酱,1,1564974913829,2,0,真乃神剧也
12,1730182462,10,麻de杜达同志,2,1564964190234,2,0,好想把崔器嘴里的东西弄出来，看着真难受啊，口水横飞
12,1315550517,25,漆雕M露比,4,1564963783195,0,2,里面女人的化妆一言难尽，跟RB艺J似的，唯一看不习惯的
12,1549802644,8,cloud06506,1,1564936377363,2,0,崔器这人真是。。。傻的可爱
12,603319378,21,非常烦没有空,5,1564929963026,0,0,好看吗
12,1366727764,12,紫罗兰69944,0,1564910260322,0,0,不能下载怎么回事
12,1145204335,100,Walter大飞,0,1564906604182,0,0,还不错
12,1711398537,35,忧郁黄花菜越发dea,0,1564851487936,6,0,真的是制作精良，服化道真的没的说，是这几年里我见过最最用心的[大拇指][大拇指][大拇指][大拇指]
12,1093351336,100,抗原决定族,6,1564846466881,0,0,好
12,1579130763,2,帅麦兜48996,0,1564844745118,2,0,闻染真的死了吗
12,1042766665,13,twinklestar0121479018484000241,2,1564827842699,3,0,为什么要嚼薄荷叶子
12,349388410,100,sunviking88,0,1564827538109,2,1,实在受不了易烊千玺的哨音，真让人出戏[吐]
12,1666803966,9,协调同学de夏侯l,0,1564798853070,3,1,这个崔器挺好的
12,1046310455,17,kakawenzi,0,1564762595813,1,0,不知道从头到尾，张是为了保护长安的百姓还是闻染？
12,687250679,14,忽而秋凉,2,1564758949825,3,1,简直就是翻版的美剧《24小时》
12,1525580473,13,T-T同志索尔,0,1564755086563,1,0,看的我都不想有大结局了（虽然也期待吧！太好看[勉强][勉强]）
12,1743052524,23,易唯意,0,1564752442985,19,0,崔器之所以让你讨厌是因为他演的好，他可以带动你的情绪，而且这是剧情
12,1748628243,7,花儿别样红吧,1,1564752334200,1,0,好剧！！
12,1354080839,16,平稳de冬儿,2,1564747263321,6,0,这部电视剧剧非常好看，从演员的演技，到服装，场景等都很棒
12,1720430064,8,喝着肥宅说减肥,0,1564742873374,6,1,爱死千玺
12,1510573999,12,T寻常de小梦,2,1564742558928,2,0,良心剧
12,1243253835,16,成4711930616,1,1564737250950,4,0,说实话，太棒了，好久没看过这麽好看的剧了
12,1749419556,5,滴帕梅拉U很零碎,2,1564734800016,5,0,有时候一天的时间里真的会发生很多我们意想不到的事。[啊]
12,1037838293,6,樱花君309,1,1564734364398,2,0,永王是李璘？
12,1217878492,54,夏普桑8,5,1564718374995,5,0,这个小胖妞太逗了，哈哈哈
12,1330600331,10,莎6530616472,0,1564714103646,1,0,o
12,1650095111,49,泡芙小姐0670,2,1564712312724,1,0,[哈哈][哈哈]
12,735342721,62,松柏常青树,6,1564711955965,4,0,片尾曲太有感觉了。
12,1533718547,8,a明快de夜山,4,1564689757575,5,0,感觉整个主题得到了升华，很好
12,735244028,51,CheanaSpring,6,1564675863376,5,1,现在的年轻演员都没有表情的哦
12,852946964,17,玫红的妮妮,5,1564663173735,2,0,刚看完小说，再来追剧，改了不少
12,1381357167,7,干同学de伊娃,1,1564661298056,6,0,国产剧终于上了新高度，值得追值得捧
12,1421463407,37,小莉和小新,1,1564650380283,1,0,好好好
12,796896294,23,付阳衡,3,1564633452954,4,2,好喜欢闻染觉得她是个团宠 龙波也很宠她 可惜那个不男不女的是个艾斯比
12,796896294,23,付阳衡,3,1564632770690,2,0,看这一群大老汉 一个个可爱傲娇的样子
12,1591261253,16,梅花飘雪轻舞,4,1564629670686,2,0,很有悬念……值得看下去！
12,860438969,24,没事就晒晒太阳吧,2,1564618937218,5,0,除了周一围，每个演员演的都很好。
12,1170774988,26,曹虹戴,4,1564606215917,1,0,积分
12,1593739939,9,某力73135,3,1564588154162,7,0,主要人物中曹破延也太惨了吧
12,783788782,29,ykapp_q4jj3l92,6,1564583017286,5,0,拍的不得错，难得这么用心慢慢看的电视剧[大拇指][大拇指]
12,1532866058,9,锋利de休谟君,2,1564578575804,1,0,演虎奔军头那个人的，表情太不自然了，演技太差
12,1254494576,5,总而言之68495,1,1564574922474,1,0,完全看不懂，但是总觉得高大上良心剧的样子
12,1744005087,7,吗咿呀嘿886,2,1564572681690,0,0,为什么跳播？
12,1716124395,14,社会我必哥人狠话不多,0,1564571778368,0,1,我攒了十几集 现在看起来[爱心][爱心][爱心]
12,1055909927,32,limi不白,5,1564550189928,3,0,阿细小可爱
12,1531488786,11,mockingjay93960,2,1564546689235,199,0,突然有点可怜那两狼卫，家乡没有了，不能回家，兄弟都死光了，看到狼王卑躬屈膝的样子，信仰都破灭了，只能被人利用，等死
12,1742970516,5,de相当荒废休谟亲,2,1564538770927,0,0,跟小说不大一样
12,1715674992,15,de李顿-越发文质彬彬,2,1564527476000,2,0,很好喜欢特别喜欢大脑袋[爱心][爱心][爱心][爱心]
12,1170774988,26,曹虹戴,4,1564516140452,1,0,积分
12,832843644,23,qzuser33715033,3,1564506573638,0,0,好讨厌这个姓姚的人，软弱，就知道仗势欺人
12,1490362341,5,盈创电气,2,1564505942671,2,0,只看千玺？
12,429534884,82,Coca--Cole,6,1564494425014,0,0,一共多少集
12,1095097328,46,海洋1485055188614263,6,1564484892569,9,0,我喜欢檀棋
12,1234990442,7,旅行大人kw,2,1564472608107,5,0,七月最好的，也是近年来的好剧，都是些好演员
12,1728392822,5,滴奥德丽h极其诚挚,0,1564464334721,6,0,千玺弟弟真是让人刮目相看
12,1602379710,4,大圣陪桃花,0,1564457009330,0,0,王凯真帅
12,1722295790,8,桑守信用十分y油条de,2,1564455500186,7,0,这剧看的，眼睛不敢离开屏幕都[泪]害怕跟不上节奏[勉强]剧情紧凑，不错噢[吐舌]
12,1319719461,18,DemonDior,0,1564417894666,101,2,千玺虽说年轻，但在演员这行也算到了一个平均年龄了，张国荣刘德华谁不是十几岁就开始演戏，青涩是应该的，毕竟初出茅庐，但希望大家可以不要瞎捧，高帽带多了容易头重脚轻晕头转向，让千玺保持这份踏实吧
12,1377180822,21,商8悟空,0,1564410882494,14,1,闻染演的太矫情了，看到就烦😡
12,1377180822,21,商8悟空,0,1564410804376,20,0,觉得闻染好讨厌的点赞[怒][怒][怒]
12,803542911,50,Harley65299634,6,1564409662856,42,1,除了道化服制作精良剧情紧凑不拖沓，真的想为长安的人设打call，一个痞子英雄有他的性格处事瑕疵，远比一个圣母婊更能引起观众共鸣，哪怕反派狼卫也能为了家人去付出牺牲，每个角色都很立体很真实，真的比大多数影视剧里面的圣母女主霸道总裁好太多。
12,1711905570,5,陈大大陈大西,0,1564402393062,5,0,超喜欢这部剧，很有感觉
12,1039351905,25,涂鸦上路,5,1564401072126,2,0,啊啊，崔器真的猪队友，珍爱生命远离猪队友
12,1150984519,23,jindan7810,0,1564399487529,1,0,谁是叛徒？
12,415096866,11,彗星袭月咋1,0,1564398063059,1,0,为什么人这么少？
12,1332161598,8,秋小漠614,0,1564383339088,2,0,被亲爱的热爱的吸引了过去，现在我又回来了
12,1708096916,11,新型冉斯登非常的l,0,1564370159874,16,0,挺喜欢那个曹狼王的演的很不错！其实那些狼王性情都挺单纯的，就是被骗来着还没了兄弟
12,901863406,52,蓝云片片98908,6,1564327188572,4,1,易烊千玺不适合演这么大的角色
12,1426201587,7,马大姐50551,0,1564318069190,0,0,只有我一个人总是没有大木么？
12,1049437241,19,wangjianqun88,5,1564316740063,8,0,"演员在年轻演员里算演技也不错，大坏人和何监演技好，制作非常好，看了十多集了这个雷佳音总是胸有成竹的但是没觉得哪好，易烊千玺这么小演的真不错，已经有自己的特色了，以后应该会非常有成就
"
12,1049437241,19,wangjianqun88,5,1564316498473,5,4,琅琊榜剧情比这个好，演员演技比这个剧好，
12,1525442950,79,天诛地灭修罗,0,1564315521732,0,0,我就想知道右相是谁啊
12,1437443797,8,清新小院58036,0,1564310514909,1,0,这个倒霉催的实在恨人
12,1093351336,100,抗原决定族,6,1564309165084,0,0,好
12,1037440537,100,松松1478917892413952,0,1564297326061,5,0,何监也太牛逼了 算到了 把锅丢给了右相
12,1700376677,14,abcde_33643,0,1564292920107,4,0,大都是演技派，所以看的好看，提高了电视剧的档次
12,1719335352,11,忆香新星同学的,0,1564289579694,1,0,大唐那会儿纸张流行啊
12,1348405507,75,U奇妙de靖雁,1,1564278260619,13,0,狼卫要是谢顶了不是要难过到自尽
12,518412307,29,切粉哇卡卡老爷,0,1564278141624,1,0,追剧
12,1050215459,23,方兴未艾1479438808407772,0,1564272435424,0,0,十二时辰剧情太漫长了
12,322334966,2,昵称_昵称_昵称昵称,6,1564254525464,3,0,最真实的电视剧，太棒了人性就要这样，可惜生活的时代不好，，，关键是，学了好多东西
12,1017373284,13,bcxmm_2006,0,1564251940596,2,1,"大唐版24小时。像极了美剧套路,"
12,1519566090,81,你的慌慌w,0,1564251724186,2,0,李必小狐狸洗脑大神哈哈哈哈
12,1014961605,4,冰蓝蔷薇96083,0,1564244400446,5,0,元载的那个小丫头有意思
12,1474297345,100,豌豆猫子,2,1564243995773,3,0,这里面都是实力派，雷佳音和谁演，谁萌萌达
12,1045700150,11,诚然有意1479205927098319,0,1564239999680,2,0,有个小疑惑，古代秃顶的人的头发是怎么弄的？
12,1179374761,55,八里台亨利,6,1564234343422,3,0,哈哈哈哈哈 那个薄荷叶是口香糖啊……
12,1321650548,28,滟滟涟漪,0,1564215574025,43,0,一直以为易烊千玺只会唱歌，没想到演技也是666，雷佳音都看不出前夫的痕迹。好的演员不是演什么像什么，而且演什么就是什么。为这部高质量的剧点赞！！！
12,1218712012,5,大大魔妮555,0,1564214875304,1,0,超级好看了
12,1305885388,18,葛x守护者,5,1564209795528,0,0,我就想知道，这片尾曲有啥好听的？词呢？
12,419573689,55,璜芼吖頭ORZ,6,1564206909907,0,0,很好
12,709059950,37,花雨Alice,0,1564204247234,3,0,我喜欢小胖妞 想抱抱
12,1345358734,19,郎罗伊T,0,1564202604731,2,0,八品官就能请人给自己取暖了？
12,691824878,19,璐璐24221,0,1564193370258,0,0,好看
12,360584979,40,Nero99635104,0,1564192979463,0,1,元载是申公豹呀
12,518412307,29,切粉哇卡卡老爷,0,1564190482413,0,0,天天追
12,949527717,14,阿湫9,2,1564153344867,4,0,好气啊啊闻染居然跳井，我连忙百度查，哈哈哈，没死有暗道[吐舌][吐舌]#你对闻染是爱还是恨？#
12,518412307,29,切粉哇卡卡老爷,0,1564150068952,0,0,天天追剧
12,821495173,10,有時候兒,2,1564144063783,1,0,闻染  是活该呢  还是欠呢  还是贱呢
12,783589130,17,秦玮超,4,1564137997273,2,0,他们嘴里嚼的啥呀
12,1208863687,6,Tim满哥,0,1564132609583,0,0,这元载出现的意义在哪里？
12,1093351336,100,抗原决定族,6,1564126961462,1,0,好
12,335267306,66,冰天血玥,6,1564124723598,0,0,确实拍的好！
12,853721429,27,张正82456729,6,1564122609788,1,0,一星期更新六级，质量还这么高
12,350396650,67,独孤遥Lilin,6,1564121426251,1,0,狼卫好单纯。[鼓掌]
12,1547735600,18,多吉格桑花,2,1564119880311,15,0,我老公问我，你在看什么？我说，长安十二时辰，他说，新出的电影？我说，电视剧。是不是画面很电影？他说，是，以为你在看电影。
12,1599841407,17,888霖888,2,1564114232851,0,0,很好看
12,1710036072,6,普兰极滴i美丽桑,0,1564113705879,1,0,个人觉得雷佳音身上有点张嘉译的影子[滑稽]
12,1741868279,6,基努略微的o威武桑,2,1564113336515,4,0,目前就看到第十二集，周一围的演技霸屏，很深邃，雷佳音演技也一直带动着，某些细节还可以再精雕。千玺弟弟还有进步空间，角色还不够稳，这个跟年龄有关。
12,797703004,2,冷卉壮观的亲,0,1564096395489,2,0,雷佳音除了皱眉就是撅嘴，痞气十足但是没气场
12,367055256,67,易图易图,7,1564072850888,0,1,[花心]
12,1042087918,15,君善解人意太i托尔de,0,1564071569146,1,0,每天追一集
12,1238330303,9,鸭扁兔33980,0,1564069864794,0,0,为什么每集的预告都这么刺激？！
12,570989916,7,云南枭雄户外,4,1564067955206,1,0,可以的
12,1095003570,41,Catgl,0,1564065207724,4,0,为什么都要吃薄荷叶
12,851996645,26,52972638a,0,1564065143623,0,0,他们吃的那什么什么叶子？
12,1399235330,31,佛系佛系很佛系,4,1564064392115,21,0,长安十二时辰真的是不错的剧啊！很好看。从演员的选择，剧的本身，服装啊，画质啊，主要还是有演技的演员。千玺的演技还是不错的啊。当时拍这剧是他最忙的时候了吧。现在中戏上学的他，演技可以有了更大的提升[呵呵][呵呵][爱心][爱心]
12,816963888,45,熊生生986,6,1564063720086,1,0,好剧
12,797971759,20,杠精必须斯,2,1564062348873,0,0,哎
12,1576128887,25,天山雪莲0401,0,1564062320320,0,0,(=^▽^=)
12,1438558621,10,wzmsld66,2,1564061591645,3,0,我擦，48集也太夸张了吧
